id,name,birth_year,birth_city,profession,bio_text
3971,Георгій Юрій  Давидович,1945.0,"м. Гомель, Білорусь",співак,"(19. 07. 1945, м. Гомель, Білорусь) – співак. Заслужений артист України (1995). Закін. Київ. інститут культури (1978; викл. А. Мархлевський). Від 1964 – соліст вокал.-інструм. ансамблю «Мелодія» (Київ)...."
3975,Герасим’юк Василь Дмитрович,1956.0,"м. Караґанда, Казахстан",поет,"(18. 08. 1956, м. Караґанда, Казахстан) – поет. Член НСПУ (1983), АУП (1997). Національна премія України імені Т. Шевченка (2003). Премія «Благовіст» НСПУ (1993) та Літ. премія ім. П. Тичини (1998). Закiн. Київ...."
3976,Герасименко Валентина Лаврентіївна,1926.0,м. Кам’янське Дніпропетровської обл.,співачка (лірико-драматичне сопрано),"(20. 12. 1926, м. Кам’янське Дніпропетровської обл.) – співачка (лірико-драматичне сопрано). Заслужений артист УРСР (1966). Закінчила Київську консерваторію (1949; кл. К. Брун). Вдосконалювала вокальну..."
3981,Герасименко Наталія  Володимирівна,1957.0,Тбілісі,живописець,"(18. 02. 1957, Тбілісі) – живописець. Член НСХУ (1988). Закін. Київський художній інститут (1983; викл. М. Стороженко, В. Чеканюк). Працює у галузях монум. і станк. живопису. Учасниця всеукр., всесоюз.,..."
3983,Герасименко Степан Михайлович,1926.0,"с. Красне Батурин., нині Бахмац. р-ну Черніг. обл.",живописець,"(26. 01.  1926, с. Красне Батурин., нині Бахмац. р-ну Черніг. обл.) – живописець. Член НСХУ (2003). Учасник 2-ї світової війни. Бойові нагороди. Закін. Київський художній інститут (1965; викл. Л. Вітковський,..."
3984,Герасименко Тамара Миколаївна,1956.0,смт Липова Долина Сум. обл.,поетеса,"(15. 07.  1956, смт Липова Долина Сум. обл.) – поетеса. Член НСПУ (1999). Закін. Київський університет (1981). Учителювала; працювала у сум. обл. г. «Ленінська правда» (1984–88), ред. сум. обл. телебачення (1989–..."
3986,Герасименко Олена Василівна,1958.0,"с. Носачів Смілянського, нині Черкаського р-ну Черкаської обл.",поетеса,"(18. 05. 1958, с. Носачів Смілянського, нині Черкаського р-ну Черкаської обл.) — поетеса. Член НСПУ (2011). Літературні премії імені М. Стельмаха (2009), імені М. Леонтовича (2011), «Кришталева вишня» (2017),..."
3987,Герасимик Микола Дмитрович,1956.0,"с. Хабарище, нині Ратнів. р-ну Волин. обл.",український поет та бард на Берестейщині,"(29. 03. 1956, с. Хабарище, нині Ратнів. р-ну Волин. обл.) – український поет та бард на Берестейщині. Дипломант фестивалю нар. мистецтва «Білорусь – моя пісня» (1998). Закін. Укр. с.-г. академію (Київ, 1988)...."
3988,Герасимов Віктор Володимирович,1941.0,м. Нікополь Дніпроп. обл.,поет-пісняр,"(13.  11. 1941, м. Нікополь Дніпроп. обл.) – поет-пісняр, музично-громадський діяч. Заслужений діяч мистецтв України (1995). Міжнар. мист. премія ім. С. Гулака-Артемовського (1997), літ. премія ім. А. Малишка..."
3989,Герасимов Леонід Степанович,1954.0,Сімферополь,графік,"(30. 08.  1954, Сімферополь) – графік. Народний художник України (2009). Премія ім. М. Волошина (1999). Член НСХУ (1991). Закін. Укр. полігр. інститут у Львові (1997; викл. А. Попов). На творчій роботі. Працює у..."
3990,Герасимова Ірина  Єлисеївна,1939.0,Київ,живописець,"(24. 07. 1939, Київ) – живописець. Дружина Владислава, мати Максима Мамсикових. Член НСХУ (1980). Закін. Київський художній інститут (1963; викл. В. Костецький, К. Трохименко). Відтоді – на творчій роботі...."
3993,Герасимчук Валерій Назарович,1956.0,с. Денихівка Тетіїв. р-ну Київ. обл.,письменник,"(20. 04.  1956, с. Денихівка Тетіїв. р-ну Київ. обл.) – письменник. Член НСПУ (1987). Закін. Львівський університет (1978). Учителював. Від 1980 – кор., зав. с.-г. відділу Тетіїв. рай. газети. Від 1986 – на творчій..."
3999,Геращенко Ігор Борисович,1957.0,Львів,актор,"(20. 07. 1957, Львів) – актор, поет, перекладач. Народний артист України (2025). Член НСПУ (1996). Закін. Львів. політех. інститут (1979), Харків. інститут мистецтв (1986; курс Є. Лисенка). Від 1980 – хорист Харків...."
4002,Гергель Ольга  Дмитрівна,1946.0,с. Новофедорівка Новосанжар. р-ну Полтав. обл.,поетеса,"(27. 02.  1946, с. Новофедорівка Новосанжар. р-ну Полтав. обл.) – поетеса. Член НСПУ (1996). Закін. Львівський університет (1974). Працювала мол. ред. у видавництві «Мистецтво», кор. ж. «Піонерія», г...."
4004,Герега Марія Михайлівна,1957.0,Львів,піаністка,"(02. 01.  1957, Львів) – піаністка, педагог. Канд. мистецтвознавства (1993). Закін. Львів. консерваторію (1981; кл. Л. Крих), де відтоді й працює (нині муз. академія): від 1999 – завідувач кафедри заг. та..."
4005,Герелло Василь Георгійович,1963.0,с. Васловівці Заставнівського р-ну Чернівецької обл.,співак (баритон),"(13. 03.  1963, с. Васловівці Заставнівського р-ну Чернівецької обл.) – співак (баритон). Заслужений артист України (2006). Заслужений артист РФ (2008). Лауреат Міжнародного конкурсу оперних співаків..."
4006,Ґерета Олег  Петрович,1940.0,"с. Скоморохи, нині Терноп. р-ну Терноп. обл.",скрипаль,"(03. 06. 1940, с. Скоморохи, нині Терноп. р-ну Терноп. обл.) – скрипаль, педагог. Син Петра, брат Ігоря Ґерет. Заслужений артист України (1999). Обл. літ.-мист. премія ім. В. Стефаника (1999). Закін. Львів...."
4007,Ґеринович Олександр  Олександрович,1936.0,"м. Новосибірськ, РФ",диригент,"(09. 03. 1936, м. Новосибірськ, РФ) – диригент, педагог. Син О. Ґериновича та Р. Ґеринович-Ланської, онук В. Ґериновича. Професор (1998). Закін. Львів. консерваторію (1960, кл. віолончелі П. Пшенички; 1962, кл...."
4013,Герман Меланія,1937.0,"с. Видрань, округ Меджилаборці, нині Словаччина",українська громадсько-культурна діячка в Словаччині,"(03. 11. 1937, с. Видрань, округ Меджилаборці, нині Словаччина) – українська громадсько-культурна діячка в Словаччині. Доктор (1987). Закін. Вищу пед. школу (1959), Університет ім. Шафарика у Пряшеві (1965)..."
4014,Герман Олег  Михайлович,1948.0,с. Чернихів Зборів. р-ну Терноп. обл.,громадський і культурний діяч,"(21. 03. 1948, с. Чернихів Зборів. р-ну Терноп. обл.) – громадський і культурний діяч, поет, графік. Кандидат історичних наук (1995). Член НСПУ (1993). Закін. Львів. політех. інститут (1972), Львів. інститут..."
4015,Герман Юрій Антонович,1941.0,с. Лаврів Луцького р-ну Волин. обл.,живописець,"(06. 06. 1941, с. Лаврів Луцького р-ну Волин. обл.) – живописець. Закін. Львів. інститут прикладного та декоративного мистецтва (1971; викл. З. Флінта). Відтоді працював на Луцькому реклам. комбінаті;..."
4017,Гермашевська Наталія Миколаївна,1959.0,Київ,художник-сценограф і живописець,"(05. 06.  1959, Київ) – художник-сценограф і живописець. Член НСХУ (1999). Закін. Київський художній інститут (1986; викл. І. Несміянов). Відтоді працює художником-постановником Нац. телекомпанії..."
4018,Героєв Олександр Іванович,1922.0,"х. Юхнов Луг, нині с. Чуланіно Псков. обл., РФ",співак (баритон),"(09.  09.  1922, х. Юхнов Луг, нині с. Чуланіно Псков. обл., РФ) – співак (баритон). Заслужений артист УРСР (1974). Учасник 2-ї світової війни, бойові нагороди. Закін. Київську консерваторію (1956; кл. І...."
4020,Ґеруляк Ярослава,1933.0,"с. Стопніца, побл. м. Кєльце, Польща",графік,"(05. 05. 1933, с. Стопніца, побл. м. Кєльце, Польща) – графік, живописець, майстриня художньої кераміки і текстилю. Від 1950 – у США. Закін. Нортвестерн. університет (1959), Інститут мистецтв у Чикаґо...."
4023,Герцева Антоніна Михайлівна,1946.0,"м. Миколаївськ-на-Амурі Хабаров. краю, РФ",живописець і графік,"(29.  04. 1946, м. Миколаївськ-на-Амурі Хабаров. краю, РФ) – живописець і графік. Член НСХУ (1993). Закін. Львів. інститут прикладного та декоративного мистецтва (1972; викл. Е. Мисько, Л. Медвідь, З. Флінта)...."
4025,Герчук Наталія Василівна,1975.0,м. Острог Рівнен. обл.,живописець,"(08. 08. 1975, м. Острог Рівнен. обл.) – живописець. Закін. Ужгород. училище приклад. мистецтва (1995; викл. Л. Аверкієва, Н. Дідик). Працювала кер. гуртків нар. промислів, оформлювачем, від 2002 – зав...."
4029,Гета Андрій Васильович,1926.0,"с. Старі Санжари, нині Новосанжар. р-ну Полтав. обл.",графік і живописець,"(25. 12.  1926, с. Старі Санжари, нині Новосанжар. р-ну Полтав. обл.) – графік і живописець. Батько С. Гети. Член НСЖУ (1966), НСХУ (1978). Учасник 2-ї світової війни. Бойові та уряд. нагороди. Закін. Укр...."
4030,Гета Сергій Андрійович,1951.0,Київ,графік і живописець,"(25. 12.  1951, Київ) – графік і живописець. Син А. Гети. Член СХУ (1979–88). Закін. Київський художній інститут (1976; викл. В. Касіян, В. Чебаник). Відтоді – на творчій роботі. Учасник респ., всесоюз. та..."
4031,Гетало Олена Юхимівна,1948.0,с. Великі Солонці Новосанжар. р-ну Полтав. обл.,співачка (мецо-сопрано),"(03. 01.  1948, с. Великі Солонці Новосанжар. р-ну Полтав. обл.) – співачка (мецо-сопрано). Заслужений артист України (2002). Закін. Харків. інститут мистецтв (1974; кл. І. Азбель). Відтоді – солістка..."
4038,Гижа Олександр  Романович,1936.0,"с. Юзефівка, нині Йосипівка Козятин. р-ну Вінн. обл.",письменник,"(13.  09. 1936, с. Юзефівка, нині Йосипівка Козятин. р-ну Вінн. обл.) – письменник. Член НСПУ (1968). Закін. Київський університет (1970). Працював у період. виданнях Києва, зокрема в ред. ж. «Україна» (1969–74),..."
4041,Гирич Віктор Сергійович,1952.0,"с. Руська Поляна Черкас. р-ну, нині Черкас. обл.",режисер,"(23. 10. 1952, с. Руська Поляна Черкас. р-ну, нині Черкас. обл.) – режисер. Чоловік А. Гирич. Народний артист України (2009). Орден «За заслуги» 3-го ступеня (2001). Закін. Київ. інститут театр. мистецтва (1978;..."
4043,Ґіґаурі Автанділ  Симонович,1962.0,"м. Душеті, Грузія",живописець і скульптор,"(10. 02. 1962, м. Душеті, Грузія) – живописець і скульптор. Член НСХУ (1995). Закін. Тбіліс. АМ (1986; викл. С. Калва, К. Касрадзе, Ш. Саладзе). Учасник регіон. 
та всеукр. мистецьких виставок від 1995. Персон. –..."
4044,Гідора Ганна Володимирівна,1959.0,"с. Студенок, нині Миропілля Краснопіл. р-ну Сум. обл.",живописець,"(09. 12. 1959, с. Студенок, нині Миропілля Краснопіл. р-ну Сум. обл.) – живописець. Дружина Олександра Животкова. Закін. Курський пед. інститут (РФ, 1985; викл. Б. Данченко). Співзасн. і чл. твор. групи..."
4055,Гіляровський Михайло Васильович,1934.0,"с. Телятин, нині Люблін. воєводства, Польща",режисер,"(14. 08. 1934, с. Телятин, нині Люблін. воєводства, Польща) – режисер. Брат Н. Гіляровської. Заслужений діяч мистецтв УРСР (1969). Закін. Київ. інститут театр. мистецтва (1960; викл. І. Чабаненко, М...."
4056,Гіммельфарб Євген Юзефович,1942.0,"м. Свердловськ, нині Єкатеринбург, РФ",режисер,"(17. 02. 1942, м. Свердловськ, нині Єкатеринбург, РФ) – режисер, актор, педагог. Син Ю. Гіммельфарба. Заслужений діяч мистецтв України (1999). Закін. Харків. інститут мистецтв (1975; викл. В. Афанасьєв)...."
4065,Гірний Богдан Богданович,1956.0,"с. Супранівка Підволочиського, нині Тернопільського р-ну Тернопільської обл.",скульптор,"(25. 06. 1956, с. Супранівка Підволочиського, нині Тернопільського р-ну Тернопільської обл.) — скульптор. Член НСХУ (2017). Закінчив Львівське училище прикладного мистецтва (1975), Українську АМ (Київ,..."
4067,Гірник Павло Миколайович,1956.0,Хмельницький,поет,"(30. 04. 1956, Хмельницький) – поет. Син М. Гірника. Член НСПУ (1984–97), АУП (1997). Літ. премії ім. П. Усенка та ім. А. Малишка (1989). Національна премія України імені Т. Шевченка (2009). Закін. Київ. пед. інститут..."
4070,Гірняк-Воєвідка Марта,1940.0,"м. Станіслав, нині Івано-Франківськ",художниця,"(1940, м. Станіслав, нині Івано-Франківськ) – художниця. Закін. Клівленд. інститут мистецтва (1962), Кент. університет (1968; обидва – США), навч. у Віден. АМ (1968– 69). Учасниця виставок від 1962. Персон. –..."
4073,Главчев Микола Степанович,1927.0,"с. Нестерівці Дунаєвец. р-ну, нині Хмельн. обл.",живописець і графік,"(24. 08.  1927, с. Нестерівці Дунаєвец. р-ну, нині Хмельн. обл.) – живописець і графік. Учасник 2-ї світової війни. Член НСХУ (1994). Закін. Одес. художнє ПТУ (1948; викл. С. Нещеретний). Відтоді працював у..."
4078,Гладій Григорій Степанович,1954.0,"с-ще Хоростків, нині місто Гусятин. р-ну Терноп. обл.",актор театру і кіно,"(04. 12. 1954, с-ще Хоростків, нині місто Гусятин. р-ну Терноп. обл.) – актор театру і кіно, режисер. Член НСКінУ (1987). Закін. актор. факультет Київ. (1976; майстерня Б. Ставицького) та режисер. факультет..."
4081,Гладкий Андрій Володимирович,1960.0,Харків,живописець,"(15. 10. 1960, Харків) – живописець. Член НСХУ (1989). Закін. Харків. худож.-пром. інститут (1983; викл. В. Ігуменцев, В. Лозовий, В. Шаламов). У 1985–92 – художник-постановник Театру З. Довжанської у Харкові...."
4082,Гладкий Віталій Дмитрович,1947.0,с. Ярошівка Ромен. р-ну Сум. обл.,прозаїк,"(26. 04. 1947, с. Ярошівка Ромен. р-ну Сум. обл.) – прозаїк. Член НСПУ (1993). Літ. премія ім. В. Короленка (1996). Закін. Донец. політех. інститут (1972). Працював на підприємствах Донецька (1966–77), Магадан. обл...."
4085,Гладкий Михайло Захарович,1923.0,"с. Петрівка-Роменська Гадяц. р-ну, нині Полтав. обл.",скульптор,"(18. 02. 1923, с. Петрівка-Роменська Гадяц. р-ну, нині Полтав. обл.) – скульптор, майстер художньої кераміки. Член НСХУ (1978). Учасник 2-ї світової війни. Бойові нагороди. Закін. Львів. інститут..."
4087,Гладкий Сергій Іванович,1890.0,"-і рр., Полтавщина",графік і живописець,"(1890-і рр., Полтавщина – ?) – графік і живописець. Закін. С.-Петербур. інститут цивіл. інженерів. Після 1-ї світової війни – на еміграції в Чехо-Словаччині. Видавав у Берні ж. «Слов’янське..."
4088,Гладкий Богдан Степанович,1962.0,м. Дрогобич Львівської обл.,скульптор,"(15. 06. 1962, м. Дрогобич Львівської обл.) — скульптор. Член НСХУ (2008). Закінчив Львівське училище прикладного і декоративного мистецтва (1983), факультет архітектурно-декоративної..."
4089,Гладких Інга Олександрівна,1966.0,Київ,графік,"(19. 01. 1966, Київ) – графік. Дочка Н. Карбовської. Лауреат мист. конкурсу, присвяч. 50-річчю ООН (Київ, 1996). Член НCХУ (1993). Закін. Київський художній інститут (1991; майстерня А. Чебикіна). Учасниця..."
4091,Гладков Вадим Юрійович,1971.0,Київ,піаніст,"(15. 06. 1971, Київ) – піаніст, педагог. Ґран-Прі 9-го Міжнар. конкурсу піаністів (м. Порто, Португалія, 1992) та 6-го Міжнар. конкурсу виконавців ім. П. Лантьє (Париж, 1994), перші премії міжнар. конкурсів..."
4093,Гладкова Альбіна Іванівна,1940.0,"м. Карабаново Владимир. обл., РФ",художниця театру,"(26. 07. 1940, м. Карабаново Владимир. обл., РФ) – художниця театру. Закін. Абрамців. худож.-пром. училище (Москва). Від 1966 – художник, від 1971 – гол. художник Вінн. театру ляльок «Золотий ключик»...."
4094,Гладнєв Василь Миколайович,1937.0,"м. Красноярськ, РФ",актор,"(04. 04. 1937, м. Красноярськ, РФ) – актор. Заслужений артист України (2003). Закін. Театр. училище ім. М. Щепкіна при Малому театрі (Москва, 1966). Відтоді – актор Донец. укр. муз.-драм. театру. Водночас..."
4097,Глазирін Володимир Львович,1940.0,"м. Свердловськ, нині Єкатеринбург, РФ",архітектор,"(24. 02. 1940, м. Свердловськ, нині Єкатеринбург, РФ) – архітектор. Нар. арх. України (2009). Канд. архітектури (1999). Дійсний член Української академії архітектури (2003). Державна премія РФ (1992)...."
4101,Глейзер Мойсей Борисович,1946.0,Київ,графік,"(29. 08. 1946, Київ) – графік. Член НСХУ (1987–2002). Закін. Ленінгр. пед. інститут (нині С.-Петербург, 1973). Працював у Києві: від 1974 – ст. художником в інституті «Діпрозв’язок–3»; від 1981 – художником Б-ки..."
4102,Глейх Максим Григорович,1912.0,,графік і живописець,"(17. 03. 1912 – ?, м. Кременчук Полтав. обл.) – графік і живописець. Член СХУ (1966). Учасник 2-ї світової війни. Закін. АМ у Латвії (1955). Працював у видавництві «Ліесма» (1945–47, 1955–60). Брав участь у респ. та..."
