id,name,birth_year,birth_city,profession,bio_text
11936,Малакова Ірина Магомедівна,1936.0,Київ,архітектор-ре­ставратор,"(30. 04. 1936, Київ) – архітектор-ре­ставратор. Дружина Д. Малакова. Член НСАУ (1981). Закін. Київ. інж.-буд. інститут (1962). Працювала 1956–60 в інституті «Діпромісто»; 1960–67 – у Зонал. НДІ експеримент...."
11937,Малакова Олена Георгіївна,1960.0,Київ,графік,"(12. 05. 1960, Київ) – графік. Дочка Георгія, онука Василя Малакових. Член НСХУ (1992). Закін. Київський художній інститут (1984; викл. Т. Лящук, В. Че­баник, А. Чебикін). Відтоді працює у..."
11945,Малахута Микола  Данилович,1939.0,с. Рашівка Гадяц. р-ну Полтав. обл.,письменник,"(23. 02. 1939, с. Рашівка Гадяц. р-ну Полтав. обл.) – письменник, літературознавець, журналіст і видавець. Член НСПУ (1970), НСЖУ (1959). Міжнар. літ.-мист. премія ім. Г. Сковороди (2007), літ. премія ім. М. Гоголя..."
11951,Малежик Юлія Миколаївна,1979.0,"Кіровоград, нині Кропивницький",графік,"(28. 08. 1979, Кіровоград, нині Кропивницький) – графік, живописець, майстриня декоративного розпису на склі. Кандидат педагогічних наук (2014). Член НСМНМУ (2016). Закін. Кіровогр. дит. юнац. художню..."
11953,Малець В’ячеслав Михайлович,1939.0,"с. Тупичів, нині Городнян. р-ну Черніг. обл.",прозаїк,"(23. 09. 1939, с. Тупичів, нині Городнян. р-ну Черніг. обл.) – прозаїк. Батько Г. Малець. Член НСПУ (1969). Закін. Київський університет (1961). Працював 1961–2003 у видавництві «Веселка», ред. г. «Літературна..."
11954,Малець Ганна  В’ячеславівна,1976.0,Київ,перекладачка,"(06. 04. 1976, Київ) – перекладачка. Дочка В. Мальця. Член НСПУ (2004). Премія ім. Г. Сковороди Посольства Франції в Україні (2007). Закін. Київський університет (1998), Нац. авіац. університет (Київ, 2016)...."
11955,Малецька Оксана Миколаївна,1983.0,"м. Зборів, нині Тернопільського р-ну Тернопільської обл.",співачка (сопрано),"(18. 08. 1983, м. Зборів, нині Тернопільського р-ну Тернопільської обл.) — співачка (сопрано). Заслужена артистка України (2020). Закінчила Львівську музичну академію (2007; кл. Л. Кривоцюк). Відтоді..."
11956,Малецька Любов Михайлівна,1983.0,с. Загір’я Зборів. р-ну Терноп. обл.,поетеса,"(12. 10. 1983, с. Загір’я Зборів. р-ну Терноп. обл.) – поетеса. Член НСПУ (2013). Літ. премія ім. С. Будного (2010). Закін. Терноп. пед. університет (2008). Працювала методистом Метод. центру з роботи із сім’єю..."
11958,Малеш Маріанна Петрівна,1959.0,с. Чома Берегів. р-ну Закарп. обл.,графік,"(09. 02. 1959, с. Чома Берегів. р-ну Закарп. обл.) – графік. Дружина О. Малеша. Член НСХУ (2013). Лауреат обл. премії у галузі образотвор. мистецтва ім. Й. Бокшая та А. Ерделі (2018). Закін. Ужгород. училище..."
11959,Малеш Олександр  Юрійович,1957.0,Ужгород,живописець,"(25. 07. 1957, Ужгород) – живописець. Чоловік М. Малеш. Член НСХУ (2013). Закін. Ужгород. училище приклад. мистецтва (1981; викл. Л. Аверкієва, В. Петрецький). У 1980-х рр. працював художником Закарп. драм...."
11960,Малєєв Павло  Терентійович,1943.0,м. Новомиргород Кіровогр. обл.,письменник,"(12. 07. 1943, м. Новомиргород Кіровогр. обл.) – письменник. Член НСПУ (1995), НСЖУ (1967). Закін. Кіровогр. пед. інститут (нині Кропивницький, 1971). Працював журналістом, був ред. міської г. «Ржищів» та рай...."
11961,Малий Леонід Якович,1946.0,"м. Куйбишев, нині Самара, РФ",художник-проектант,"(18. 02. 1946, м. Куйбишев, нині Самара, РФ) – художник-проектант. Член НСХУ (1989). Закін. Київський художній інститут (1980; викл. М. Катернога, Л. Скорик). На творчій роботі. Основні галузі – архіт...."
11963,Малик Галина Миколаївна,1951.0,м. Бердянськ Запоріз. обл.,письменниця,"(12. 08. 1951, м. Бердянськ Запоріз. обл.) – письменниця, драматург, перекладачка. Член НСПУ (1991). Премії ж. «Перець» (1987), ім. О. Ко­пиленка ж. «Барвінок» (1988), ім. Лесі Українки (2003), ім. Ф. По­тушняка (2006,..."
11965,Малик Олексій Володимирович,1959.0,м. Кременчук Полтав. обл.,графік,"(20. 08. 1959, м. Кременчук Полтав. обл.) – графік, живописець, дизайнер. Член НСХУ (1995). Закін. Харків. худож.-пром. інститут (1984; викл. О. Векленко, І. Криворучко). На творчій роботі; 1991–97 –..."
11966,Маликов Юрій Анатолійович,1957.0,"м. Дніпродзержинськ, нині Ка­м’янське Дніпроп. обл.",актор,"(23. 05. 1957, м. Дніпродзержинськ, нині Ка­м’янське Дніпроп. обл.) – актор. Заслужений артист України (2007). Закін. Дніпроп. театр. училище (нині Дніпро, 1981; викл. Н. Пінська). У 1981–2008 – актор..."
11968,Малина Валерій  Васильович,1940.0,"м. Городенка Станіслав., нині Івано-Фр. обл.",мистецтвознавець,"(15. 06. 1940, м. Городенка Станіслав., нині Івано-Фр. обл.) – мистецтвознавець. Доктор мистецтво­знавства (2009). Член НСХУ (1984). Закін. Урал. (нині Єкатеринбург, РФ; 1973) та Київ. (1975) університети...."
11969,Малина В’ячеслав Васильович,1975.0,"с-ще Геологів, нині у складі с. Бірки Олександрів. р-ну Кіровогр. обл.",живописець,"(10. 10. 1975, с-ще Геологів, нині у складі с. Бірки Олександрів. р-ну Кіровогр. обл.) – живописець. Закін. Київський університет будівництва та архітектури (2007). На творчій роботі. Учасник обл.,..."
11970,Малинка Віктор Олександрович,1935.0,"м. Таганрог Ростов. обл., РФ",живописець,"(17. 08. 1935, м. Таганрог Ростов. обл., РФ) – живописець, графік. Батько Олексія, дід Петра та Ксенії Малинок. Член НСХУ (1970). Закін. Київський художній інститут (1967; викл. В. Касіян, В. Чебаник)...."
11971,Малинка Ксенія Олексіївна,1982.0,Київ,графік,"(07. 05. 1982, Київ) – графік. Дочка О. Малинки та Олени Плесовської, сестра П. Малинки, онука В. Малинки та Олександри Плесовської. Навч. у Нац. авіац. університеті (Київ, 2001–04). Мистецтву навч. у..."
11972,Малинка Олександр Олександрович,1950.0,"м. Сталіно, нині Донецьк",живописець,"(02. 02. 1950, м. Сталіно, нині Донецьк) – живописець. Член НСХУ (1985). Закін. Інститут живопису, скульптури та архітектури у Ленінграді (нині С.-Петербург, 1979; викл. І. Серебряний). На творчій роботі...."
11973,Малинка Олексій Вікторович,1961.0,"м. Таганрог Ростов. обл., РФ",скульптор,"(10. 09. 1961, м. Таганрог Ростов. обл., РФ) – скульптор, графік і живописець. Син В. Малинки, чоловік О. Плесовської, батько Петра та Ксенії Малинок. Член НСХУ (1992). Закін. Київський художній інститут..."
11974,Малинка Петро  Олексійович,1990.0,Київ,графік,"(26. 08. 1990, Київ) – графік, живописець. Син О. Малинки та Олени Плесовсь­­кої, брат К. Малинки, внук В. Малинки та Олександри Плесовсь­­кої. Член НСХУ (2015). Диплом 1-го ступеня у номінації «естамп»..."
11975,Малинкіна Раїса  Петрівна,1958.0,"м. Макіївка Сталін., нині Донец. обл.",графік,"(11. 01. 1958, м. Макіївка Сталін., нині Донец. обл.) – графік, живописець. Член НСХУ (2002). Навч. у худож. студії (1970-і рр.; кер. Валентина і Володимир Телички), закін. Іванов. художнє училище (РФ, 1981; викл...."
11977,Малиновський В’ячеслав Андрійович,1937.0,с. Колодіївка Корец. р-ну Рівнен. обл.,живописець,"(12. 03. 1937, с. Колодіївка Корец. р-ну Рівнен. обл.) – живописець, графік, поет і педагог. Член НСХУ (1993). Закін. Київський художній інститут (1964; викл. Л. Вітковський, В. За­башта, В...."
11979,Малиновський Рафаїл Болеславович,1949.0,"с. Слобода-Чернецька, нині с. Лебедівка Новоград-Волин. р-ну Житомир. обл.",балетмейстер,"(03. 01. 1949, с. Слобода-Чернецька, нині с. Лебедівка Новоград-Волин. р-ну Житомир. обл.) – балетмейстер, педагог. Батько А. Малиновського. Народний артист України (1993). Орден «За заслуги» 3-го (1999)..."
11980,Малих Олексій Андрійович,1956.0,Берлін,живописець,"(24. 08. 1956, Берлін) – живописець, графік, скульптор. Член НСХУ (1995). Закін. худож.-графіч. факультет Моск. пед. інституту (1981; викл. Б. Єрьомін, В. Казарін). Працює у Києві: 1984–85 – викладач студії..."
11981,Малицька Любов Іванівна,1936.0,Запоріжжя,співачка (мецо-со­прано),"(29. 11. 1936, Запоріжжя) – співачка (мецо-со­прано). Народний артист України (1997). Премія ім. І. Паторжинського обл. відділ. Укр. фонду культури (Запоріжжя, 2007). Закін. Одес. муз. училище (1965). Відтоді..."
11987,Малишева Лариса Геннадіївна,1947.0,Одеса,живописець,"(04. 06. 1947, Одеса) – живописець. Дочка Г. Малишева. Член СХ РФ (1978). Закін. Одес. художнє училище (1967; викл. О. Слешинський), Ленінгр. вище худож.-пром. училище (нині С.-Петербург, 1974; викл. А...."
11992,Малишко Микола Олексійович,1938.0,с. Знаменівка Новомоск. р-ну Дніпроп. обл.,живописець,"(15. 02. 1938, с. Знаменівка Новомоск. р-ну Дніпроп. обл.) – живописець, графік і монументаліст. Брат П. Малишка, чоловік Н. Денисової. Заслужений художник України (2009). Премія ім. В. Стуса (1998)...."
11993,Малишко Олег Іванович,1962.0,Львів,художник декоративно-ужиткового мистецтва,"(21. 03. 1962, Львів) – художник декоративно-ужиткового мистецтва. Член НСХУ (2008). Закін. Львів. інститут прикладного та декоративного мистецтва (1992; викл. М. Гладкий, Б. Горбалюк, І. Франк)...."
11994,Малишко Петро Олексійович,1941.0,с. Знаменівка Новомоск. р-ну Дніпроп. обл.,живописець,"(05. 07. 1941, с. Знаменівка Новомоск. р-ну Дніпроп. обл.) – живописець, графік, скульптор. Брат М. Ма­лишка. Заслужений художник України (2009). Член НСХУ (1974). Закін. Дніпроп. художнє училище (нині..."
11998,Малишко Олександр Васильович,1959.0,"с. Кропивна Антонин., нині Ізяслав. р-ну Хмельн. обл.",письменник,"(31. 01. 1959, с. Кропивна Антонин., нині Ізяслав. р-ну Хмельн. обл.) – письменник, лікар. Член НСПУ (2003). Закін. Крим. мед. інститут (Сімферополь, 1982). Працював лікарем-фтизіатром, гол. лікарем..."
12000,Малігон Анна Миколаїівна,1984.0,м. Конотоп Сумської обл.,письменниця,"(04. 06. 1984, м. Конотоп Сумської обл.) – письменниця. Член НСПУ (2004). Лауреатка Міжнародної українсько-німецької премії імені О. Гончара (2009), премій «Благовіст» (2012), «Ватерлінія» (2012), обласних..."
12002,Малінович Андрій Володимирович,1975.0,Тернопіль,актор,"(26. 03. 1975, Тернопіль) – актор. Чоловік О. Малінович. Заслужений артист України (2016). Закін. актор. відділ. Терноп. муз. училища (1998; кл. В. Хім’яка), Київ. академію керів. кадрів культури і..."
12003,Маліш Петро Іванович,1953.0,с. Меденичі Дрогоб. р-ну Львів. обл.,прозаїк,"(27. 01. 1953, с. Меденичі Дрогоб. р-ну Львів. обл.) – прозаїк, публіцист. Член НСПУ (2014). Премії: «За подвижництво у державотворенні» ім. Я. Гальчевського (2004), літ. міські ім. Б. Хмельницького (2007) та ім...."
12007,Малкович Іван Антонович,1961.0,"с. Березів Нижній Косів. р-ну Станіслав., нині Івано-Фр. обл.",поет,"(10. 05. 1961, с. Березів Нижній Косів. р-ну Станіслав., нині Івано-Фр. обл.) – поет, видавець. Національна премія України імені Т. Шевченка (2017). Член НСПУ (1986). Закін. Київський університет (1985)...."
12008,Малованюк Іван Лазарович,1941.0,с. Бобівці Сторожинец. р-ну Чернів. обл.,живописець,"(23. 11. 1941, с. Бобівці Сторожинец. р-ну Чернів. обл.) – живописець, художник-монументаліст. Член НСХУ (1993). Закін. факультет худож. кераміки Львів. інституту прикладного та декоративного мистецтва..."
12015,Малькова Ксенія Аркадіївна,1899.0,,співачка (сопрано),"(14(27). 05. 1899, м. Катеринослав, нині Дніпро – ?, Москва) – співачка (сопрано), педагог. Заслужений артист РРФСР (1941). Навч. у Дніпроп. консерваторії (нині Дніпро, 1919–22; кл. З. Малютіної), Держ...."
12018,Мальцев Анатолій Іванович,1941.0,"Дніпропетровськ, нині Дніпро",графік,"(06. 09. 1941, Дніпропетровськ, нині Дніпро) – графік, живописець. Батько О. Папушникової. Член НСХУ (1975). Закінчив Дніпропетровське художнє училище (1962; викладачі М. Боровсь­кий, М. Родзін, В...."
12024,Мальцев Віталій Володимирович,1946.0,Харків,віолончеліст,"(15. 02. 1946, Харків) – віолончеліст. Народний артист України (2016). Лауреат низки респ. та всеукр. конкурсів і фестивалів. Закін. Харків. інститут мистецтв (1970; кл. Г. Авер’янова). 1971–95 – арт. симф...."
12027,Мальцева Олена Володимирівна,1969.0,"м. Бузулук Оренбур. обл., РФ",співачка (мецо-сопрано),"(01. 10. 1969, м. Бузулук Оренбур. обл., РФ) – співачка (мецо-сопрано). Заслужений артист України (2011). Лауреатка міжнар. конкурсу «Новий Сонч» (Польща, 2006, 1-а премія). Закін. Астрахан. консерваторію (РФ,..."
12031,Малюта Іван Трохимович,1943.0,с. Цибулівка Тростянец. р-ну Вінн. обл.,письменник,"(16. 04. 1943, с. Цибулівка Тростянец. р-ну Вінн. обл.) – письменник, публіцист, журналіст, краєзнавець. Член Національної спілки краєзнавців України (2014), НСПУ (2015). Заслужений журналіст України (2009)...."
12033,Малютіна Наталія Павлівна,1963.0,Одеса,літературознавець,"(19. 12. 1963, Одеса) – літературознавець. Доктор філологічних наук (2007), професор (2007). Закін. Одес. університет (1985) та муз. академію (1999). Учителювала. Від 1991 викладає на каф. укр. літ-ри Одес...."
12035,Маляр Олександр Сергійович,1955.0,с. Підлісне Золочів. р-ну Львів. обл.,скульптор,"(28. 04. 1955, с. Підлісне Золочів. р-ну Львів. обл.) – скульптор. Обл. мист. премія ім. М. Бойчука (1998). Член НСХУ (2003). Закін. Львів. інститут прикладного та декоративного мистецтва (1985; викл. Д...."
12039,Маляров Анатолій Андрійович,1933.0,с. Шевченкове Березів. р-ну Одес. обл.,прозаїк,"(21. 04. 1933, с. Шевченкове Березів. р-ну Одес. обл.) – прозаїк, драматург. Член НСПУ (1983). Лауреат всеукр. літ. конкурсів (1983, 1993, 2007). Закін. Київ. інститут театр. мистецтва (1958). Працював реж. на Київ. та..."
12040,Малярчук Таня (Тетяна Володимирівна),1983.0,Івано-Франківськ,письменниця,"(Тетяна Володимирівна; 17. 04. 1983, Івано-Франківськ) – письменниця. Премія «Kristal Vi­­lenica» (Словенія), літ. премії ім. Дж. Конрада-Коженьовського (обидві – 2013) та «Книга року ВВС» (2016). Закін. Прикарп...."
12041,Малярчук Микола Дементійович,1935.0,"с. Вороне Маньків. р-ну, нині Черкас. обл.",живописець,"(27. 08. 1935, с. Вороне Маньків. р-ну, нині Черкас. обл.) – живописець. Член НСМНМУ (2002). Закін. Київський художній інститут (1970). Працював 1975–83 на Київ. комбінаті декор. і монум. мистецтва; 1983–85 – гол...."
12042,Малярчук-Когут Оксана Володимирівна,1974.0,м. Калуш Івано-Фр. обл.,літературознавець,"(27. 09. 1974, м. Калуш Івано-Фр. обл.) – літературознавець. Дружина О. Малярчука. Доктор філологічних наук (2013), професор (2015). Закін. Прикарп. університет (Івано-Франківськ, 1996). Учителювала;..."
12045,Мамакін Юрій Анатолійович,1940.0,Харків,прозаїк,"(01. 06. 1940, Харків) – прозаїк. Член НСПУ (1979). Закін. Харків. інститут інж. залізнич. транспорту (1962) та Вищі літ. курси в Москві (1989). Працював кер. групи Укр. інституту проектування міст Держбуду..."
12046,Мамалига Наталія Миколаївна,1968.0,Черкаси,співачка (сопрано),"(15. 04. 1968, Черкаси) – співачка (сопрано). Заслужений артист України (2009). Закін. Київську консерваторію (1992; викл. С. Баштан, М. Шевченко). Відтоді – солістка Черкас. філармонії; від 1994 – Черкас...."
12048,Мамедов Хаджи-Мурат Миколайович,1939.0,"c. Руставі, Пд. Осетія, Грузія",кінооператор,"(03. 04. 1939, c. Руставі, Пд. Осетія, Грузія) – кінооператор, режисер. Заслужений діяч мистецтв УРСР (1990). Член СКін СРСР (1971). Дипломант Всесоюз. кінофес­тивалю спорт. фільмів (Одеса, 1972), Міжнар...."
12049,Мамедов Катіб Сафар Оглу,1963.0,"с. Учтапа, нині Ґьойґьол. р-ну, Азербайджан",скульптор,"(10. 10. 1963, с. Учтапа, нині Ґьойґьол. р-ну, Азербайджан) – скульптор. Народний художник України (2019). Міжнародна премія ім. І. Рєпіна (2012). Член НСХУ (1999). Закін. Харків. худож.-пром. інститут (1993;..."
12050,Мамедов Суммани Махмадали,1952.0,"с. Дузаграмі, Грузія",живописець,"(15. 06. 1952, с. Дузаграмі, Грузія) – живописець. Навч. у Тбіліс. АМ (1970), закін. Харків. худож.-пром. інститут (1981; викл. А. Константинопольський). Відтоді – у Жданові (нині Маріуполь Донец. обл.). На..."
