id,name,birth_year,birth_city,profession,bio_text
12293,Масалітіна Ольга Юріївна,1974.0,Київ,письменниця,"(29. 07. 1974, Київ) – письменниця, видавець. Член НСПУ (2016). Закін. Київ. інститут нар. господарства (1996). Профес. діяльність розпочала у банків. сфері, потім очолювала агентство видавн. дому..."
12294,Масалов Анатолій Кирилович,1940.0,"ст. Бурла Алтай. краю, РФ",поет,"(09. 04. 1940, ст. Бурла Алтай. краю, РФ) – поет. Член НСПУ (2002). Лауреат літ. премії «Срібна ліра» (1998), Держ. літ. премії АР Крим (2003), Респ. премії ім. А. Чехова (2003), літ. премії «Золота ліра» (2006), Всерос...."
12296,Масальська Людмила Олександрівна,1947.0,"м. Ярославль, РФ",живописець,"(11. 04. 1947, м. Ярославль, РФ) – живописець, художник-монументаліст. Заслужений художник України (2019). Член НСХУ (1993). Закін. Білорус. театр.-худож. інститут (Мінськ, 1978; викл. Г. Ващенко, В. Громико)...."
12297,Масаутов Рафаель Зейнурович,1934.0,"с. Малі Чапурники Сталінгр. краю, нині Волгогр. обл., РФ",графік,"(21. 12. 1934, с. Малі Чапурники Сталінгр. краю, нині Волгогр. обл., РФ) – графік, живописець, дизайнер і громадський діяч. Батько Т. Масаутова. Народний художник України (1993). Мист. премія ім. В...."
12298,Масаутов Тимур Рафаельович,1962.0,Київ,живописець,"(01. 11. 1962, Київ) – живописець, графік, дизайнер. Син Р. Масаутова. Член НСХУ (2000). Закін. Київський художній інститут (1986; викл. А. Чебикін), творчі майстерні АМ СРСР у Києві (1991). Працював 1991–96..."
12303,Маскалик Павло Михайлович,1942.0,"с. Великий Буковець, нині Буківці Пряшів. краю, Словаччина",актор,"(21. 06. 1942, с. Великий Буковець, нині Буківці Пряшів. краю, Словаччина) – актор, письменник, театральний критик. Премія ім. І. Франка (Словаччина, 2014). У 1947–66 проживав в Україні. Навч. у Пряшів...."
12306,Масленкова Олена Ігорівна,1947.0,смт Ворзель Київ. обл.,мистецтвознавець,"(17. 08. 1947, смт Ворзель Київ. обл.) – мистецтвознавець. Дочка І. Масленкова. Канд. мистецтвознавства (1974). Член НСХУ (1977–2007). Закін. Київський художній інститут (1969; викл. Л. Сак, О. Тищенко)...."
12308,Масленніков Олег Миколайович,1961.0,Київ,актор,"(15. 01. 1961, Київ) – актор, режисер. Закін. Воронез. інститут мистецтв (РФ, 1985). У 1985–2004 – актор Київ. театру драми та комедії на Лівому березі Дніпра. Відтоді знімається в кіно та займається реж...."
12309,Масленнікова Анжела Геннадіївна,1970.0,"м. Єлізово Камчат. краю, РФ",хормейстер,"(08. 12. 1970, м. Єлізово Камчат. краю, РФ) – хормейстер. Заслужений працівник культури України (2009). Орден княгині Ольги 3-го ступеня (2020). Закін. диригент.-хор. факультет Київ. консерваторії (нині Нац...."
12310,Маслик Олександр Іванович,1952.0,смт Ладан Прилуц. р-ну Черніг. обл.,скульптор,"(02. 04. 1952, смт Ладан Прилуц. р-ну Черніг. обл.) – скульптор. Премія Київ. організації НСХУ ім. М. Лисенка (2010). Член НСХУ (1989). Закін. Київський художній інститут (1984; викл. В. Борисенко, М...."
12313,Маслобойщиков Сергій Володимирович,1957.0,Київ,режисер,"(18. 08. 1957, Київ) – режисер, сценарист, художник театру і кіно, актор, графік. Чоловік А. Сергійко. Член-кореспондент НАМУ (2017). Золота медаль АМУ в галузі театру (Київ, 1998). Лауреат міжнар. і..."
12317,Маслова Наталія Іванівна,1969.0,Харків,поетеса,"(03. 08. 1969, Харків) – поетеса, літературознавець. Дочка І. Маслова. Член НСПУ (1995). Літ. премія ім. Б. Слуцького (2001). Закін. Харків. пед. інститут (1991). Учителювала; викладала у Харків...."
12318,Маслова Тетяна Миколаївна,1975.0,Херсон,графік,"(24. 06. 1975, Херсон) – графік, живописець. Дружина Л. Басанця. Член НСХУ (2012). Закін. худож.-графіч. факультет Пд.-укр. пед. університету (Одеса, 1998; викл. Д. Жижин, С. Лозовський, І. Орос, М...."
12320,Маслюк Григорій Андрійович,1944.0,с. Студенок Глухів. р-ну Сум. обл.,актор,"(26. 04. 1944, с. Студенок Глухів. р-ну Сум. обл.) – актор. Народний артист України (2004). Закін. Харків. інститут мистецтв (1969). Відтоді – актор Дніпроп. укр. муз.-драм. театру ім. Т. Шевченка (нині Дніпро)...."
12322,Маслюх Андрій Миколайович,1975.0,Львів,перекладач,"(03. 06. 1975, Львів) – перекладач. Закін. Львівський університет (1998), вивчав італ. мову в Центрі італ. мови і культури при цьому Університеті (2001–03). Уже в університет. роки почав перекладати..."
12326,Масляник Олександр Іванович,1956.0,м. Рахів Закарп. обл.,письменник,"(05. 08. 1956, м. Рахів Закарп. обл.) – письменник, журналіст, видавець. Член НСПУ (2016), НСЖУ (1980). Заслужений журналіст України (2003). Премія ім. В. Чорновола (2008), міжнар. літ. премії ім. Ірини Вільде та В...."
12332,Мастєрова Валентина Миколаївна,1957.0,"с. Сивки Козлян., нині Черніг. р-ну Черніг. обл.",прозаїк,"(01. 03. 1957, с. Сивки Козлян., нині Черніг. р-ну Черніг. обл.) – прозаїк, журналістка. Член НСПУ (1994). Лауреатка літ. конкурсу «Гранослов» (1991) та літ. премій ім. Є. Бачинського «У свічаді слова» (1997),..."
12333,Мастикаш Михайло Васильович,1946.0,"с. Лисець Дунаєвец. р-ну Кам’янець-Поділ., нині Хмельн. обл.",графік,"(23. 07. 1946, с. Лисець Дунаєвец. р-ну Кам’янець-Поділ., нині Хмельн. обл.) – графік, живописець. Член НСХУ (1986), НСЖУ (2000). 2-а премія Респ. конкурсу плаката (Київ, 1983). Обл. мист. премія ім. В...."
12334,Мась Оксана Миколаївна,1969.0,"м. Іллічівськ, нині Чорноморськ Одес. обл.",живописець,"(05. 09. 1969, м. Іллічівськ, нині Чорноморськ Одес. обл.) – живописець. Член НСХУ (2009). Закін. Одес. художнє училище (1992; викл. В. Вершиніна, Т. Єгорова), здобула ступ. бакалавра з філософії в Одес...."
12336,Масютин Федір Максимович,1879.0,"м. Кролевець Черніг. губ., нині Сум. обл.",живописець,"(07. 06. 1879, м. Кролевець Черніг. губ., нині Сум. обл. – ?) – живописець. Служив у цар. армії командиром Ровен. піхот. полку. Демобілізов. 1901. Навч. 1903–04 як вільнослухач у Київ. худож. училищі, у 1920-х..."
12337,Матвейцев Володимир Євгенович,1963.0,м. Кам’янець-По­­дільський Хмельницької обл.,живописець,"(15. 04. 1963, м. Кам’янець-По­­дільський Хмельницької обл.) – живописець, графік. Чоловік Ганни, батько Ольги Матвейцевих. Обласна премія ім. М. Коцюбинського (2014). Член НСХУ (1992). Закінчив..."
12338,Матвейцева Ольга Володимирівна,1989.0,Чернігів,графік,"(04. 04. 1989, Чернігів) – графік. Дочка Володимира та Ганни Матвейцевих. Член НСХУ (2013). Закін. Нац. академію образотвор. мистецтва та архітектури (Київ, 2013; викл. А. Чебикін). На творчій..."
12339,Матвейцева Ганна Олександрівна,1961.0,Чернігів,графік,"(17. 04. 1961, Чернігів) – графік. Дружина Володимира, мати Ольги Матвейцевих. Член НСХУ (1994). Закін. Київський художній інститут (1992; викл. М. Компанець, А. Чебикін). Працювала у Чернігові:..."
12340,Матвєєв Андрій Вікторович,1979.0,"м. Керч, АР Крим",композитор,"(27. 02. 1979, м. Керч, АР Крим) – композитор. Член НСКУ (2004). Дипломант Міжнар. конкурсу ім. С. Про­­коф’єва (Донецьк, 2000), Всеукр. конкурсу студентів-композиторів «Gradus ad Parnassum» (Київ, 2001). Закін. Нац...."
12342,Матвєєв Євген Володимирович,1950.0,с. Харпай Моск. обл.,живописець,"(15. 01. 1950, с. Харпай Моск. обл.) – живописець, графік. Народний художник України (2016). Державна премія України імені Тараса Шевченка (1983). Срібна медаль АМ СРСР (1985). Член НСХУ (1978). Закін. Київ...."
12346,Матвєєва Лариса Віталіївна,1969.0,Миколаїв,письменниця,"(09. 05. 1969, Миколаїв) – письменниця. Член НСПУ (1998). Закін. Микол. пед. інститут (1992). Від 1993 працює у відділі комп’ютеризації й інформ. систем упр. (від 2007 – заступник нач.) Суднобуд. заводу ім. 61..."
12347,Матвєєва Тетяна Степанівна,1963.0,"м. Веймар, Німеччина",літературознавець,"(09. 07. 1963, м. Веймар, Німеччина) – літературознавець. Доктор філологічних наук (2017). Закін. Харків. університет (1985), де відтоді й працює: від 1999 – доцент кафедри історії укр. літ-ри. Наукові..."
12349,Матвієнко Леонід Григорович,1950.0,"с. Юнаківка, нині Сум. р-ну Сум. обл.",співак (баритон),"(28. 09. 1950, с. Юнаківка, нині Сум. р-ну Сум. обл.) – співак (баритон). Заслужений артист Абхаз. РСР (1984), України (1999). Орден «За заслуги» 3-го ступеня (2018). Навч. у Сум. культ.-осв. училищі (с. Кияниця Сум...."
12351,Матвієнко Олександр Володимирович,1961.0,м. Переяслав-Хмельницький Київ. обл.,поет,"(23. 08. 1961, м. Переяслав-Хмельницький Київ. обл.) – поет. Член НСПУ (2012). Закін. Полтав. інж.-буд. інститут (1983), Перея­слав-Хмельн. пед. університет (2016). Працював на виробництві (1983–86); у..."
12352,Матвієнко Світлана Геннадіївна,1976.0,м. Кам’янець-Поділь­сь­кий Хмельн. обл.,літературознавець,"(11. 03. 1976, м. Кам’янець-Поділь­сь­кий Хмельн. обл.) – літературознавець, культуролог. Член АУП (2000). Навч. у Кам’янець-Поділ. пед. інституті (1993–96), Нац. університеті «Києво-Могилян. академія»..."
12353,Матвієнко Сергій Миколайович,1966.0,м. Кривий Ріг Дніпроп. обл.,живописець,"(26. 10. 1966, м. Кривий Ріг Дніпроп. обл.) – живописець. Член НСХУ (1993). Закін. Дніпроп. художнє училище (нині Дніпро, 1985; викл. К. Беркут, В. Матяш). Працював художником на Криворіз. металург. комбінаті..."
12354,Матвієнко Теодор,1924.0,Київ,поет,"(12. 09. 1924, Київ) – поет. Член Об’єдн. укр. письменників «Слово». Освіта середня. 1943 емігрував до Німеччини, згодом мешкав у Франції та Іспанії. Після 2-ї світової вій­ни здобував освіту..."
12355,Матвієнко Тоня,1981.0,Київ,співачка (сопрано),"(Гончар Антоніна Петрівна; 12. 04. 1981, Київ) – співачка (сопрано). Дочка П. Гончара та Н. Матвієнко, сестра Андрія, онука Івана Гончарів, дружина А. Мірзояна. Заслужений артист України (2021)...."
12356,Матвієнко Ганна Іванівна,1955.0,смт Семенівка Полтав. обл.,художниця декоративного розпису,"(28. 04. 1955, смт Семенівка Полтав. обл.) – художниця декоративного розпису. Закін. Полтав. пед. інститут (1980), Гадяц. училище культури (Полтав. обл., 2004), Рівнен. гуманітар. університет (2008). Мистецтву..."
12360,Матвіїв Ігор Ярославович,1958.0,"м. Стрий Дрогоб., нині Львів. обл.",живописець,"(01. 01. 1958, м. Стрий Дрогоб., нині Львів. обл.) – живописець, графік. Член НСХУ (1994, у 2000–05 – заступник голови Микол. організації). Закін. архіт. факультет Львів. політех. інституту (1980; викл. В...."
12362,Матвіїшин  Галина-Жанна Ярославівна,1963.0,"с. Ясениця, Турківський р-н, Львівська обл.",мистецтвознавець,"(16. 01. 1963, с. Ясениця, Турківський р-н, Львівська обл.) – мистецтвознавець, культуролог. Дочка Я. Матвіїшина. Член НСХУ (2010). Закінчила Львівський політехнічний інститут (1984), Львівську АМ (2005)...."
12363,Матвійчук Анатолій Миколайович,1958.0,Київ,естрадний співак,"(29. 09. 1958, Київ) – естрадний співак, поет, композитор. Народний артист України (2000). Член НСПУ (2016), НСЖУ (1988). Літ. премії ім. І. Франка (2002), ім. Д. Луценка (2007). Закін. Київський університет (1986)...."
12366,Матвійчук Ніна Іванівна,1948.0,Київ,поетеса,"(05. 11. 1948, Київ) – поетеса, перекладачка. Член НСПУ (1982). Закін. Київський університет (1973). Працювала в Інституті мовознавства АН УРСР (1966–69), позаштат. оглядачем ред. ж. «Всесвіт» (1969–73),..."
12368,Матевощук Юрій Олександрович,1991.0,м. Ланівці Терноп. обл.,письменник,"(25. 04. 1991, м. Ланівці Терноп. обл.) – письменник, перекладач, есеїст. Член НСПУ (2014). Літ. премія ім. С. Будного (2015). Закін. Терноп. пед. університет (2013). Працює гол. ред. видавництва «Крок» та..."
12370,Матейко Любомир Михайлович,1969.0,с. Скопівка Коломий. р-ну Івано-Фр. обл.,скрипаль,"(21. 05. 1969, с. Скопівка Коломий. р-ну Івано-Фр. обл.) – скрипаль, композитор, диригент. Чоловік О. Кулик. Народний артист України (2019). Закін. Нац. муз. академію України (Київ, 2001; кл. О...."
12371,Матейчук Федір Михайлович,1956.0,"с. Кулачківці Снятин. р-ну Станіслав., нині Івано-Фр. обл.",живописець,"(17. 04. 1956, с. Кулачківці Снятин. р-ну Станіслав., нині Івано-Фр. обл.) – живописець. Брат Т. Матейчука. Член НСХУ (2013). Закін. Моск. заоч. університет мистецтв (1985). На творчій роботі. Основна..."
12373,Материнка Борис Васильович,1947.0,"с. Куничне Кам’ян. р-ну, Молдова",молдовський співак (баритон),"(Materinca Boris Vasiliovici; 13. 04. 1947, с. Куничне Кам’ян. р-ну, Молдова) – молдовський співак (баритон). Заслужений артист Молдови (1992). Закін. Кишинів. консерваторію (1976; кл. М. Кіоси). Від 1975 – соліст Нац...."
12374,Матешко Анатолій Миколайович,1953.0,"смт Гостомель, нині Ірпін. міськради Київ. обл.",актор,"(29. 09. 1953, смт Гостомель, нині Ірпін. міськради Київ. обл.) – актор, кінорежисер. Брат О. Матешко. Лауреат премії КМ України ім. Лесі Українки (2017). Орден «За заслуги» 3-го ступеня (2021). Член..."
12375,Матієнко Оксана Володимирівна,1954.0,"м. Магнітогорськ Челябін. обл., РФ",архітектор,"(17. 02. 1954, м. Магнітогорськ Челябін. обл., РФ) – архітектор. Державна премія України у галузі архітектури за проект реконструкції пл. Льва Толстого у Києві (1998). Закін. Київ. інж.-буд. інститут (1978;..."
12377,Матіїв Ігор Олегович,1985.0,Івано-Франківськ,режисер,"(21. 01. 1985, Івано-Франківськ) – режисер. Закін. Київський університет театру, кіно і телебачення (2008; кл. Е. Митницького). Працював у Київ. муз.-драм. театрі ім. П. Саксаганського (м. Біла Церква..."
12378,Матій Петро Петрович,1943.0,"с. Сасово, нині Виноградів. р-ну Закарп. обл.",співак (баритон),"(28. 04. 1943, с. Сасово, нині Виноградів. р-ну Закарп. обл.) – співак (баритон), педагог, композитор, музично-громадський діяч. Народний артист України (1996). Лауреат обл. премій ім. Д. Задора (1995, 1999, 2006),..."
12379,Матійко Наталія Олександрівна,1983.0,Миколаїв,живописець,"(25. 05. 1983, Миколаїв) – живописець, дизайнер інтер’єрів. Дочка О. Ма­­тійка. Член молодіж. об’єдн. НСХУ (2005). Закін. Нац. університет кораблебудування (Миколаїв, 2004; викл. І. Макушина). Від 2005..."
12380,Матійко Олександр Васильович,1950.0,"м. Красноярськ, РФ",живописець,"(18. 10. 1950, м. Красноярськ, РФ) – живописець. Батько Н. Матійко. Заслужений діяч мистецтв України (2013). Обл. премія ім. М. Аркаса (2010). Член НСХУ (1986). Закін. Одес. художнє училище (1978; викл. Г...."
12383,Матіко Іван Іванович,1953.0,с. Дулове Тячів. р-ну Закарп. обл.,художник декоративно-ужиткового мистецтва,"(04. 04. 1953, с. Дулове Тячів. р-ну Закарп. обл.) – художник декоративно-ужиткового мистецтва, живописець, графік. Чоловік М. Матіко. Член НСХУ (1987). Закін. Ужгород. училище приклад. мистецтва (1973;..."
12384,Матіко Марія Юріївна,1954.0,с. Страбичеве Мукачів. р-ну Закарп. обл.,художниця декоративно-ужиткового мистецтва,"(10. 09. 1954, с. Страбичеве Мукачів. р-ну Закарп. обл.) – художниця декоративно-ужиткового мистецтва. Дружина І. Матіка. Обл. премія у галузі образотвор. мистецтва ім. Й. Бокшая та А. Ерделі (2004). Член..."
12385,Матіос Марія Василівна,1959.0,с. Розтоки Путильс. р-ну Чернів. обл.,письменниця,"(19. 12. 1959, с. Розтоки Путильс. р-ну Чернів. обл.) – письменниця, публіцистка, політична діячка. Дружина С. Литвина. Член НСПУ (1986). Національна премія України імені Т. Шевченка (2005). Переможець..."
12386,Матіяш Іван Григорович,1939.0,"містечко Маркопіль, нині село Бродів. р-ну Львів. обл.",графік,"(25. 05. 1939, містечко Маркопіль, нині село Бродів. р-ну Львів. обл.) – графік. Від 1955 – у Ленінграді (нині С.-Петербург), де закін. декор.-оформлювал. відділ. худож. училища (1967). Під час навч...."
12387,Матіяш Богдана Валентинівна,1982.0,Київ,письменниця,"(28. 01. 1982, Київ) – письменниця, перекладачка, літературний критик. Сестра Д. Матіяш, дружина К. Москальця. Премії видавництва «Смолоскип» (2004), Фонду Л. та П. Ковалевих (2010), «Літакцент року..."
12389,Матіяш Дзвінка,1978.0,Київ,письменниця,"(Дзвенислава Валентинівна; 16. 11. 1978, Київ) – письменниця, перекладачка. Сестра Б. Матіяш. Премія Фонду Л. та П. Ковалевих (2013). Закін. Нац. університет «Києво-Могилян. академія» (2002), навч. у..."
