id,name,birth_year,birth_city,profession,bio_text
3840,Гапоченко Іван Іванович,1951.0,с. Семиротівка Лебедин. р-ну Сум. обл.,живописець і графік,"(27. 11. 1951, с. Семиротівка Лебедин. р-ну Сум. обл.) – живописець і графік. Батько Ю. Гапоченко. Член НСХУ (1995), НСМНМУ (1999).
Закін. Київ. інститут театр. мистецтва (1999; викл. І. Зубавіна, О. Мусієнко). Від..."
3841,Гапоченко Юлія Іванівна,1980.0,Суми,живописець,"(01. 10. 1980, Суми) – живописець. Дочка І. Гапоченка. Член НСМНМУ (2001), НСХУ (2002). Закін. Харків. пед. інститут (2004; викл. В. Хмельницький). Працює у галузях станк.
живопису та декор.-ужитк. мистецтва..."
3842,Гаптар Володимир Максимович,1953.0,с. Орловець Городищен. р-ну Черкас. обл.,поет,"(17. 03. 1953, с. Орловець Городищен. р-ну Черкас. обл.) – поет. Син М. Гаптара. Член НСПУ (1990). Літ. премія ім. А. Малишка (1992). Закін. Літ. інститут у Москві (1987). Працював оглядачем Радіотелеграф...."
3844,Гаптенко Віктор Олександрович,1939.0,м. Біла Церква Київ. обл.,співак (тенор),"(12. 05. 1939, м. Біла Церква Київ. обл.) – співак (тенор). Заслужений артист України (1996). Закін. Київське музичне училище ім. Р. Ґлієра (1966; кл. Л. Дорошенко). Від 1962 – арт. хору Нац. опери України (Київ)...."
3845,Гарабач Ярема,1948.0,Мюнхен,скульптор,"(1948, Мюнхен) – скульптор. Золоті медалі Італ. АМ (1979, 1981). Навч. у Рим. (1968– 69), Мюнхен. (1969–74; викл. Г. Крук) АМ. Від 1970 – у США (м. Парма, шт. Огайо). Автор напівабстракт. метал. скульптур. Учасник..."
3848,Гаран Олена Валентинівна,1977.0,Полтава,поетеса,"(05. 09.  1977, Полтава) – поетеса. Член НСПУ (2002). Дипломантка Міжнар. конкурсу молодих літераторів «Гранослов» (2000). Закін. Полтав. пед. інститут (1999). Учителювала. Від 2005 – голова Полтав...."
3856,Гарасимчук Орест,1966.0,Нью-Йорк,український піаніст і композитор у США,"(28. 09. 1966, Нью-Йорк) – український піаніст і композитор у США. Закін. Консерваторію Мейсон Ґросс при Ратґер. університеті (1989; кл. композиції Ч. Вуорінена), навч. в Укр. муз. інституті в Нью-Йорку...."
3859,Гарасюта Роман Федорович,1958.0,Москва,живописець,"(03. 08.  1958, Москва) – живописець. Член НСХУ (1992). Закін. Харків. худож.-пром. інститут (1984). Відтоді працював у Худож. фонді Микол. організації СХУ. Митець поєднує реалізм, абстракцію та романтизм...."
3860,Гарбуз Володимир Васильович,1951.0,с. Карапиші Миронів. р-ну Київ. обл.,графік і живописець,"(21. 12. 1951, с. Карапиші Миронів. р-ну Київ. обл.) – графік і живописець. Член НСХУ (1988). Закін. Укр. полігр. інститут у Львові (1988; викл. Ф. Глущук). Працював оформлювачем «Київоздоббуду» (1972–79); на..."
3861,Гарбуз Роман Степанович,1949.0,с. Шельпаки Підволочис. р-ну Терноп. обл.,скульптор,"(02. 01.  1949, с. Шельпаки Підволочис. р-ну Терноп. обл.) – скульптор. Член НСХУ (1993). Закін. Львів. інститут прикладного та декоративного мистецтва (1971; викл. Ю. Лащук, А. Оверчук, З. Флінта). Від 1972 –..."
3862,Гарбуз Сергій Володимирович,1961.0,м. Свердловськ Луган. обл.,письменник,"(31. 08. 1961, м. Свердловськ Луган. обл.) – письменник. Член НСПУ (1995). Закін. Київський університет (1998).
Працює журналістом. Друкується від 1989. Автор поет. зб. «Яблуко надкушене» (Сокиряни, 1993),..."
3864,Ґарда Орест  Павлович,1965.0,Львів,актор,"(03. 08. 1965, Львів) – актор. Народний артист України (2017). Закін. студію при Львів. укр. драм. театрі ім. М. Заньковецької (1984; кл. Б. Козака, Л. Каганової), факультет укр. філології Львів. університету..."
3867,Гарді-Ковачевич Iрина,1944.0,"с. Руський Керестур, Воєводина, нині Сербія і Чорногорія",русинська поетеса в Сербії й Чорногорії,"(17. 09. 1944, с. Руський Керестур, Воєводина, нині Сербія і Чорногорія) – русинська поетеса в Сербії й Чорногорії. Закiн. фiлол. факультет Новосад. університету (1974). Працювала у видавництві «Руске..."
3872,Гаркавий Олег В’ячеславович,1968.0,"м. Каспійськ, Дагестан, РФ",композитор,"(08. 10. 1968, м. Каспійськ, Дагестан, РФ) – композитор. Член НСКУ (2002). Закін. С.-Петербур. мор. тех. університет (1992), Одес. консерваторію (1998; кл. В. Ніколаєва). Від 1998 – на творчій роботі.

Тв.:..."
3873,Гаркуша Антоніна Степанівна,1947.0,"с. Волоки Гроднен. обл., Білорусь",співачка (колоратурне сопрано),"(25. 06. 1947, с. Волоки Гроднен. обл., Білорусь) – співачка (колоратурне сопрано). Закін. Одес. консерваторію (1973; кл. О. Благовидової). 1973–74 – солістка Одес., від 1975 – Дніпроп. театрів опери та..."
3875,Гаркуша Володимир Захарович,1938.0,м. Павлоград Дніпроп. обл.,співак (тенор),"(06. 01. 1938, м. Павлоград Дніпроп. обл.) – співак (тенор). Заслужений артист УРСР (1990). Дипломант Міжнар. фестивалю-конкурсу «Золоті трембіти» (Івано-Франківськ, 1997). Закін. Одес. консерваторію (1968;..."
3879,Гармаш Анатолій Терентійович,1947.0,Дніпропетровськ,графік і живописець,"(01. 01. 1947, Дніпропетровськ) – графік і живописець. Член НСХУ (1984). Закін. Укр. полігр. інститут у Львові (1976; викл. В. Бунов). Працював художником у КБ «Південне» (Дніпропетровськ, 1966– 77); від 1977 –..."
3880,Гармаш Галина Семенівна,1966.0,м. Кобеляки Полтав. обл.,поетеса,"(27. 11.  1966, м. Кобеляки Полтав. обл.) – поетеса, журналістка. Член НСПУ (2001). Закін. Київський університет (1990). Працювала кор. г. «Наша віра» (1990–94), «Слово Просвіти» (2003–05), від 2005 – ред...."
3883,Гармаш Тамара Іванівна,1963.0,Харків,співачка (ліричне сопрано),"(25. 09.  1963, Харків) – співачка (ліричне сопрано). Заслужений артист України (2004). Лауреатка Міжнар. конкурсу опер. та камер. вокал. музики ім. І. Паторжинського (Луганськ, 1997). Закін. Харків...."
3884,Гармаш Юрій Тимофійович,1947.0,с. Ковалівка Шишац. р-ну Полтав. обл.,кінооператор,"(22. 02. 1947, с. Ковалівка Шишац. р-ну Полтав. обл.) – кінооператор. Член НСКінУ (1980). Закін. ВДІК (1971; майстерня Б. Волчека). Працював освітлювачем Харків. студії телебачення. Від 1972 – оператор Нац...."
3885,Гармаш Людмила Вікторівна,1968.0,Харків,літературознавець,"(20. 06. 1968, Харків) — літературознавець. Доктор філологічних наук (2016), професор (2021). Закінчила Харківські університет (1994, спеціальність «російська мова та література») та педагогічний..."
3887,Гармидер Наталія Геннадіївна,1968.0,Одеса,графік і живописець,"(18. 09.  1968, Одеса) – графік і живописець. Дочка Г. Гармидера та С. Крижевської, онука Г. Крижевського. Член НСХУ (2005). Закін. Одес. художнє училище (1987; викл. Т. Єгорова, С. Крижевська). Працювала в..."
3888,Гармидер Олександр Володимирович,1956.0,с. Леміщиха Жашків. р-ну Черкас. обл.,живописець,"(12. 07. 1956, с. Леміщиха Жашків. р-ну Черкас. обл.) – живописець. Член НСХУ (2005). Закін. Вижниц. училище приклад. мистецтва (Чернів. обл., 1980; викл. І. Баричев). Працював ст. художником ф-ки худож...."
3890,Гарпаш Петро Васильович,1951.0,с. Імстичеве Іршав. р-ну Закарп. обл.,живописець,"(28. 01. 1951, с. Імстичеве Іршав. р-ну Закарп. обл.) – живописець. Член НСХУ (1992). Закін. Львів. інститут прикладного та декоративного мистецтва (1982). Працює у галузях живопису, монум.-декор...."
3897,Гарченко Григорій Миколайович,1949.0,с. Багате Новомосков. р-ну Дніпроп. обл.,письменник,"(30. 01. 1949, с. Багате Новомосков. р-ну Дніпроп. обл.) – письменник. Член НСПУ (1992). Обл. літ. премія ім. І. Сокульського (2004). Закін. Дніпроп. культ.-осв. училище (1973; викл. Г. Шаповал), Літ. інститут у..."
3898,Гаряга Василь Григорович,1946.0,с. Очеретувате Семенів. р-ну Полтав. обл.,співак,"(02. 12. 1946, с. Очеретувате Семенів. р-ну Полтав. обл.) – співак. Заслужений артист УРСР (1976). Закін. Київську консерваторію (1972). Від 1973 – соліст Ансамблю пісні і танцю Київ. військ. округу, 1979– 83 та..."
3900,Гассанов Раміз Фірузович Оглу,1954.0,Баку,скульптор,"(04. 12. 1954, Баку) – скульптор. Член НСХУ (1992). Закін. Харків. худож.-пром. інститут (1988; викл. М. Рябінін, Д. Сова). Від 1990 працював у Хмельн. худож.-вироб. майстернях; від 1993 – викладач Хмельн. дит...."
3901,Гассанова-Тарковська Нінель Сергіївна,1938.0,Київ,мистецтвознавець,"(10. 05.  1938, Київ) – мистецтвознавець. Канд. мистецтвознавства (1980). Член НСХУ (1984). Закін. Моск.технол. інститут місц. промисловості (1968). Працювала н. с. Київ. зонал. НДІ експерим. проектування..."
3902,Гатило Олександр Миколайович,1937.0,Дніпропетровськ,живописець і графік,"(10. 08. 1937, Дніпропетровськ) – живописець і графік. Член НСХУ (1989). Закін. Київський художній інститут (1970). Працює у галузях станк. графіки і живопису. Учасник обл. та респ. мистецьких виставок..."
3903,Гатилова Любов Костянтинівна,1962.0,Київ,художниця декоративно-ужиткового мистецтва,"(27. 01. 1962, Київ) – художниця декоративно-ужиткового мистецтва. Член НСХУ (2000). Закін. Респ. художню школу ім. Т. Шевченка (Київ, 1980), Моск. текстил. інститут (1986). Працювала у Респ. будинку моделей..."
3912,Гах Ірина Степанівна,1964.0,Львів,художниця декоративного скла,"(15. 12.  1964, Львів) – художниця декоративного скла, мистецтвознавець. Член Львів. асоц. художників-вітражистів «Вікно» (1999). Закін. Львів. інститут прикладного та декоративного мистецтва (1989;..."
3916,Гащук Олександр Сергійович,1937.0,"с. Межирічка Голованів. р-ну, нині Кіровогр. обл.",художник-монументаліст,"(13. 09. 1937, с. Межирічка Голованів. р-ну, нині Кіровогр. обл.) – художник-монументаліст, живописець і графік. Член НСХУ (1990). Закін. Одес. художнє училище (1963; викл. М. Павлюк), Львів. інститут..."
3917,Гаюк Володимир Васильович,1951.0,"м. Косів, нині Івано-Фр. обл.",публіцист і видавець,"(25. 07. 1951, м. Косів, нині Івано-Фр. обл.) – публіцист і видавець. Член НСЖУ (1979). Закін. Львівський університет (1974). Від 1986 – директор Львів. музею історії релігії. 1990 заснував видавництво «Логос»...."
3918,Гвардюбров Володимир Дмитрович,1952.0,"с. Верещагіно Смолен. обл., РФ",живописець,"(30. 09. 1952, с. Верещагіно Смолен. обл., РФ) – живописець. Член НСХУ (1992–2003). Закін. Харків. худож.-пром. інститут (1985; викл. Є. Биков, Є. Єгоров, О. Хмельницький). Працює у галузях живопису, монум...."
3922,Гвоздинська Лариса Панасівна,1950.0,м. Карлівка Полтав. обл.,художник-монументаліст і графік,"(11. 05. 1950, м. Карлівка Полтав. обл.) – художник-монументаліст і графік. Дружина В. Гвоздинського. Член НСХУ (1998). Закін. Харків. худож.-пром. інститут (1977; викл. С. Бесєдін, А. Константинопольський)...."
3923,Гвоздинський Віктор В’ячеславович,1951.0,"м. Володимир-Волинський, Волинська область",живописець,"(25.02.1951, м. Володимир-Волинський, Волинська область) — живописець. Чоловік Л. Гвоздинської. Член НСХУ (від 1985 року). Закінчив Харківський художньо-промисловий інститут (1975; викладачі: С...."
3925,Ґданський Володимир  Іванович,1944.0,с. Кожухівка Коростен. р-ну Житомир. обл.,диригент,"(29. 01. 1944, с. Кожухівка Коростен. р-ну Житомир. обл.) – диригент, педагог. Заслужений артист України (2000). Закін. Київське музичне училище ім. Р. Ґлієра (1964; кл. І .Журомського) і консерваторію (1972;..."
3928,Гебрина Марія Іванівна,1954.0,с. Іванівці Кельменец. р-ну Чернів. обл.,живописець,"(14. 11. 1954, с. Іванівці Кельменец. р-ну Чернів. обл.) – живописець. Член НСМНМУ (2001). Закін. Моск. заоч. нар. університет мистецтв (1992; викл. М. Ротанов). Відтоді працює викл. образотвор. мистецтва у..."
3934,Геврик Тит Богданович,1936.0,"м. Дрогобич, нині Львів. обл.",архітектор і мистецтвознавець,"(13. 07. 1936, м. Дрогобич, нині Львів. обл.) – архітектор і мистецтвознавець. Дійсний член НТШ у США, голова секції мистецтвознавства. Член-кореспондент УВАН США. Магістр містобудування (1966). Закін...."
3938,Гедз Микола Сергійович,1960.0,с. Нова Гребля Калинів. р-ну Вінн. обл.,поет,"(13. 02. 1960, с. Нова Гребля Калинів. р-ну Вінн. обл.) – поет. Член НСПУ (2005). Закін. Вінн. пед. інститут (1981). Учителював. Від 1987 – директор Кіров. заг.-осв. школи Калинів. р-ну. Кер. рай. поет. клубу..."
3939,Гедзевич Станіслав Вікторович,1958.0,"м. Орськ Оренбур. обл., РФ",графік і живописець,"(26. 03. 1958, м. Орськ Оренбур. обл., РФ) – графік і живописець. Член НСХУ (1990). Закін. Харків. худож.-пром. інститут (1988; викл. А. Константинопольський, О. Хмельницький). Відтоді – учасник респ. і..."
3943,Гейвандова Каріне Нариманівна,1953.0,Харків,музикознавець,"(19. 01. 1953, Харків) – музикознавець. Канд. мистецтвознавства (1981). Член НСКУ (1985). Закін. Харків. інститут мистецтв (1976; викл. М. Черкашина-Губаренко). Від 1972 – керівник дит. муз. гуртка Палацу..."
3944,Гейдек Олександр Петрович,1971.0,м. Дрогобич Львів. обл.,графік,"(03. 10. 1971, м. Дрогобич Львів. обл.) – графік. Син П. Гейдека. Навч. в Укр. полігр. інституті у Львові (1991–93; викл. В. Таранов). Працював дизайнером видавництва «Коло» (Дрогобич, 1990-і рр.). Від 2000 – у..."
3946,Гейко Марія Дмитрівна,1956.0,Київ,графік,"(04. 12. 1956, Київ) – графік. Сестра О. Гейко-Матусевич. Член НСХУ (1984). Закін. Київський художній інститут (1981; викл. В. Чебаник, А. Чебикін), творчі майстерні АМ СРСР у Києві (кер. М. Дерегус, 1982–85)...."
3948,Геймур Олена,1960.0,Нью-Йорк,співачка (сопрано),"(бл. 1960, Нью-Йорк) – співачка (сопрано), піаністка. Лауреатка конкурсу вокалістів (Нью-Йорк, 1983). Закін. Мангеттен. (1977; кл. фортепіано) та Джульярд. (1983; кл. вокалу) муз. школи в Нью-Йорку...."
3950,Ґелитович Адріан  Борисович,1961.0,Львів,живописець,"(19. 09. 1961, Львів) – живописець. Син Ксенії, онук Миколи, правнук Філарета Колесс, брат О. Ґелитовича. Закін. Львів. інститут прикладного та декоративного мистецтва (1984; викл. О. Мінько), навч. у К...."
3951,Ґелитович Орест  Борисович,1968.0,Львів,графік і живописець,"(22. 07. 1968, Львів) – графік і живописець. Син Ксенії, онук Миколи, правнук Філарета Колесс, брат А. Ґелитовича. Закін. Львів. інститут прикладного та декоративного мистецтва (1992; викл. О. Мінько),..."
3953,Гельман Регіна Юхимівна,1938.0,Київ,скульпторка,"(09. 12.  1938, Київ) – скульпторка. Член НСХУ (1983). Закін. Київський художній інститут (1964; викл. М. Лисенко). Відтоді працювала дизайнером у Київ. філії ВНДІ тех. естетики; від 1971 – на..."
3959,Ґембик Олександр,1949.0,м. Камінь-Каширський Волин. обл.,графік і дизайнер,"(14. 01. 1949, м. Камінь-Каширський Волин. обл.) – графік і дизайнер. Закін. Укр. полігр. інститут у Львові (1976). Розробляє дизайн графіч. систем. Автор логотипів фірм. стилю ВАТ «Волиньагрохім»,..."
3960,Гененко Анатолій Тимофійович,1927.0,"м. Нові Санжари, нині Полтав. обл.",письменник,"(26. 02. 1927, м. Нові Санжари, нині Полтав. обл.) – письменник, журналіст. Батько Ю. Гененка. Член НСПУ (1986). Закін. Донец. пед. інститут (1951). Працював завідувач відділу пропаганди та агітації (1951–55),..."
3961,Генералюк Леся Станіславівна,1962.0,"м. Теребовля, нині Тернопільського р-ну Тернопільської обл.",літературознавець,"(27. 02. 1962, м. Теребовля, нині Тернопільського р-ну Тернопільської обл.) — літературознавець, мистецтвознавець. Доктор філологічних наук (2011). Закінчила Львівський університет (1984). Учителювала;..."
3967,Генріх Адам Людвиґович,1870.0,,архітектор,(бл. 1870 – ?) – архітектор. Закін. С.-Петербур. інститут цивіл. інженерів. У 1894–1918 – гол. арх. м. Євпаторія (нині АР Крим). Гласний Євпаторій. міської думи. У творчості використовував форми...
3969,Геньба Любов Григорівна,1960.0,с. Грушеве Гуляйпіл. р-ну Запоріз. обл.,поетеса,"(28. 02.  1960, с. Грушеве Гуляйпіл. р-ну Запоріз. обл.) – поетеса. Член НСПУ (1997). Закін. Мелітоп. училище культури (Запоріз. обл., 1996; викл. Б. Бервецький, В. Дяченко), Запоріз. університет (2005). Від 1987..."
3970,Георгієнко Володимир Миколайович,1937.0,Херсон,кінорежисер,"(11. 04. 1937, Херсон) – кінорежисер. Закін. Харків. театр. інститут. На студії «Укртелефільм» створив стрічки: «Катерина Твердохліб» (1974, автор сценарію і реж.), «Мости дружби» (1979), «Володимир..."
