id,name,birth_year,birth_city,profession,bio_text
4230,Годунова Ірина Георгіївна,1973.0,Київ,живописець,"(23. 06. 1973, Київ) – живописець. Дочка Лариси, онука Олександра Годунових. Член НСХУ (2000). Закін. Укр. АМ (Київ, 1996; майстерня Ф. Гуменюка). Учасниця всеукр. худож. виставок від 1993. Персон. – у Києві..."
4231,Годунова Лариса Олександрівна,1946.0,Київ,живописець,"(07. 06. 1946, Київ) – живописець. Дочка Олександра, мати Ірини Годунових. Заслужений художник України (2016). Член НСХУ (1978). Закін. Київський художній інститут (1970; майстерня Т. Яблонської). Працювала..."
4232,Гожа Наталія Віталіївна,1960.0,Київ,дизайнер,"(02. 01. 1960, Київ) – дизайнер. Член НСХУ (2003). Закін. Респ. художню школу ім. Т. Шевченка (Київ, 1978; викл. О. Животков), Київ. відділення Укр. полігр. інституту (1984; викл. Б. Валуєнко, Ф. Юр’єв). Працювала..."
4238,Голейко Валерій Петрович,1956.0,Київ,живописець і графік,"(11. 08. 1956, Київ) – живописець і графік. Освіта середня. Організатор мист. соц.-екол. групи «Стронцій–90», засн. і дир. (від 1993) арт-центру «Відродження». Учасник вітчизн. та зарубіж. худож...."
4242,Голембовська Лідія Сергіївна,1953.0,Київ,графік і живописець,"(04. 05. 1953, Київ) – графік і живописець. Дочка С. Голембовської, дружина С. Білостоцького. Член НСХУ (1983). Закін. Київський художній інститут (1978; викл. В. Чебаник), творчі майстерні АМ СРСР у Києві..."
4244,Голенда Йолана 8. 01,1938.0,Ужгород,український літературознавець,"(08. 01. 1938, Ужгород) – український літературознавець, педагог у Словаччині. Закін. Ужгород. університет (1967). Працювала у ред. ж. «Дукля» (1967–72), драматургом Укр. студії чехословац. радіо (1972–73),..."
4245,Голенищев Володимир Митрофанович,1938.0,Харків,дизайнер,"(12. 07. 1938, Харків) – дизайнер, живописець і графік. Член Спілки дизайнерів України (1987). Закін. Харків. худож.-пром. інститут (1970; викл. М. Константинопольський, В. Лістровой, М. Шапошников). Від 1964..."
4246,Голець Ірина Павлівна,1956.0,м. Охтирка Сумської обл.,скульпторка,"(26. 04. 1956, м. Охтирка Сумської обл.) – скульпторка, графік і художник театру. Закінчила Київський художній інститут (1981; майстерня В. Бородая, викладачі Ю. Бондаренко, І. Макогон, В. Швецов),..."
4247,Голець Ярослав Васильович,1941.0,с. Великий Говилів Терноп. р-ну Терноп. обл.,скульптор,"(27. 11. 1941, с. Великий Говилів Терноп. р-ну Терноп. обл.) – скульптор. Закін. Львів. інститут прикладного та декоративного мистецтва (1975; викл. Д. Крвавич, З. Флінта). Відтоді працює на Терноп...."
4248,Голиков Ігор Едуардович,1954.0,Львів,живописець,"(28. 12. 1954, Львів) – живописець. Член НСХУ (1988). Закін. Львів. інститут прикладного та декоративного мистецтва (1977; викл. О. Овсійчук, Ю. Щербатенко). На творчій роботі. Працює у галузях..."
4249,Голинська Ольга Арсеніївна,1958.0,Київ,музикознавець,"(17. 09. 1958, Київ) – музикознавець. Член НСКУ (2000). Закін. Київську консерваторію (1984; кл. Л. Єфремової). 1984–99 працювала у Держ. видавництві «Музична Україна» (Київ): від ред. до пров. муз. ред.; від 1999..."
4250,Голинський Валерій Болеславович,1951.0,"м. Калінінград, РФ",живописець,"(09. 12. 1951, м. Калінінград, РФ) – живописець. Чоловік Т. Диманової-Голинської. Член НСХУ (1986). Закін. Київський художній інститут (1981; майстерня В. Шаталіна). Кер. живописної секції СХ Криму (1987–91);..."
4252,Голицина Галина Євгенівна,1961.0,Донецьк,прозаїк,"(03. 03. 1961, Донецьк) – прозаїк, публіцист. Член НСПУ (1998). Закін. Донец. університет (1985), Інститут економіки, права та систем упр. (Київ, 2004). Працювала у Донец. центрі стандартизації та метрології..."
4255,Голіброда Олександр Євгенович,1936.0,"с. Маркостав, Польща, нині Володимир-Волин. р-ну Волин. обл.",художник декоративно-ужиткового мистецтва,"(04. 06. 1936, с. Маркостав, Польща, нині Володимир-Волин. р-ну Волин. обл.) – художник декоративно-ужиткового мистецтва. Батько Н. Голіброди-Бойко. Бронз. медаль ВДНГ (Москва, 1971). Член НСХУ (1993)...."
4256,Голіброда-Бойко Наталія Олександрівна,1972.0,Сімферополь,живописець,"(24. 11. 1972, Сімферополь) – живописець. Дочка О. Голіброди. Закін. Академію образотвор. мистецтва і архітектури (Київ, 1999; майстерня В. Чеканюка). Учасниця худож. виставок та міжнародних..."
4257,Голіней Роман Юрійович,1974.0,смт Ланчин Надвірнян. р-ну Івано-Фр. обл.,письменник,"(21. 06. 1974, смт Ланчин Надвірнян. р-ну Івано-Фр. обл.) – письменник, фізик. Член НСПУ (2004). Кандидат фізико-математичних наук (2003). Закін. Нац. тех. університет України «Київ. політех. інститут» (1997)...."
4258,Голінчак Степан Олексійович,1946.0,с. Хитар Сколів. р-ну Львів. обл.,художник монументально-декоративного мистецтва,"(29. 10. 1946, с. Хитар Сколів. р-ну Львів. обл.) – художник монументально-декоративного мистецтва, живописець і графік. Закін. Львів. інститут прикладного та декоративного мистецтва (1970; викл. Д...."
4261,Голобородько Василь Іванович,1945.0,"с. Андріанопіль, нині Перевал. р-ну Луган. обл.",поет,"(07. 04. 1945, с. Андріанопіль, нині Перевал. р-ну Луган. обл.) – поет. Член НСПУ (1988). Державна премія України імені Тараса Шевченка (1994). Літ. премія ім. В. Симоненка (1988). Навч. у Київ. університеті (1964–..."
4262,Голобородько Олександр Олександрович,1938.0,м. Дніпродзержинськ Дніпроп. обл.,актор,"(28. 09. 1938, м. Дніпродзержинськ Дніпроп. обл.) – актор. Заслужений артист УРСР (1967), нар. арт. РРФСР (1985). Державна премія СРСР (1977). Закін. Київ. інститут театр. мистецтва (1960; курс М...."
4263,Голобородько Тетяна Василівна,1959.0,Сімферополь,графік,"(09. 09. 1959, Сімферополь) – графік. Член НСХУ (1993). Закін. Укр. полігр. інститут у Львові (1988; викл. А. Попов). Працювала методистом з мистецтвознавства у Крим. будинку художника (1984– 89); викл...."
4265,Голобородько Ярослав Юрійович,1961.0,Херсон,літературознавець,"(27. 09. 1961, Херсон) – літературознавець. Син Юрія та Євдокії, брат Костянтина, онук Костянтина Йосиповича Голобородьків. Доктор філологічних наук (1997), професор (2001). Член АУП (2000). Закін. Херсон...."
4268,Голованов Станіслав Дмитрович,1940.0,"с. Молчаново Амур. обл., РФ",скульптор,"(01. 05. 1940, с. Молчаново Амур. обл., РФ) – скульптор. Член НСХУ. Закін. Одес. пед. інститут (1962), Ленінгр. вище худож.-пром. училище (нині С.-Петербург, 1967; викл. В. Рибалко). Учасник мистецьких виставок..."
4271,Головатий Степан Степанович,1935.0,"с-ще Красний Яр, нині у складі Луганська",графік і живописець,"(25. 07. 1935, с-ще Красний Яр, нині у складі Луганська) – графік і живописець. Член НСХУ (1967). Закін. Харків. худож. інститут (1963; майстерня В. Мироненка). Учителював; від 1964 – оформлювач Донец. худож...."
4272,Головатюк Євген Іванович,1938.0,с. Лозувата Липовец. р-ну Вінн. обл.,режисер,"(28. 09. 1938, с. Лозувата Липовец. р-ну Вінн. обл.) – режисер, актор. Заслужений діяч мистецтв УРСР (1977). Закін. Київ. інститут театр. мистецтва (актор. ф-т, 1961, викл. В. Неллі; режисер. ф-т, 1973, викл. В...."
4274,Головацький Богдан,1943.0,с. Торчиновичі Старосамбір. р-ну Львів. обл.,живописець,"(10. 09. 1943, с. Торчиновичі Старосамбір. р-ну Львів. обл.) – живописець. Закін. Львів. інститут прикладного та декоративного мистецтва (1975; викл. Б. Галицький). Працював гол. художником, проектантом..."
4275,Головач Марія Іванівна,1945.0,"м. Мукачеве, нині Закарп. обл.",письменниця,"(07. 08. 1945, м. Мукачеве, нині Закарп. обл.) – письменниця, перекладачка. Член НСПУ (1990). Навч. у Сімфероп. мед. інституті (1962–64), закін. Азерб. мед. інститут (Баку, 1970). Від 1972 живе в Ужгороді; працювала..."
4277,Головаш Юрій Михайлович,1934.0,Харків,графік і монументаліст,"(05. 05. 1934, Харків) – графік і монументаліст. Член НСХУ (1969). Закін. Харків. худож.-пром. інститут (1965; викл. Г. Бондаренко, В. Мироненко, В. Селезньов). Працював худож. ред. видавництва «Прапор»..."
4279,Головецький Василь Миколайович,1954.0,с. Головецьке Старосамбір. р-ну Львів. обл.,письменник,"(28. 10. 1954, с. Головецьке Старосамбір. р-ну Львів. обл.) – письменник, журналіст. Член НСЖУ (1980), НСПУ (2000). Закін. Львівський університет (1976), Літ. інститут у Москві (1987). У 1976–79 вчителював; 1979–83 –..."
4283,Головін Костянтин Олексійович,1954.0,"м. Зеленокумськ Ставропол. краю, РФ",живописець і графік,"(23. 09. 1954, м. Зеленокумськ Ставропол. краю, РФ) – живописець і графік. Батько О. Головіна. Заслужений діяч мистецтв України (2012). Член НСХУ (1986). Закін. Ленінгр. пед. інститут (нині С.-Петербург, 1977;..."
4284,Головін Олексій Костянтинович,1977.0,"Ленінград, нині С.-Петербург",живописець,"(26. 06. 1977, Ленінград, нині С.-Петербург) – живописець. Син К. Головіна. Закін. Крим. художнє училище (Сімферополь, 1997), С.-Петербур. АМ (2005; викл. А. Бистров, С. Рєпін, В. Песиков). Учасник обл., всеукр...."
4285,Головін Юрій Аркадійович,1945.0,"с. Отказне Ставроп. краю, РФ",актор,"(02. 01. 1945, с. Отказне Ставроп. краю, РФ) – актор. Народний артист України (2002). Закін. Ленінгр. інститут театру, музики та кінематографії (1966; викл. Т. Сойнікова). Працював у театрах Ленінграда..."
4290,Головко Дмитро Андрійович,1933.0,с. Піски Бобровиц. р-ну Черніг. обл.,письменник,"(17. 12. 1933, с. Піски Бобровиц. р-ну Черніг. обл.) – письменник. Член НСПУ (1974). Літ. премія ім. П. Тичини (1993). Закін. Київ. худож.-ремісн. училище (1952; викл. О. Патана) та Київ. університет (1958). Працював у..."
4295,Головньова Любов Миколаївна,1959.0,с. Білогриве Кролевец. р-ну Сум. обл.,співачка (сопрано),"(12. 05. 1959, с. Білогриве Кролевец. р-ну Сум. обл.) – співачка (сопрано). Заслужений артист України (2007). Закін. Сум. культ.-осв. училище (1978; викл. А. Алевченко). Від 1979 – солістка Черкас. нар. хору при..."
4297,Головня Едуард Володимирович,1933.0,Київ,режисер кіно і телебачення,"(17. 08. 1933, Київ) – режисер кіно і телебачення. Член НСКінУ (1971). Заслужений діяч мистецтв України (1998). Закінчив Київський інститут театрального мистецтва (1956; майстерня М. Крушельницького)...."
4298,Головчак Олег Іванович,1951.0,"с. Новичка Долин. р-ну Станіслав., нині Івано-Фр. обл.",архітектор,"(01. 03. 1951, с. Новичка Долин. р-ну Станіслав., нині Івано-Фр. обл.) – архітектор. Член НСАУ (1978). Закін. Львів. політех. інститут (1974). Працював гол. арх. проектів в АТ «Терно-Корс» (1986–97); у ТВП..."
4302,Головчук Ярослав Володимирович,1932.0,"с. Вербівці, нині Теребовлян. р-ну Терноп. обл.",співак (тенор),"(24. 11. 1932, с. Вербівці, нині Теребовлян. р-ну Терноп. обл.) – співак (тенор). Заслужений артист УРСР (1968). Державна премія Грузії ім. З. Паліашвілі (1973). Закін. Львів. консерваторію (1965; кл. П...."
4305,Голод Роман Богданович,1968.0,с. Сарники Рогатин. р-ну Івано-Фр. обл.,літературознавець,"(02. 12. 1968, с. Сарники Рогатин. р-ну Івано-Фр. обл.) – літературознавець. Доктор філологічних наук (2006). Закін. Львівський університет (1994). Працював 1997–2002 у Івано-Фр. мед. академії: від 2001 –..."
4306,Голодик Микола,1924.0,"містечко Гришине, нині м. Красноармійськ Донец. обл.",живописець,"(27. 07. 1924, містечко Гришине, нині м. Красноармійськ Донец. обл.) – живописець, скульптор, співак (баритон). Золота медаль і 1-е м. за стін. розпис «Утеча» (1955). Лауреат конкурсу вокалістів (Ла-Плата,..."
4309,Гололобова Ірина Анатоліївна,1963.0,"м. Таганрог Ростов. обл., РФ",художник театру,"(14. 06. 1963, м. Таганрог Ростов. обл., РФ) – художник театру. Закін. Харків. худож.-пром. інститут (1987). Відтоді працювала у Ворошиловгр. (нині Луган.) театрі ляльок: від 1995 – гол. художник. Від 2001 – на..."
4314,Голота Любов Василівна,1949.0,м. Кривий Ріг Дніпроп. обл.,письменниця,"(31. 12. 1949, м. Кривий Ріг Дніпроп. обл.) – письменниця. Дружина П. Мовчана. Національна премія України імені Т. Шевченка (2008). Член НСПУ (1977). Всесоюз. премія ім. В. Маяковського (1982), Літ. премія ім. В...."
4315,Голота Людмила Григорівна,1943.0,"м. Пржевальськ, Киргизстан",графік,"(27. 08. 1943, м. Пржевальськ, Киргизстан) – графік. Дружина А. Крвавича. Член НСХУ (1972). Закін. Київський художній інститут (1967; викл. І. Селіванов, Л. Чичкан). Учасниця всеукр. мистецьких виставок від..."
4317,Голощук Олександр Вікторович,1946.0,"с. Нижня Кринка Сталін. обл., нині смт Донец. обл.",художник театру і графік,"(18. 01. 1946, с. Нижня Кринка Сталін. обл., нині смт Донец. обл.) – художник театру і графік. Член НСХУ (1992). Закін. Одес. театр.-художнє училище (1971; викл. В. Кара-Гіаур, Т. Козлова). Працював бутафором на..."
4318,Голояд Богдан Маркович,1967.0,"м. Бурштин Галицького, нині Івано-Франківського р-ну Івано-Франківської обл.",скульптор,"(06. 05. 1967, м. Бурштин Галицького, нині Івано-Франківського р-ну Івано-Франківської обл.) — скульптор, графік, живописець. Син Г. Голояд. Закінчив Республіканську художню школу імені Т. Шевченка..."
4320,Голуб Олена Євгенівна,1951.0,Київ,живописець і мистецтвознавець,"(25. 12. 1951, Київ) – живописець і мистецтвознавець. Член андеґраунд. виставк. об’єдн. «Рух» (1977), НСХУ (2003). Закін. Київський університет (1974), Інститут журналіст. майстерності (Київ, 1986; викл. В...."
4321,Голуб Сергій Олександрович,1947.0,с. Василівка Лебедин. р-ну Сум. обл.,хоровий диригент,"(19. 01. 1947, с. Василівка Лебедин. р-ну Сум. обл.) – хоровий диригент, педагог. Заслужений працівник культури УРСР (1991). Закін. муз.-пед. факультет Ніжин. пед. інституту (Черніг. обл., 1974),..."
4324,Голуб Василь Григорович,1946.0,с. Кам’янка Дикан. р-ну Полтав. обл.,актор,"(26. 03. 1946, с. Кам’янка Дикан. р-ну Полтав. обл.) – актор. Народний артист України (2006). Орден «За заслуги» 3-го (2025) ступеня. Закін. Київ. інститут театр. мистецтва (1971; курс М. Карасьова)...."
4326,Голубенко Євген Іванович,1956.0,м. Кам’янець-Подільський Хмельницької обл.,художник кіно,"(04. 11. 1956, м. Кам’янець-Подільський Хмельницької обл.) — художник кіно, декоратор, постановник. Чоловік К. Муратової. Кінопремія «Золотий овен» (2004). Закінчив Одеське художнє училище (1977;..."
4328,Голубець Орест Михайлович,1954.0,Львів,мистецтвознавець,"(25. 10. 1954, Львів) – мистецтвознавець. Син М. Голубця, брат Р. Грималюк. Доктор мистецтвознавства (2003), член-кореспондент НАМУ (2017). Член НСХУ (1986). Закін. Львів. інститут прикладного та..."
4329,Голубєв Василь Іванович,1921.0,"с. Кошево Новосибір. обл., Росія",живописець,"(02. 04. 1921, с. Кошево Новосибір. обл., Росія) – живописець. Член СХУ. Учасник 2-ї світової війни. Бойові та держ. нагороди. Жив у Калуші. Працював на Івано-Фр. худож.-вироб. комбінаті. Брав участь в..."
4333,Голубєва Ольга Володимирівна,1960.0,"с-ще Мундибаш Кемеров. обл., РФ",поетеса,"(31. 01. 1960, с-ще Мундибаш Кемеров. обл., РФ) – поетеса. Член НСПУ (2003). Закін. Сімфероп. університет (1984). Працювала 1984–97 у Сімфероп. бюро мандрівок та екскурсій, 1997–99 – у Респ. палаці культури..."
4336,Голубкова Катерина Олександрівна,1946.0,"смт Пам’яті 13 Борців Краснояр. краю, РФ",поетеса,"(05. 11. 1946, смт Пам’яті 13 Борців Краснояр. краю, РФ) – поетеса. Член НСПУ (1979). Закін. Ленінгр. університет (1975). Працювала на виробництві; кер. літ. об’єдн. «Стапель», заст. гол. ред. Микол. обл...."
4339,Голубов Іван Васильович,1950.0,Одеса,композитор,"(23. 06. 1950, Одеса) – композитор, музикознавець. Заслужений діяч мистецтв України (1999). Член НСКУ (1990). Обл. премія ім. Е. Багрицького (1982). Лауреат низки респ. і всесоюз. конкурсів композиторів...."
4343,Голубченко Дмитро Григорович,1938.0,с. Олександродар Петрів. р-ну Кіровогр. обл.,актор,"(04. 10. 1938, с. Олександродар Петрів. р-ну Кіровогр. обл.) – актор. Заслужений артист РРФСР (1981). Закін. Дніпроп. театр. училище (1962; викл. І. Кобринський). Працював у Дніпроп. рос. драм. театрі ім. М...."
