id,name,birth_year,birth_city,profession,bio_text
3708,Гайда Ігор Федорович,1939.0,Харків,віолончеліст,"(22. 12. 1939, Харків) – віолончеліст. Доц. (1993). Закін. Харків. інститут мистецтв (1964; кл. Г. Авер’янова), де й викладає від 1968 (нині університет): від 1993 – завідувач кафедри камер. ансамблю та струн...."
3709,Гайдабура Валерій Михайлович,1937.0,"м. Гуляйполе, нині Запоріз. обл.",театрознавець,"(01. 07. 1937, м. Гуляйполе, нині Запоріз. обл.) – театрознавець. Син М. Гайдабури. Доктор мистецтвознавства (2000). Член-кореспондент АМУ (2004). Заслужений діяч мистецтв УРСР (1990). Орден «За заслуги» 3-го..."
3721,Гайдамака Христина Анатоліївна,1969.0,Київ,дизайнер і живописець,"(27. 05. 1969, Київ) – дизайнер і живописець. Дочка А. Гайдамаки та Л. Міщенко. Член НСХУ (1996). Закін. Київ. худож.-пром. технікум (1989). Працювала 1991–96 на Київ. монум.-декор. комбінаті; 1997 – дизайнер..."
3723,Гайдар Станіслав Григорович,1947.0,смт Кринички Дніпроп. обл.,культурний діяч,"(29. 08. 1947, смт Кринички Дніпроп. обл.) – культурний діяч. Заслужений діяч мистецтв України (2004). Закін. Харків. інститут культури (1971), Київ. університет театру, кіно і телебачення (2005). Працював..."
3724,Гайдар Андрій Миколайович,1971.0,Дніпропетровськ,живописець,"(10. 02. 1971, Дніпропетровськ) – живописець. Член НСХУ (2005). Навч. у Варшав. АМ (1993–94), закін. Укр. АМ (Київ, 1996; викл. П. Басанець). Працює у ній від 1998 (нині Нац. академія образотвор. мистецтва і..."
3725,Гайдар-Прудка Ольга Олександрівна,1939.0,"ст. Джула Самарканд. обл., нині Узбекистан",скульпторка,"(26. 08. 1939, ст. Джула Самарканд. обл., нині Узбекистан) – скульпторка. Член НСХУ (1974). Закін. Київський художній інститут (1967; викл. В. Бородай, М. Вронський). Від 1974 – худож. кер. скульптур. цеху,..."
3726,Гайдаренко Аркадій Григорович,1939.0,Херсон,співак (ліричний тенор),"(08. 03. 1939, Херсон) – співак (ліричний тенор). Заслужений артист УРСР (1973). Соліст ансамблів пісні і танцю: Таврійського (1954–58), Одес. військ. округів (1958–64), прикордон. військ Зх. прикордон. округу..."
3727,Гайденко Анатолій Павлович,1937.0,"с. Хорошеве, нині смт Харків. р-ну Харків. обл.",композитор,"(24. 12.  1937, с. Хорошеве, нині смт Харків. р-ну Харків. обл.) – композитор, педагог. Батько І. Гайденка. Професор (1995). Заслужений діяч мистецтв України (1993). Член НСКУ (1977). Премія ім. Б. Лятошинського..."
3728,Гайденко Іван Олександрович,1898.0,,художник театру і скульптор,"(30. 03 (11. 04). 1898, с. Сипарня – ?) – художник театру і скульптор. Навч. у Харків. худож. інституті (1923–25). Оформив вистави: «Маруся Богуславка» М. Старицького (Черкас. драм. театр, 1924), «Справа честі»..."
3729,Гайденко Ігор Анатолійович,1961.0,смт Хорошеве Харків. р-ну Харків. обл.,композитор,"(11. 01. 1961, смт Хорошеве Харків. р-ну Харків. обл.) – композитор, педагог. Син А. Гайденка. Канд. мистецтвознавства (2005). Член НСКУ (1992). Лауреат Всеукр. конкурсу ім. В. Косенка (Одеса, 1995), Міжнар...."
3733,Гайдук Василь Михайлович,1938.0,"с. Доробратове, нині Іршав. р-ну Закарп. обл.",хоровий диригент,"(01. 02. 1938, с. Доробратове, нині Іршав. р-ну Закарп. обл.) – хоровий диригент, композитор, педагог. Член НСКУ (1999). Обл. премія ім. Д. Задора (1999, 2001). Лауреат 2-го Всесоюз. фестивалю нар. творчості (1978,..."
3740,Гайжевська Любов  Олександрівна,1962.0,с. Некрасове Вінн. р-ну Вінн. обл.,поетеса,"(01. 05. 1962, с. Некрасове Вінн. р-ну Вінн. обл.) – поетеса. Член НСПУ (2004). Лауреатка Міжнар. конкурсу молодих літераторів «Гранослов» (1994). Навч. у Київ. університеті (1980–83). Працювала у Вінн...."
3742,Гайовий Григорій Титович,1937.0,с. Степанівка Менського р-ну Черніг. обл.,письменник,"(04. 02. 1937, с. Степанівка Менського р-ну Черніг. обл.) – письменник, журналіст. Член НСПУ (1999). Від 1955 навч. у Київ. університеті, 1957 відрахований «за невиконання навч. програми» (насправді – за..."
3743,Гайовий Михайло Васильович,1972.0,с. Чемер Козелец. р-ну Черніг. обл.,живописець,"(03. 11. 1972, с. Чемер Козелец. р-ну Черніг. обл.) – живописець. Член НСХУ (2003). Закін. Академію образотвор. мистецтва та архітектури (Київ, 1999; викл. М. Стороженко). Працює у галузях монум. і станк...."
3744,Гайчук Василь Павлович,1955.0,Київ,живописець,"(21. 06. 1955, Київ) – живописець. Син Т. Гайчук-Раздорської і П. Гайчука, чоловік Т. Гайчук-Білоусової. Закін. Респ. художню школу ім. Т. Шевченка (Київ, 1970). Працює реставратором у МТМК (від 1981)...."
3746,Гайчук-Білоусова Тамара Сергіївна,1958.0,Дніпропетровськ,графік і реставратор,"(02. 12. 1958, Дніпропетровськ) – графік і реставратор. Дружина В. Гайчука. Орден «За заслуги» 3-го ступеня (2020). Закін. Дніпроп. художню школу та монтаж. технікум (відділ. архітектури, 1980; викл. П...."
3750,Гакман Микола Михайлович,1959.0,с. Остриця Чернівецького р-ну Чернівецької обл.,скрипаль,"(11. 05. 1959, с. Остриця Чернівецького р-ну Чернівецької обл.) — скрипаль, музично-громадський діяч, педагог. Заслужений артист України (2009). Закінчив Чернівецьке музичне училище (1978; кл. скрипки Г...."
3752,Галаєва Оксана Миколаївна,1980.0,"с. Фрунзе Сакського, нині Багайли Євпаторійського р-ну, АР Крим",поетеса,"(09. 10. 1980, с. Фрунзе Сакського, нині Багайли Євпаторійського р-ну, АР Крим) — поетеса. Членкиня НСПУ (2013). Переможниця та дипломантка низки літературних конкурсів (імені В. Нестайка,..."
3753,Галайда Ілля Павлович,1931.0,"с. Чертіжне, округ Меджилабірці, нині Словаччина",український письменник,"(01. 08. 1931, с. Чертіжне, округ Меджилабірці, нині Словаччина) – український письменник, педагог і художник у Словаччині. Член НСПУ (1995). Кандидат філологічних наук (1972). Від 1952 навч. у Карловому..."
3755,Галата Василь Опанасович,1938.0,с. Лебедин Шполян. р-ну Черкас. обл.,актор,"(01. 02.  1938, с. Лебедин Шполян. р-ну Черкас. обл.) – актор. Заслужений артист України (2002). Закін. Харків. інститут мистецтв (1967; курс В. Чистякової). Працював у Харків. театрі муз. комедії (1967–68),..."
3756,Галатін Олег Іванович,1940.0,"м. Чита, РФ",художник декоративно-ужиткового мистецтва,"(09. 09. 1940, м. Чита, РФ) – художник декоративно-ужиткового мистецтва. Член СА СРСР (1973), НСХУ (1986–2004). Закін. Київський художній інститут (1969). Працював ст. арх. Керч. відділу «Гіпроград» (нині АР..."
3758,Галдецька Світлана Володимирівна,1972.0,"с. Буда-Варовичі Поліс. р-ну Київ. обл., нині зона відчуження",живописець,"(22. 01. 1972, с. Буда-Варовичі Поліс. р-ну Київ. обл., нині зона відчуження) – живописець. Член НСХУ (2000). Закін. Укр. АМ (1997; майстерня В. Пузиркова). На творчій роботі. Учасниця всеукр. та міжнар...."
3760,Галета Олена Ігорівна,1975.0,Львів,поетеса,"(22. 09. 1975, Львів) – поетеса, літературознавець. Член НСПУ (1997), АУП (1999). Кандидат філологічних наук (2001). Закін. Львівський університет (1997), де відтоді й працює: від 2002 – доцент, одночасно від 2005..."
3761,Галинська Галина Іванівна,1947.0,Київ,графік,"(02. 01. 1947, Київ) – графік. Дружина В. Гордійчука. Заслужений діяч мистецтв УРСР (1990). Професор (1995). Член НСХУ (1977). Закін. Київський художній інститут (1972; викл. В. Касіян, В. Чебаник, О. Яблонська),..."
3763,Галиняк Іван Антонович,1931.0,"с. Суходіл, нині Гусятин. р-ну Терноп. обл.",співак (баритон),"(17. 01. 1931, с. Суходіл, нині Гусятин. р-ну Терноп. обл.) – співак (баритон). Заслужений артист УРСР (1974). Державні нагороди СРСР. Закін. Борщів. с.-г. технікум (Терноп. обл., 1950). У 1954– 62 – соліст держ...."
3765,Галицький Василь Дмитрович,1926.0,"с. Зазим’я, нині Бровар. р-ну Київ. обл.",хоровий диригент,"(10. 06.  1926, с. Зазим’я, нині Бровар. р-ну Київ. обл.) – хоровий диригент, педагог. Професор (1994). Учасник 2-ї світової війни. Бойові нагороди. Закін. Київське музичне училище (1949; кл. Г. Жуковського,..."
3768,Галицький Микола Іванович,1950.0,с. Верхні Торгаї Нижньосірогоз. р-ну Херсон. обл.,графік,"(20. 05. 1950, с. Верхні Торгаї Нижньосірогоз. р-ну Херсон. обл.) – графік. Член НСХУ (1989). Закін. Укр. полігр. інститут у Львові (1983; викл. В. Бунов). Працював гол. художником Запоріз. худож.-вироб...."
3769,Галицький Сергій Феодосійович,1960.0,Хмельницький,дизайнер,"(12.  12. 1960, Хмельницький) – дизайнер. Член НСХУ (1993). Закін. Харків. худож.-пром. інститут (1986; викл. С. Павлов, В. Сидоренко). Працював 1988–92 у Хмельн. худож.-вироб. майстернях. Учасник респ...."
3770,Галич Артем Олександрович,1985.0,Рівне,літературознавець,"(16. 01. 1985, Рівне) — літературознавець. Син Олександра та Валентини Галичів. Доктор філологічних наук (2017), професор (2020). Закінчив Луганський педагогічний університет (2006), де й працює від 2002..."
3773,Галич Юрій Ілліч,1952.0,"м. Керкі, Туркменістан",живописець,"(28. 02. 1952, м. Керкі, Туркменістан) – живописець. Член НСХУ (1990). Закін. Харків. худож.-пром. інститут (1974; викл. С. Бесєдін, А. Константинопольський). Працює у ньому (нині академія дизайну та..."
3774,Галич-Бондаренко Лариса Григорівна,1972.0,Полтава,живописець,"(20. 01.  1972, Полтава) – живописець. Член НСХУ (2003). Закін. Академію образотвор. мистецтва та архітектури (Київ, 1998; майстерня М. Стороженка). Працювала в Архіт.-проект. бюро при Адміністрації..."
3775,Галичин Іван Григорович,1927.0,Полтава,живописець,"(05. 05. 1927, Полтава) – живописець, графік і художник декоративно-ужиткового мистецтва. Медалі ВДНГ УРСР (1971, 1976, 1978, 1983), диплом ВДНГ СРСР (1968). Член НСМНМУ (1991). Закін. Ленінгр. вище худож.-пром...."
3776,Галій Марія Василівна,1940.0,Львів,співачка (сопрано),"(01. 01.  1940, Львів) – співачка (сопрано), педагог. Заслужений артист України (1995). Закін. істор.-теор. факультет Львів. (1963) та вокал. факультет Одес. (1966; кл. О. Благовидової) консерваторій. Виступала..."
3777,Галімон Анатолій Андрійович,1936.0,"с. Градизьк, нині смт Глобин. р-ну Полтав. обл.",режисер,"(28.  11. 1936, с. Градизьк, нині смт Глобин. р-ну Полтав. обл.) – режисер, актор. Заслужений діяч мистецтв України (1993). Закін. Київ. інститут театр. мистецтва (1969; курс І. Чабаненка). Працював актором у..."
3779,Галіцин Олександр Анатолійович,1955.0,"м. Валуйки Бєлгород. обл., РФ",поет,"(20. 12. 1955, м. Валуйки Бєлгород. обл., РФ) – поет, промисловець. Член НСПУ (2000). Закін. Харків. політех. інститут (1983). Відтоді працював на виробництві; 1986–90 – нач. штабу молодіжно-житл. комплексу;..."
3780,Галічин Микола Єгорович,1931.0,"с. Панкрушиха Алтай. краю, РФ",живописець і художник театру,"(21. 12. 1931, с. Панкрушиха Алтай. краю, РФ) – живописець і художник театру. Член НСХУ (1966). Закін. Алма-атин. художнє училище (1957; викл. А. Черкаський). Працював гол. художником Акмолин. драм. театру..."
3785,Галочкіна Тетяна Валентинівна,1959.0,Київ,живописець,"(06. 05. 1959, Київ) – живописець, графік, дизайнер і скульпторка. Дочка В. Галочкіна та Ю. Укадер. Член НСХУ (2000). Закін. Київський художній інститут (1987; викл. А. Стороженко). Працювала на Київ...."
3789,Галушканич Василь Станіславович,1924.0,"с. Волосянка Великоберезнян. р-ну, нині Закарп. обл.",живописець,"(1924, с. Волосянка Великоберезнян. р-ну, нині Закарп. обл.) – живописець. Лауреат 2-го всесоюз. фестивалю нар. творчості (1987). Закін. Івано-Фр. пед. інститут (1964). Учителював. Учасник обл., респ...."
3790,Галчак Анна,1929.0,"м. Меджилаборці, нині Словаччина",українська письменниця у Словаччині,"(11. 04. 1929, м. Меджилаборці, нині Словаччина) – українська письменниця у Словаччині. 1952–63 жила у Чертіжному, згодом у Гуменному та Липанах. Від 1963 працює інж. у Меджилаборцях. Низку поезій Г...."
3791,Галчанський Олександр Дмитрович,1959.0,Запоріжжя,графік і живописець,"(12. 07. 1959, Запоріжжя) – графік і живописець. Брат С. Галчанського, чоловік Т. Висоцької. Член НСХУ (1989). Закін. Київський художній інститут (1988; майстерня В. Чебаника). Від 1980 – учасник респ.,..."
3792,Галчанський Сергій Дмитрович,1954.0,Запоріжжя,живописець і графік,"(21. 11. 1954, Запоріжжя) – живописець і графік. Брат О. Галчанського. Член НСХУ (1988). Закін. Київський художній інститут (1983; викл. В. Шаталін), навч. у твор. майстернях АМ СРСР у Києві (кер. Т...."
3794,Гальперін Юлій Аркадійович,1928.0,Одеса,графік,"(12. 03.  1928, Одеса) – графік. Заслужений художник України (1995). Член НСХУ (1971). Закін. Моск. полігр. інститут (1965; викл. Ю. Бурджелян, А. Гончаров, В. Житеньов). Працював художником-кореспондентом обл...."
3799,Гальченко Сергій Анастасійович,1947.0,"с. Пустовійти, нині Миронів. р-ну Київ. обл.",літературознавець,"(12. 08. 1947, с. Пустовійти, нині Миронів. р-ну Київ. обл.) – літературознавець, архівіст. Кандидат філологічних наук (1987). Член НСПУ (2000). Дійсний член НТШ (2025). Орден «За заслуги» 3-го ступеня (2017)...."
3800,Гальчинська-Куліш Віра Михайлівна,1941.0,"с. Старий Орлик Кишеньків. р-ну Полтав. обл., нині затопл. водами Кременчуц. вод",письменниця,"(14. 01. 1941, с. Старий Орлик Кишеньків. р-ну Полтав. обл., нині затопл. водами Кременчуц. водосховища) – письменниця. Член НСПУ (2005). Закін. буд. технікум. Працює за фахом. Авторка зб. поезій «Де..."
3801,Галябарда Степан Петрович,1951.0,с. Суходіл Гусятин. р-ну Терноп. обл.,поет-пісняр,"(02. 12. 1951, с. Суходіл Гусятин. р-ну Терноп. обл.) – поет-пісняр, культурний діяч. Заслужений діяч мистецтв України (1996). Орден «За заслуги» 3-го ступеня (2001). Закін. Чернів. університет (1973). Відтоді..."
3802,Гамаль Володимир Ілліч,1948.0,"с. Рогізна, нині у складі Чернівців",скульптор,"(07. 10.  1948, с. Рогізна, нині у складі Чернівців) – скульптор. Обл. літ.-мист. премія ім. С. Воробкевича (2000). Член НСХУ (1986). Закін. Вижниц. училище ужитк. мистецтва (Чернів. обл., 1970; викл. В...."
3804,Гамар Володимир Олексійович,1946.0,"м. Старобільськ, нині Луган. обл.",скрипаль,"(11. 04. 1946, м. Старобільськ, нині Луган. обл.) – скрипаль, педагог. Заслужений артист України (2007). Закін. Донец. муз.-пед. інститут (1970; кл. В. Тіткова). Відтоді – арт., від 1994 – концертмейстер..."
3806,Гамирін Володимир Іванович,1950.0,м. Миргород Полтав. обл.,художник декоративної кераміки,"(26. 02.  1950, м. Миргород Полтав. обл.) – художник декоративної кераміки, живописець і графік. Закін. Миргород. керам. технікум (1969; викл. Т. Мірошниченко, Л. Статкевич, В. Ханко), Львів. інститут..."
3807,Гамкало Іван-Ярослав Дмитрович,1939.0,"с. Городище Королівське, нині Жидачів. р-ну Львів. обл.",диригент,"(01. 05. 1939, с. Городище Королівське, нині Жидачів. р-ну Львів. обл.) – диригент, педагог, музикознавець, музично-громадський діяч. Професор (1991). Член-кореспондент АМУ (2001). Народний артист УРСР..."
3811,Гандзюк Степан Миколайович,1943.0,с. Гальчинці Теофіпол. р-ну Хмельн. обл.,живописець,"(18. 08. 1943, с. Гальчинці Теофіпол. р-ну Хмельн. обл.) – живописець. Член НСХУ (1993). Закін. Одес. художнє училище (1969; викл. А. Лоза). Учасник обл., респ., всесоюз. мистецьких виставок від 1979.
Персон. – у..."
3815,Ґанзбурґ Григорій  Ізраїльович,1954.0,Харків,музикознавець,"(25. 09. 1954, Харків) – музикознавець, композитор, педагог. Член НСКУ (1989), Національної всеукраїнської музичної спілки (1992). Премія ім. І. Слатіна (1997). Закін. Харків. спеціаліз. муз. школу (1973; кл...."
3817,Ганзенко Володимир Миколайович,1949.0,с. Сулимівка Бориспіл. р-ну Київ. обл.,скульптор,"(02. 01. 1949, с. Сулимівка Бориспіл. р-ну Київ. обл.) – скульптор. Член НСХУ (1989). Закін. Київський художній інститут (1981; викл. В. Бородай, І. Макогон, В. Швецов). Працював 1981–91 на Київ...."
3820,Ганноченко Олександр Павлович,1952.0,"м. Краматорськ, нині Донец. обл.",актор,"(18. 04. 1952, м. Краматорськ, нині Донец. обл.) – актор. Народний артист України (2018). Закін. Харків. інститут мистецтв (1973; викл. Т. Ольховський, Н. Богомолова). Працював
у Крим. рос. драм. театрі ім. М...."
