id,name,birth_year,birth_city,profession,bio_text
11428,Лозова Оксана Євгенівна,1963.0,с. Неслухів Кам’янка-Бузького р-ну Львів. обл.,письменниця,"(02. 05. 1963, с. Неслухів Кам’янка-Бузького р-ну Львів. обл.) – письменниця, перекладачка. Член НСПУ (2000). Літ. премія ім. М. Шашкевича (2010). Закін. Львівський університет (1987). Працювала на Львів...."
11429,Лозовенко Сергій Петрович,1951.0,"м. Красний Сулін Ростов. обл., РФ",актор,"(03. 08. 1951, м. Красний Сулін Ростов. обл., РФ) – актор. Заслужений артист України (1992). Закін. Ярославл. театр. училище (РФ, 1975; викл. М. Коваль, С. Тихонов). Працював у театрах Горького (нині Нижній..."
11433,Лозовська Віра Леонідівна,1980.0,Київ,живописець,"(01. 04. 1980, Київ) – живописець. Член НСХУ (2008). Закін. Нац. академію обра­зотвор. мистецтва (Київ, 2004; майстерня М. Стороженка). На творчій роботі. Учасниця обл., всеукр., міжнар. мистецьких виставок..."
11434,Лозовський Анатолій Максимович,1957.0,м. Глухів Сум. обл.,піаніст,"(10. 02. 1957, м. Глухів Сум. обл.) – піаніст, педагог. Доц. (2011). Заслужений артист України (2010). Закін. Донец. муз.-пед. інститут (1987; кл. Н. Чеснокової), де відтоді й викладає (нині муз. академія): від 2007 –..."
11437,Лозовський Станіслав Анатолійович,1981.0,Рівне,актор,"(12. 06. 1981, Рівне) – актор, режисер. Заслужений артист України (2015). Закін. Рівнен. гуманітар. університет (2003; викл. В. Богатирьов). Від 1998 працює у Рівнен. театрі ляльок; водночас від 2003 – у Рівнен...."
11438,Лоїк Григорій Іванович,1963.0,"с. Голгоча Бережан. р-ну, нині Волиця Підгаєц. р-ну Терноп. обл.",живописець,"(17. 06. 1963, с. Голгоча Бережан. р-ну, нині Волиця Підгаєц. р-ну Терноп. обл.) – живописець, графік, художник театру. Заслужений художник України (2019). Диплом всеукр. фестивалю «Терноп. театр...."
11447,Ломакін Віктор Григорович,1946.0,"с. Олень-Колодязь Воронез. обл., РФ",співак (тенор),"(28. 09. 1946, с. Олень-Колодязь Воронез. обл., РФ) – співак (тенор). Заслужений артист УРСР (1979). Лауреат Всесоюз. конкурсу вокалістів ім. М. Глінки (Ташкент, 1977, 2-а премія). Закін. Харків. інститут..."
11448,ломанець Валерій Абрамович,1943.0,"м. Курґан-Тюбе, Таджики­стан",піаніст,"(28. 01. 1943, м. Курґан-Тюбе, Таджики­стан) – піаніст, педагог. Заслужений артист УРСР (1986). Кращий концертмейстер конкурсу молодих опер. співаків фестивалю «Молоді голоси» (Одеса, 1980), 1-го Міжнар...."
11451,Ломко Світлана Анатоліївна,1964.0,"м. Жданов, нині Маріуполь Донец. обл.",співачка (мецо-сопрано),"(16. 03. 1964, м. Жданов, нині Маріуполь Донец. обл.) – співачка (мецо-сопрано). Заслужений артист України (2009). Лауреатка Всеукр. пісен. фестивалю-конкурсу ім. М. Маш­­кіна (м. Іршава Закарп. обл., 2000)..."
11452,Ломовський Анатолій Анатолійович,1978.0,Київ,живописець,"(21. 08. 1978, Київ) – живописець. Син А. Ломовського. Член НСХУ (2003). Закін. Нац. академію образотвор. мистецтва та архітектури (Київ, 2003; викл. Л. Вітковський, М. Гуйда, В. Шаталін). Працював 2003–15 ст...."
11453,Ломовський Анатолій Іванович,1944.0,м. Дніпродзержинськ Дніпроп. обл.,живописець,"(16. 10. 1944, м. Дніпродзержинськ Дніпроп. обл.) – живописець. Батько А. Ло­мовського. Заслужений діяч мистецтв України (2004). Член НСХУ (1982). Закін. Дніпроп. художнє училище (1967; викл. М. Боровський, Г...."
11454,Ломонос Марина Миколаївна,1960.0,с. Вихвостів Городнян. р-ну Черніг. обл.,письменниця,"(05. 02. 1960, с. Вихвостів Городнян. р-ну Черніг. обл.) – письменниця. Член НСПУ (1997). Лауреатка міжнар. літ. конкурсу «Грано­слов» (1993). Закін. Київ. технол. інститут харчової промисловості (1981)...."
11455,Ломоносов Олександр Михайлович,1939.0,с. Березова Лука Гадяц. р-ну Полтав. обл.,співак (тенор),"(01. 02. 1939, с. Березова Лука Гадяц. р-ну Полтав. обл.) – співак (тенор). Нар. арт. РФ (1992). Закін. Держ. муз.-пед. інститут ім. Гнесіних (Москва, 1975; кл. Є. Бєлова). Мешкає і працює у Москві: 1970–73 – соліст..."
11456,Ломсадзе Мака Георгіївна,1974.0,"м. Хобі, Грузія",хореограф,"(04. 05. 1974, м. Хобі, Грузія) – хореограф. Заслужений діяч мистецтв України (2011). Закін. Тбіліс. університет (1999). У 1980–91 – солістка ансамблю у м. Хобі. Від 2000 мешкає в Києві, від 2003 – худож. кер...."
11457,Лончина Ірина Володимирівна,1982.0,с. Королівка Тлумац. р-ну Івано-Фр. обл.,естрадна співачка,"(05. 12. 1982, с. Королівка Тлумац. р-ну Івано-Фр. обл.) – естрадна співачка. Заслужений артист України (2008). Ґран-Прі Всеукр. конкурсу «Кар­патські соловейки» (2000), Міжнар. конкурсів «Захід 21..."
11462,Лопата Павло,1945.0,"с. Калинів Меджилабір. округу, Словаччина",український живописець і культурний діяч у Канаді,"(20. 03. 1945, с. Калинів Меджилабір. округу, Словаччина) – український живописець і культурний діяч у Канаді. Член Укр. спілки образотвор. мистецтв у Торонто. Навч. у відділі ху­дож. творчості ВШ..."
11468,Лопухова Наталія Олександрівна,1966.0,Київ,графік,"(01. 03. 1966, Київ) – графік, живописець. Дочка Олександра та Надії, сестра Світлани Лопухових. Заслужений художник України (1996). Срібна медаль АМ СРСР (1989). Член НСХУ (1989). Закін. Київський художній..."
11469,Лопухова Світлана Олександрівна,1951.0,Київ,живописець,"(11. 12. 1951, Київ) – живописець, графік. Дочка Олександра та Надії, сестра Наталії Лопухових, мати А. Подерв’янської. Заслужений художник України (2007). Член НСХУ (1984). Закін. Київський художній..."
11472,Лосєв Станіслав Іванович,1945.0,"м. Сватове Ворошиловгр., нині Луган. обл.",прозаїк,"(31. 05. 1945, м. Сватове Ворошиловгр., нині Луган. обл.) – прозаїк, валеолог. Член НСПУ (1995). Закін. Горлів. інститут іноз. мов (Донец. обл., 1973), Харків. університет (2006). Від 1973 – викладач франц. і лат...."
11474,Лосицький Станіслав Феліціанович,1941.0,"с. Чернігівське Краснодар. краю, РФ",живописець,"(18. 06. 1941, с. Чернігівське Краснодар. краю, РФ) – живописець. Міжнар. премії ім. В. Винниченка (2008), ім. Г. Сковороди (2015). Кандидат технічних наук (1978). Член НСХУ (2000). Закін. Львів. лісотех. інститут..."
11475,Лосицький Юрій Георгійович,1953.0,Київ,архітектор,"(08. 02. 1953, Київ) – архітектор. Заслужений архітектор України (1996). Член-кореспондент Укр. академії архітектури (1998). Закін. Респ. художню школу ім. Т. Шевченка (1971, Київ), Київ. інж.-буд. інститут..."
11476,Лосікова Людмила Миколаївна,1941.0,"м. Смоленськ, РФ",мистецтвознавець,"(20. 05. 1941, м. Смоленськ, РФ) – мистецтвознавець. Член НСХУ (1992). Закін. Львівський університет (1967). Від 1995 – у Німеччині. Дослідж. у галузі укр. давнього та сучас. живопису, особливу увагу..."
11477,Лосінський Віктор Валерійович,1965.0,смт Мізоч Здолбунів. р-ну Рівнен. обл.,графік,"(08. 05. 1965, смт Мізоч Здолбунів. р-ну Рівнен. обл.) – графік. Закін. Но­во­сибір. вище військ.-політ. училище (РФ, 1986), Львів. інститут внутр. справ (1995). Мистецтву навч. самотужки. Служив у ЗС СРСР..."
11481,Лотовський Яків Калманович,1939.0,Київ,прозаїк,"(10. 03. 1939, Київ) – прозаїк, перекладач. Член СПУ (до 1995). Закін. Літ. інститут у Москві (1973). Писати почав у студент. роки. Тривалий час у рад. період його твори не друкували. 1995 емігрував до США,..."
11486,Лоцман Руслана Олександрівна,1988.0,с. Матусів Шполян. р-ну Черкас. обл.,естрадна співачка,"(17. 07. 1988, с. Матусів Шполян. р-ну Черкас. обл.) – естрадна співачка, педагог. Кандидат педагогічних наук (2013). Заслужений артист України (2015). Лауреатка Всеукр. фестивалю-кон­курсу мистецтв..."
11489,Лошков Юрій Іванович,1964.0,"м. Рубіжне Ворошиловгр., нині Луган. обл.",музикознавець,"(29. 05. 1964, м. Рубіжне Ворошиловгр., нині Луган. обл.) – музикознавець, педагог. Доктор мистецтвознавства (2008), професор (2011). Закін. Хар­ків. інститут мистецтв (1990). У 1990–98 – викладач муз.-пед...."
11492,Лубенський В’ячеслав  Іванович,1939.0,"м. Грайворон, нині Бєлгород. обл., РФ",живописець,"(18. 05. 1939, м. Грайворон, нині Бєлгород. обл., РФ) – живописець, графік, мистецтвознавець. Канд. мистецтвознавства (1974). Пре­мія Респ. конкурсу на кращу художню листівку видавництва «Мистецтво»..."
11497,Лубська Ольга Пилипівна,1925.0,"с. Войтове Березан. р-ну, нині Войкове Згурів. р-ну Київ. обл.",поетеса,"(06. 11. 1925, с. Войтове Березан. р-ну, нині Войкове Згурів. р-ну Київ. обл.) – поетеса. Навч. у Київ. фінанс.-екон. технікумі. Весною 1942 вивезена на примус. роботи до Німеччини; перебувала у таборі м...."
11498,Луганько Ніна Пилипівна,1937.0,м. Миргород Полтав. обл.,художниця декоративно-ужиткового мистецтва,"(12. 04. 1937, м. Миргород Полтав. обл.) – художниця декоративно-ужиткового мистецтва. Закін. Миргород. керам. технікум (1959; викл. Т. Богданова, Т. Мірошниченко, О. Сухаревський). Відтоді працювала на..."
11499,Лугова Ляриса Ярославівна,1942.0,Тернопіль,живописець,"(22. 01. 1942, Тернопіль) – живописець. Сестра Ю. Лугового. Родина вивезена до Казахстану, 1943 виїхала до Бельгії, від 1950 – у Канаді. Закін. Мист. школу (1965), продовжила студії в АМ (обидві – м...."
11501,Луговенко Микола Володимирович,1944.0,м. Нікополь Дніпроп. обл.,живописець,"(23. 06. 1944, м. Нікополь Дніпроп. обл.) – живописець. Мистецтву навч. 1964–66 у М. Сар’яна та студії при Будинку нар. творчості (кер. Х. Мурадян) у Єревані, ізостудії у м. Нікополь (1966–68; кер. Я...."
11502,Луговий Віталій Леонідович,1973.0,"с. Павлівка, нині Баштанського р-ну Миколаївської обл.",актор,"(03. 07. 1973, с. Павлівка, нині Баштанського р-ну Миколаївської обл.) — актор, режисер. Заслужений артист України (2021). Обласна премія імені Леся Курбаса (2020). Закінчив Тернопільське музичне училище..."
11503,Луговик-Сениця Микола Миколайович,1946.0,с. Дем’янці Переяслав-Хмельн. р-ну Київ. обл.,письменник,"(псевд.: Зорро, Лесь Місяць; 10. 01. 1946, с. Дем’янці Переяслав-Хмельн. р-ну Київ. обл.) – письменник, літературознавець. Онук П. Сениці. Член НСПУ (1989). Закін. Ніжин. пед. інститут (Черніг. обл., 1976)...."
11504,Луговський Анатолій  Васильович,1955.0,с. Басівка Сум. р-ну Сум. обл.,поет,"(13. 06. 1955, с. Басівка Сум. р-ну Сум. обл.) – поет, краєзнавець. Член НСПУ (1999). Закін. Сум. культ.-осв. училище (1974), Орлов. філію Моск. інституту культури (РФ, 1981), Київ. університет (1987). Працював..."
11505,Луговський Андрій Віталійович,1974.0,смт Васильківка Дніпроп. обл.,живописець,"(24. 11. 1974, смт Васильківка Дніпроп. обл.) – живописець. Чоловік О. Опанасенко. Премія за кращу академ. постановку (рисунок) 1-ї Міжнар. виставки «Приватні заклади освіти в Україні» (Київ, 2008). Член..."
11507,Лужанська Клара (Лариса) Борисівна,1939.0,"м. Петергоф, нині С.-Петербур. міськради",графік,"(20. 05. 1939, м. Петергоф, нині С.-Петербур. міськради) – графік, живописець, скульпторка, худож­ниця монументального мистецтва. Член НСХУ (1994). Знач. вплив на творчість Л. справила А. Ро­зенман...."
11509,Лук’яненко Ганна Сергіївна,1988.0,м. Конотоп Сум. обл.,поетеса,"(29. 06. 1988, м. Конотоп Сум. обл.) – поетеса. Член НСПУ (2012). Закін. Київський університет (2011). Вихованка літ. студії «Джерела» (кер. І. Козлова). Авторка поет. зб. «Повноліття» (2007), «Цілунок ночі» (2008;..."
11511,Лук’янець Вікторія Іванівна,1966.0,Київ,співачка (лірико-колора­турне сопрано),"(20. 11. 1966, Київ) – співачка (лірико-колора­турне сопрано), педагог. Народний артист України (2001). Іноз. чл. НАМУ (2017). Орден княгині Ольги 3-го ступеня (2009). Лауреат­ка міжнар. конкурсів: ім. М...."
11513,Лук’янець Галина Василівна,1966.0,Харків,співачка (альт),"(10. 04. 1966, Харків) – співачка (альт), фольклористка. Заслужений артист України (2009). Закін. істор.-теор. факультет Харків. інституту мистецтв (1990). Творчу діяльність розпочала 1988 у фольклор. гурті..."
11515,Лук’янова Лариса Георгіївна,1951.0,м. Зіньків Полтав. обл.,співач­ка (сопрано),"(06. 12. 1951, м. Зіньків Полтав. обл.) – співач­ка (сопрано), педагог. Заслужений артист України (1996). Закін. Полтав. муз. училище (1972; кл. В. Ємець), Київ. консерваторію (1977; кл. Є. Чавдар). Відтоді..."
11516,Лук’янченко Вадим Ігорович,1955.0,Київ,архітектор,"(03. 05. 1955, Київ) – архітектор. Заслужений архітектор України (2004). Закін. Київ. буд. технікум (1977) та інж.-буд. інститут (1986). Працював 1977–78 в інституті «Діпрохіммаш»; 1978–2008 – у системі Укр. спец...."
11517,Лук’янчук Раїса Федорівна,1948.0,с. Богданівці Деражнян. р-ну Хмельн. обл.,поетеса,"(07. 09. 1948, с. Богданівці Деражнян. р-ну Хмельн. обл.) – поетеса, публіцистка. Член НСПУ (1990). Від 1952 мешкає на Луганщині. Закін. буд. технікум у м. Стаханов (Ворошиловгр., нині Луган. обл., 1974), Луган...."
11518,Лук’яньонок Наталія  Леонідівна,1969.0,"м. Елґава, Латвія",живописець,"(28. 08. 1969, м. Елґава, Латвія) – живописець, графік. Член НСХУ (2003). Закін. Харків. худож.-пром. інститут (1994; викл. В. Сергєєв, В. Сизиков). На творчій роботі. Учасниця обл., всеукр., міжнар. мистецьких..."
11524,Луканюк Анна  Михайлівна,1988.0,Ашґабат,графік,"(09. 01. 1988, Ашґабат) – графік, живописець. Член молодіж. об’єдн. при Чернів. організації НСХУ (2013). Закін. арт-студію «Музеум» при Чернів. ХМ (2012; кер. О. Михайленко), пед. факультет Кам’янець-Поділ...."
11525,Лукач Валентина Василівна,1942.0,м. Вознесенськ Микол. обл.,художниця декоративно-ужиткового мистецтва,"(15. 05. 1942, м. Вознесенськ Микол. обл.) – художниця декоративно-ужиткового мистецтва, живописець, графік. 1-а премія Всесоюз. виставки худож. оформлення виробів легкої промисловості (Москва, 1974)...."
11527,Лукаш Іван  Михайлович,1950.0,"с. Ленінське, нині Спаське Кролевец. р-ну Сум. обл.",архітектор,"(05. 04. 1950, с. Ленінське, нині Спаське Кролевец. р-ну Сум. обл.) – архітектор. Державна премія України у галузі архітектури (2004). Закін. Київський художній інститут (1974). Відтоді працював у Сум...."
11528,Лукаш Лариса Олексіївна,1955.0,Полтава,художниця декоративного текстилю,"(25. 05. 1955, Полтава) – художниця декоративного текстилю. Член НСХУ (2008). Закін. Укр. полігр. інститут у Львові (1985; викл. І. Прийдан, М. Таранов). Працювала у Полтаві: від 1972 – на виробництві; від 1982 –..."
11530,Лукашев Володимир  Анатолійович,1936.0,Харків,режисер,"(07. 05. 1936, Харків) – режисер, музично-громадський діяч, педагог. Народний артист УРСР (1985). Професор (1989). Ордени князя Яро­слава Мудрого 5-го ступ. (2006), «За заслуги» 3-го (1998) та 2-го (2012) ступ. Закін...."
11531,Лукашева Анна Володимирівна,1979.0,"с. Кошари Антрацитів. р-ну Ворошиловгр., нині Луган. обл.",письменниця,"(08. 12. 1979, с. Кошари Антрацитів. р-ну Ворошиловгр., нині Луган. обл.) – письменниця. Член НСПУ (2012). Закін. Донец. університет (2003). Пише для дітей. Авторка кн. «Шоко­­лад­­ные стихи», «Клуб..."
11533,Лукашевич Тетяна  Сергіївна,1956.0,Рівне,художниця декоративного мистецтва,"(04. 05. 1956, Рівне) – художниця декоративного мистецтва. Онука Л. Майгур-Куліш, правнучка І. Ку­­ліша. Член НСХУ (1993). Закін. Львів. інститут прикладного та декоративного мистецтва (1978; викл. К...."
11534,Лукашевич-Полон Оксана Йосипівна,1944.0,м. Ходорів Жидачів. р-ну Львів. обл.,живописець,"(20. 02. 1944, м. Ходорів Жидачів. р-ну Львів. обл.) – живописець, графік. Разом із батьками через Австрію 1950 прибула до США. Мист. освіту здобула в Університеті в Сиракузах (шт. Нью-Йорк, 1964, бакалавр..."
11539,Лукашова Олена Володимирівна,1969.0,смт Гребінки Васильків. р-ну Київ. обл.,естрадна співачка,"(13. 04. 1969, смт Гребінки Васильків. р-ну Київ. обл.) – естрадна співачка, композитор. Заслужений артист України (2003). Лауреатка міжнародних фестивалів у м. Пекін (2001), м. Усі (2003; обидва – Китай)...."
