id,name,birth_year,birth_city,profession,bio_text
7444,Ільченко Ярослав Ілліч,1948.0,Чернівці,майстер ювелірного мистецтва і живописець,"(17. 09. 1948, Чернівці) – майстер ювелірного мистецтва і живописець. Член НСХУ (1989). Закін. Вижниц. училище приклад. мистецтва (Чернів. обл., 1969; викл. В. Жаворонков, П. Лемський). На творчій роботі...."
7447,Ілюк Мирослав,1942.0,"м. Хуст, нині Закарп. обл.",публіцист,"(09. 07. 1942, м. Хуст, нині Закарп. обл.) – публіцист, громадсько-культурний діяч. Син Й. Ілюка. Орден «За заслуги» 3-го ступеня (2008). Закін. Пряшів. філос. факультет Кошиц. університету ім. П. Шафарика..."
7449,Ілюшин Олексій Андрійович,1936.0,"м. Орджонікідзеград, нині у складі м. Брянськ, РФ",живописець і графік,"(23. 03. 1936, м. Орджонікідзеград, нині у складі м. Брянськ, РФ) – живописець і графік. Член НСХУ (1987). Закін. Одес. художнє училище (1961; викл. І. Логвин, В. Путейко). Працював 1961–92 на Одес. худож.-вироб...."
7450,Імханицький Михайло Йосипович,1946.0,Харків,музикознавець,"(23. 07. 1946, Харків) – музикознавець, баяніст, композитор, педагог. Доктор мистецтвознавства (1990), професор (1991). Заслужений діяч мистецтв Росії (2007). Закін. факультет нар. інструментів (1969; кл...."
7460,Інкіна Клара Якимівна,1934.0,Дніпропетровськ,співачка (лірико-колоратурне сопрано),"(11. 03. 1934, Дніпропетровськ) – співачка (лірико-колоратурне сопрано), педагог. Заслужений артист РРФСР (1978). Закін. Київську консерваторію (1959; кл. З. Гайдай). Солістка Держ. засл. капели УРСР..."
7461,Іноземцев Андрій Вікторович,1984.0,"м. Ворошиловград, нині Луганськ",живописець,"(10. 01. 1984, м. Ворошиловград, нині Луганськ) – живописець. 1-е м. Київ. конкурсу живопису ім. В. Зарецького (2007). Закін. Луган. художнє училище (2005; викл. М. Романовський), Крим. філіал Нац. академії..."
7464,Іноземцева Світлана Петрівна,1947.0,"м. Коломия Станіслав., нині Івано-Фр. обл.",архітектор-реставратор,"(14. 01. 1947, м. Коломия Станіслав., нині Івано-Фр. обл.) – архітектор-реставратор. Заслужений архітектор України (2005). Член НСАУ (1979). Державна премія України в галузі архітектури (2000). Закін. Київ...."
7465,Інсарова Марія Миколаївна,1866.0,"м. Новгород, нині Великий Новгород, РФ",співачка (лірико-драматичне сопрано),"(1866, м. Новгород, нині Великий Новгород, РФ – ?) – співачка (лірико-драматичне сопрано). Навч. у С.-Петербур. консерваторії (кл. Ю. Платонової, Є. Іванова-Смоленського, С. Габеля). Від 1887 виступала..."
7466,Інюточкін Олександр Олександрович,1947.0,"с. Знаменка, Башкортостан, РФ",режисер,"(18. 10. 1947, с. Знаменка, Башкортостан, РФ) – режисер, педагог. Доц. (1991). Заслужений діяч мистецтв України (2004). Закін. Харків. інститут мистецтв (1975; викл. В. Афанасьєв). Відтоді – гол. реж. Кіровогр...."
7470,Іолоп Микола Миколайович,1953.0,Запоріжжя,живописець,"(07. 04. 1953, Запоріжжя) – живописець. Член НСХУ (1977). Закін. Дніпроп. художнє училище (1972; викл. В. Загубибатько), Микол. філію Київ. університету культури і мистецтв (2005; викл. Ю. Корнюков, А...."
7475,Іпатова Ольга Михайлівна,1945.0,"смт Мир Корелиц. р-ну Гроднен. обл., Білорусь",білоруська письменниця,"(Іпатава Вольга Міхайлаўна; 01. 01. 1945, смт Мир Корелиц. р-ну Гроднен. обл., Білорусь) – білоруська письменниця. Член СП Білорусі (1970). Закін. Білорус. університет (Мінськ, 1967), Літ. інститут (Москва,..."
7476,Іпатьєва Ганна Вікторівна,1971.0,Київ,художник театру,"(30. 10. 1971, Київ) – художник театру, живописець. Дочка В. Гукайла. Член НСХУ (1995–2007). Закінчила Українську АМ (Київ, 1995; майстерня М. Стороженка). Створила ескізи костюмів до балетів: «Запрошення..."
7479,Ірванець Олександр Васильович,1961.0,с. Твориничі Локачин. р-ну Волин. обл.,письменник,"(24. 01. 1961, с. Твориничі Локачин. р-ну Волин. обл.) – письменник, драматург, перекладач. Член НСПУ (1988). Закін. Дубен. пед. училище (Рівнен. обл., 1980), Літ. інститут у Москві (1989). Спільно з Ю...."
7482,Ірод Корнелій Миколайович,1937.0,"с. Марицея Сучав. пов., Румунія",український письменник і перекладач у Румунії,"(24. 08. 1937, с. Марицея Сучав. пов., Румунія) – український письменник і перекладач у Румунії. Член СП Румунії (1968) та НСПУ (1991). Закін. укр. відділ. філол. факультету (1960) і теол. факультет (1974)..."
7484,Ірха Івета Василівна,1969.0,Харків,піаністка,"(20. 09. 1969, Харків) – піаністка, культурно-громадська діячка, педагог. Дочка В. Ірхи. Ґран-Прі Міжнар. конкурсів піаністів (м. Кілі, Швеція, 1996; м. Ніборґ, Данія, 1998). Закін. Харків. інститут мистецтв..."
7485,Ісаєв Андрій Іванович,1960.0,"м. Красноярськ, РФ",живописець і графік,"(10. 10. 1960, м. Красноярськ, РФ) – живописець і графік. Член НСХУ (1991). Закін. Одес. художнє училище (1990; викл. В. Алікберов). На творчій роботі. Учасник мистецьких виставок від 1990-х рр. Для творчості..."
7490,Ісаєв Сергій Іванович,1949.0,"м. Комсомольськ-на-Амурі, Хабаров. край, РФ",живописець,"(27. 11. 1949, м. Комсомольськ-на-Амурі, Хабаров. край, РФ) – живописець. Член НСХУ (1978). Закін. Моск. худож. інститут (1974; викл. О. Мизін, А. Орловський, К. Тутеволь). Відтоді працював на Дніпроп...."
7492,Ісаєва Зінаїда Олександрівна,1930.0,"м. Таганрог, нині Ростов. обл., РФ",скульпторка,"(10. 05. 1930, м. Таганрог, нині Ростов. обл., РФ – ?) – скульпторка, художниця декоративно-ужиткового мистецтва. Закін. Інститут живопису, скульптури та архітектури у Ленінграді (нині С.-Петербург,..."
7493,Ісак Валентин  Михайлович,1951.0,"с. Калугер Флорешт. р-ну, Молдова",архітектор,"(07. 01. 1951, с. Калугер Флорешт. р-ну, Молдова) – архітектор. Нар. арх. України (2004). Дійсний член Укр. академії архітектури (2001). Державна премія України у галузі архітектури (2003). Закін. Кишинів...."
7494,Ісаков Валерій Трохимович,1936.0,"с. Верхошижем’я, нині смт Кіров. обл., РФ",кінорежисер,"(07. 08. 1936, с. Верхошижем’я, нині смт Кіров. обл., РФ) – кінорежисер, актор. Державна премія України імені Тараса Шевченка (1975). Член СКінУ (1971–76). Закін. ВДІК (Москва, 1964; майстерня М. Ромма)...."
7495,Ісаков Денис Валерійович,1977.0,Київ,скульптор,"(31. 07. 1977, Київ) – скульптор. Закін. Київ. художню школу № 6 (1993). На творчій роботі. Учасник мистецьких виставок від 2008. Працює у галузі мініатюр. пластики, використовуючи кістку,..."
7497,Ісаханов Генріх Давидович,1933.0,Баку,режисер,"(16. 09. 1933, Баку) – режисер, співак (бас), театрознавець, педагог. Чоловік Н. Ісаханової. Канд. мистецтвознавства (1986), професор (1993). Заслужений артист Узбец. РСР (1964). Лауреат Всесоюз. конкурсу..."
7498,Ісаханова Нінель Йосипівна,1931.0,Одеса,піаністка,"(30. 12. 1931, Одеса) – піаністка, музикознавець, педагог. Дочка Й. Остапенка, дружина Г. Ісаханова. Канд. мистецтвознавства (1968). Закін. Одес. консерваторію (1954; кл. фортепіано О. Плещицер, теорії..."
7504,Ісмаїлов Абіб,1939.0,"с. Чагалтай Акмечец. р-ну Крим. обл., нині с. Далеке Чорномор. р-ну АР Крим",живописець,"(25. 11. 1939, с. Чагалтай Акмечец. р-ну Крим. обл., нині с. Далеке Чорномор. р-ну АР Крим) – живописець. Член СХ СРСР (1970). Депортов. із родиною 1944 в Узбекистан. Закін. Ташкент. художнє училище (1961). У м...."
7509,Ісупов Ілля Володимирович,1971.0,м. Васильків Київ. обл.,графік і живописець,"(08. 01. 1971, м. Васильків Київ. обл.) – графік і живописець. Син Володимира та Неллі, брат Сергія Ісупових. Член НСХУ (1999). Закін. Респ. художню середню школу ім. Т. Шевченка (Київ, 1990; викл. О...."
7510,Ісупова Неллі Миколаївна,1939.0,"м. Ставрополь, РФ",художниця декоративної кераміки,"(01. 03. 1939, м. Ставрополь, РФ) – художниця декоративної кераміки. Мати Сергія та Іллі Ісупових. Член НСХУ (1975). Закін. Одес. художнє училище (1961; викл. І. Гончаренко, Д. Клювгант). Працювала 1961–75..."
7511,Іськів Лариса Петрівна,1952.0,Львів,художниця декоративного текстилю,"(17. 03. 1952, Львів) – художниця декоративного текстилю, дизайнер одягу. Член НСХУ (1988). Закін. Львів. інститут прикладного та декоративного мистецтва (1976; викл. І. Боднар, М. Токар, Є. Фащенко)...."
7514,Іщак Ігор Михайлович,1977.0,м. Миколаїв Львів. обл.,співак (контртенор),"(19. 10. 1977, м. Миколаїв Львів. обл.) – співак (контртенор). Заслужений артист України (2018). Лауреат низки міжнар. конкурсів. Закін. Київську консерваторію (2001; викл. М. Кондратюк, К. Радченко, Г...."
7520,Іщенко Наталія Анатоліївна,1960.0,Сімферополь,літературознавець,"(23. 08. 1960, Сімферополь) – літературознавець. Доктор філологічних наук (2009). Закін. Сімфероп. університет (1982). Учителювала. Від 1990 – доцент кафедри рос. і зарубіж. літ-р Таврій. університету..."
7521,Іщенко Наталія Іванівна,1924.0,"с. Руська Поляна Київ. губ., нині Черкас. р-ну Черкас. обл.",художниця декоративно-ужиткового мистецтва,"(19. 08. 1924, с. Руська Поляна Київ. губ., нині Черкас. р-ну Черкас. обл. – ?) – художниця декоративно-ужиткового мистецтва. Закін. Косів. училище приклад. мистецтва (нині Івано-Фр. обл., 1951; викл. Г...."
7522,Іщенко Світлана Вікторівна,1969.0,Миколаїв,поетеса,"(30. 07. 1969, Миколаїв) – поетеса, актриса. Член АУП (1997), НСПУ (1998). Закін. Микол. вище училище культури (1988), філію Київ. університету культури та мистецтв (1998; викл. О. Мірошниченко). 1988–2001 – актриса..."
7523,Іщенко Тетяна Миколаївна,1949.0,Одеса,художниця декоративної кераміки і педагог,"(04. 10. 1949, Одеса) – художниця декоративної кераміки і педагог. Член НСХУ (1990). Закін. Одес. пед. інститут (1988; викл. В. Філіпенко). Працювала викл. Одес. дит. худож. школи (1978–90) та дит. худож. школи..."
7525,Іщенко Юрій Петрович,1943.0,"ст. Чу Джамбул. обл., Казахстан",живописець,"(27. 03. 1943, ст. Чу Джамбул. обл., Казахстан) – живописець. Заслужений художник України (2003). Член НСХУ (1978). Закін. у Києві худож. інститут (1970; майстерня В. Шаталіна), творчі майстерні АМ СРСР (1973;..."
7528,Іщук Руслан Васильович,1949.0,м. Почаїв Кременец. р-ну Терноп. обл.,композитор,"(25. 06. 1949, м. Почаїв Кременец. р-ну Терноп. обл.) – композитор, аранжувальник, хоровий диригент. Член Національної ліги українських композиторів (1997). Закін. муз.-пед. факультет Івано-Фр. пед...."
7544,Йориш Михайло Миколайович,1942.0,м. Скалат Підволочис. р-ну Терноп. обл.,живописець і скульптор,"(03. 07. 1942, м. Скалат Підволочис. р-ну Терноп. обл.) – живописець і скульптор. Член НСХУ (1998). Закін. Львів. інститут прикладного та декоративного мистецтва (1969; викл. Ю. Лащук, Е. Мисько). Відтоді..."
7546,Йосипова Людмила Миколаївна,1965.0,"с. Красне Друге, нині Германівка Обухів. р-ну Київ. обл.",співачка (альт),"(03. 05. 1965, с. Красне Друге, нині Германівка Обухів. р-ну Київ. обл.) – співачка (альт). Заслужений артист України (2007). Закін. хор. студію при Держ. засл. укр. нар. хорі ім. Г. Верьовки (Київ, 1984; викл. В...."
7554,Кабан Юрій Степанович,1946.0,Київ,мистецтвознавець,"(01. 11. 1946, Київ) – мистецтвознавець. Син С. Кабана. Член НСХУ (1984–2007). Закін. Київський художній інститут (1972). Працював у Києві: освітлювачем рос. драм. театру ім. Лесі Українки (1964–68); позаштат...."
7555,Кабанов Олександр Михайлович,1968.0,Херсон,поет,"(10. 10. 1968, Херсон) – поет. Член НСПУ (2004). Міжнар. літ. премії ім. Юрія Долгорукого (ж. «Радуга», Київ, 2005), Волошинська (Україна–РФ, 2009), «Планета поета» ім. Л. Вишеславського (2008). Закін. філол...."
7557,Кабарівський Богдан-Адам Іванович,1907.0,"с. Сихів, нині у складі Львова",публіцист,"(псевд. і крипт.: К. Богдасик, К. Богданко, Карий, Богдан Наталчин, К. Богданик, Чугайстер-Лісовик, Я. Адам, А з Я; 03. 04. 1907, с. Сихів, нині у складі Львова – ?) – публіцист, поет, літературознавець,..."
7558,Кабацький Олександр Олексійович,1948.0,Київ,архітектор,"(23. 10. 1948, Київ) – архітектор. Державна премія України імені Тараса Шевченка (1984). Закінчив Київський художній інститут (1972). Відтоді працював в Українському зональному науково-дослідному..."
7560,Кабаченко Гліб Володимирович,1983.0,Одеса,живописець,"(06. 02. 1983, Одеса) — живописець. Син В. Кабаченка та Г. Литвиненко, онук Володимира та Тамари Литвиненків.Член НСХУ (2010). Закінчив Одеське художньо-театральне училище (2004; майстерня Т...."
7562,Кабаченко Олександр Петрович,1960.0,Миколаїв,військовий диригент,"(09. 07. 1960, Миколаїв) – військовий диригент, композитор, аранжувальник. Брат В. Кабаченка. Заслужений діяч мистецтв України (2006). Закін. Моск. консерваторію (1983; викл. А. Мішурін, С. Ганичев, А...."
7565,Кабка Геннадій Миколайович,1966.0,м. Дніпродзержинськ Дніпроп. обл.,співак (тенор),"(25. 01. 1966, м. Дніпродзержинськ Дніпроп. обл.) – співак (тенор), педагог. Заслужений діяч мистецтв України (2019). Лауреат міжнар. конкурсів вокалістів: ім. Е. Дестін (м. Чеське-Будейовіце, Чехія, 1995,..."
7569,Каверзнєва Наталія Володимирівна,1949.0,"м. Красноярськ, РФ",графік,"(02. 11. 1949, м. Красноярськ, РФ) – графік. Член НСХУ (1994). Закін. Київський художній інститут (1978; викл. І. Селіванов, А. Чебикін, Л. Чичкан). На творчій роботі. Від 2001 – викладач графіки у мист. гуртку..."
7571,Каверін Віктор Олександрович,1950.0,Ужгород,живописець,"(11. 03. 1950, Ужгород) – живописець. Чоловік О. Левади. Член НСХУ (1986). Закін. Київський художній інститут (1978; викл. Д. Лідер, С. Подерв’янський). На творчій роботі. Учасник всеукр., всесоюз. та..."
7573,Кавка Євген Антонович,1949.0,"смт Жовтень Станіслав. обл., нині смт Єзупіль Тисмениц. р-ну Івано-Фр. обл.",живописець,"(12. 09. 1949, смт Жовтень Станіслав. обл., нині смт Єзупіль Тисмениц. р-ну Івано-Фр. обл.) – живописець, графік. Закін. Івано-Фр. художню школу (1965; викл. М. Варення, В. Чазов), навч. у Львові в майстерні..."
7574,Кавка Іван,1869.0,"с. Поляни Суровичні Сяноц. пов., Лемківщина, нині зняте з обліку",скульптор,"(бл. 1869, с. Поляни Суровичні Сяноц. пов., Лемківщина, нині зняте з обліку – ?) – скульптор. Навч. у Риманів. різьбяр. школі (кін. 19 ст., Польща), худож. студіях у Кракові та Будапешті. Працював у..."
7576,Кавсан Дмитро Вадимович,1964.0,Київ,живописець,"(28. 12. 1964, Київ) – живописець. Син В. Кавсана. Член НСХУ (2005). Закін. Київський художній інститут (1990; майстерня М. Стороженка). На творчій роботі. Учасник всеукр., всесоюз. мистецьких виставок від..."
7577,Кавтарадзе Геннадій Гівійович,1960.0,"с. Ешера, Грузія",живописець,"(25. 02. 1960, с. Ешера, Грузія) – живописець. Член НСХУ (1999). Закін. Харків. худож.-пром. інститут (1993; викл. І. Криворучко, В. Хованов, В. Чаус). На творчій роботі. Учасник обл., всеукр. і зарубіж...."
7578,Кавун Андрій Олеглвич,1969.0,Львів,кінорежисер,"(09. 12. 1969, Львів) – кінорежисер, сценарист. Закін. ВДІК (Москва, 1999; майстерня В. Хотиненка). Диплом. короткометраж. фільм «Скільки коштує ця рибка?» (навч. студія ВДІКу) відзнач. гол. призом Мкф..."
7579,Кавун Вероніка Олексіївна,1985.0,Житомир,поетеса,"(15. 06. 1985, Житомир) – поетеса. Член НСПУ (2004). Закін. факультет журналістики Львів. університету (2008). Мешкає у Львові. Авторка зб. «Задзеркалля», «Завтра» (обидві – 2001), «Зимні інтеграли», «Без..."
7581,Кавун Лідія Іванівна,1961.0,"с. Вільнопілля Ружинського, нині Бердичівського р-ну Житомирської обл.",літературознавець,"(14. 11. 1961, с. Вільнопілля Ружинського, нині Бердичівського р-ну Житомирської обл.) — літературознавець. Доктор філологічних наук (2008), професор (2011). Закінчила Київський університет (1987)...."
7586,Кадан Микита Вікторович,1982.0,Київ,живописець,"(26. 11. 1982, Київ) – живописець, графік. Закін. Нац. академію образотвор. мистецтва та архітектури (Київ, 2007; майстерня М. Стороженка). На творчій роботі. Учасник міських, всеукр., міжнар...."
