id,name,birth_year,birth_city,profession,bio_text
4103,Глемязь Петро Васильович,1961.0,с. Ходосіївка Києво-Святошин. р-ну Київ. обл.,скульптор,"(17. 09. 1961, с. Ходосіївка Києво-Святошин. р-ну Київ. обл.) – скульптор. Член НСХУ (1990). Закін. Київський художній інститут (1990; викл. В. Бородай). Відтоді – учасник всеукр. мистецьких виставок...."
4109,Гливка Богдан Миколайович,1946.0,"с. Рогізна Садгур. р-ну Чернів. обл., нині у складі Чернівців",співак (тенор),"(26. 09. 1946, с. Рогізна Садгур. р-ну Чернів. обл., нині у складі Чернівців) – співак (тенор). Заслужений артист УРСР (1980). Закін. Рівнен. інститут культури (1992; кл. хор. диригування С. Вернюка). Виступав..."
4117,Глова Степан Іванович,1959.0,с. Оселя Яворів. р-ну Львів. обл.,актор,"(01. 01. 1959, с. Оселя Яворів. р-ну Львів. обл.) – актор. Народний артист України (2007). Закін. студію при Львів. укр. драм. театрі ім. М. Заньковецької (1978; викл. О. Ріпко), Львів. університет (1988). У 1981–88 –..."
4121,Глотов Олександр Леонідович,1953.0,"м. Норильськ Красноярського краю, РФ",літературознавець,"(10. 11. 1953, м. Норильськ Красноярського краю, РФ) – літературознавець. Доктор філологічних наук (1997), професор (2002). Закінчив Львівський університет (1979). Викладав у Львівському університеті..."
4123,Глуздов Віктор Павлович,1925.0,Полтава,графік і живописець,"(08. 03. 1925, Полтава) – графік і живописець. Член НСХУ (1963). Учасник
2-ї світової війни. Закін. Київський художній інститут (1958; майстерня О. Шовкуненка). Працював оформлювачем книг у видавництвах..."
4125,Глух Світлана Петрівна,1945.0,Чернігів,піаністка,"(11. 08. 1945, Чернігів) – піаністка, педагог. Проф. Народний артист України (1997). Закін. Київську консерваторію (1970; кл. О. Холодної), де й викладає від 1980 (нині Нац. муз. академія України). 1970–95 –..."
4128,Глухенький Ігор Іванович,1969.0,Київ,скульптор,"(08. 01. 1969, Київ) – скульптор. Член НСХУ (1999). Закін. Укр. АМ (1994; викл. М. Вронський). Працював викл. на факультеті образотвор. мистецтва Вищого мист. коледжу Київ. дит. АМ (1995–2003). Відтоді – на..."
4132,Глуховська Наталія Андріївна,1946.0,"с. Гвардійське Городоцького р-ну Кам’янець-Поділ. обл., нині Хмельн. р-ну Хмельн",письменниця,"(09. 08. 1946, с. Гвардійське Городоцького р-ну Кам’янець-Поділ. обл., нині Хмельн. р-ну Хмельн. обл.) – письменниця. Член НСПУ (2002). Від 1965 навч. у Кам’янець-Поділ., Пенз. (РФ) пед. інститутах, закін...."
4135,Глушич Галина Василівна,1942.0,"м. Керки Чаржоус. обл., нині Туркменистан",дизайнер,"(02. 03. 1942, м. Керки Чаржоус. обл., нині Туркменистан) – дизайнер, аквареліст. Дружина Миколи, мати Олега Глушичів. Член НСХУ (1987). Закін. Центр. експерим. студію СХ СРСР (Москва, 1989; викл. В...."
4136,Глушич Микола Йосипович,1936.0,"с. Крохмальці Решетилів. р-ну, нині Полтав. обл.",дизайнер і живописець,"(13. 11. 1936, с. Крохмальці Решетилів. р-ну, нині Полтав. обл.) – дизайнер і живописець. Чоловік Галини, батько Олега Глушичів. Член НСХУ (1976). Закін. Миргород. керам. технікум (Полтав. обл., 1959), Центр...."
4137,Глушич Олег Миколайович,1965.0,Ташкент,дизайнер,"(19. 10. 1965, Ташкент) – дизайнер, графік і живописець. Син Миколи та Галини Глушичів. Член НСХУ (2003). Закін. Харків. худож.-пром. інститут (1992; викл. А. Константинопольський, А. Луценко, О. Пронін)...."
4142,Глущак Анатолій Степанович,1940.0,"с. Писарівка, нині Волочис. р-ну Хмельн. обл.",поет,"(08. 01. 1940, с. Писарівка, нині Волочис. р-ну Хмельн. обл.) – поет, перекладач. Член НСПУ (1974). Закін. Одес. університет (1962). Відтоді – на журналіст. роботі в Одесі;
1977–83 – директор видавництва..."
4143,Глущенко Віктор Михайлович,1939.0,Суми,поет,"(29. 04. 1939, Суми) – поет. Член НСПУ (2003). Закін. Київ. автодорож. інститут (1963). Від 1957 працював (з перервами) на виробництві у Києві; 1969–73 – у ВНДІ електропобут. машин та приладів; 1973–93 – у Київ...."
4144,Глущенко Марина Вадимівна,1958.0,Харків,дизайнер і графік,"(24. 04. 1958, Харків) – дизайнер і графік. Дружина П. Макова. Член НСХУ (1987), Спілки дизайнерів України (1988). Закін. Харків. худож.-пром. інститут (1980; викл. Г. Кесслер, П. Осначук, Г. Тищенко). На
твор...."
4150,Глущенко Юрій Петрович,1947.0,Київ,піаніст,"(22. 09. 1947, Київ) – піаніст, педагог. Канд. мистецтвознавства (1991), доцент
(1995). Лауреат Всесоюз. конкурсу піаністів (Москва, 1970, 3-є м.). Закін. Київську консерваторію (1971; кл. Т. Кравченко), де..."
4151,Глущук Сергій Сергійович,1957.0,"м. Сєвероуральськ Свердлов. обл., РФ",живописець і реставратор,"(05. 08. 1957, м. Сєвероуральськ Свердлов. обл., РФ) – живописець і реставратор. Член Міжнар. спілки незалеж. художників «КЕТ» ім. А. Кашкая (1990). Закін. Київський художній інститут (1985; викл. О...."
4157,Ґмитро Микола  Михайлович,1958.0,"с. Омеляна, нині Велика Омеляна Рівнен. р-ну Рівнен. обл.",реставратор та іконописець,"(25. 02. 1958, с. Омеляна, нині Велика Омеляна Рівнен. р-ну Рівнен. обл.) – реставратор та іконописець. Закін. художню школу в Рівному (1974), навч. у Моск. нар. заоч. університеті мистецтв (1980–82). Від 1983..."
4159,Гнатенко Володимир Порфирович,1937.0,"с. Попівка Канів. р-ну, нині Черкас. обл.",культурний діяч,"(31. 03. 1937, с. Попівка Канів. р-ну, нині Черкас. обл.) – культурний діяч. Закін. Київ. інститут театр. мистецтва (1966; кл. Л. Білецької). Працював у Рівнен. муз.-драм. театрі (1968–73): заст. дир., від 1969 –..."
4160,Гнатенко Костянтин Володимирович,1961.0,"містечко Браїлів, нині смт Жмерин. р-ну Вінн. обл.",поет,"(08. 05. 1961, містечко Браїлів, нині смт Жмерин. р-ну Вінн. обл.) – поет. Член НСПУ (1989). Закін. Київський університет (1987). Працював зав. сектору виставок Держ. музею Т. Шевченка в Києві. Опублікував..."
4161,Гнатенко Микола Григорович,1957.0,"с. Луб’янка Білокуракинського, нині Сватівського р-ну Луганської обл.",актор,"(25. 01. 1957, с. Луб’янка Білокуракинського, нині Сватівського р-ну Луганської обл.) — актор, театральний діяч. Заслужений діяч мистецтв України (2009). Премія імені М. Садовського НСТДУ. Орден «За..."
4166,Гнатковський Олексій Іванович,1985.0,Івано-Франківськ,актор,"(09. 11. 1985, Івано-Франківськ) — актор, режисер. Народний артист України (2024). Премія імені В. Смоляка (2019). Закінчив Прикарпатський університет (Івано-Франківськ, 2008, історичний факультет; 2009,..."
4169,Гнатовський Ярослав Васильович,1962.0,Львів,диригент,"(02. 04. 1962, Львів) – диригент, педагог. Закін. Львів. консерваторію (1986; кл. О. Сотничук). Вдосконалював майстерність у Б. Завойського та І. Майчика. 1988– 98 – засн. і кер. камер. хору «Gloria» при Львів...."
4170,Гнатченко Микола Петрович,1947.0,м. Золочів Харків. обл.,графік,"(09. 06. 1947, м. Золочів Харків. обл.) – графік. Член НСХУ (1977). Закін. Харків. худож.-пром. інститут (1972; викл. А. Константинопольський, В. Ненадо, В. Селезньов). Відтоді працював викл. у Київ. палаці..."
4171,Гнатченко Стефанія,1924.0,"с. Кобиловолоки Теребовлян. р-ну, нині Терноп. обл.",живописець,"(18. 12. 1924, с. Кобиловолоки Теребовлян. р-ну, нині Терноп. обл.) – живописець. Закін. Дрогоб. середню школу (Львів. обл., 1944). Емігрувала до Німеччини. Мист. освіту здобула в Мюнхені (1947– 48) та у..."
4172,Гнатюк Володимир Миколайович,1957.0,"с. Нири Турійського, нині Ковельського р-ну Волинської обл.",поет,"(28. 03. 1957, с. Нири Турійського, нині Ковельського р-ну Волинської обл.) — поет, педагог. Член НСПУ (2015). Кандидат педагогічних наук (2001). Премії імені Г. Сковороди (2023), імені І. Огієнка (2008), імені О...."
4173,Гнатюк Анатолій Васильович,1964.0,с. Немирівка Старокостянтинів. р-ну Хмельн. обл.,актор,"(12. 06. 1964, с. Немирівка Старокостянтинів. р-ну Хмельн. обл.) – актор. Брат М. Гнатюка. Народний артист України (2015). Орден «За заслуги» 3-го ступеня (2024). Закін. Київ. інститут театр. мистецтва (1981;..."
4174,Гнатюк Валерій Михайлович,1964.0,м. Кіцмань Чернів. обл.,графік,"(29. 06. 1964, м. Кіцмань Чернів. обл.) – графік. Член НСХУ (2003). Закін. Одес. пед. інститут (1991; викл. Т. Басанець, В. Власов). Створює акварелі, пастелі. Учасник всеукр. мистецьких виставок від 1999...."
4176,Гнатюк Григорій Михайлович,1951.0,с. Небелівка Новоархангел. р-ну Кіровогр. обл.,живописець і графік,"(18. 06. 1951, с. Небелівка Новоархангел. р-ну Кіровогр. обл.) – живописець і графік. Заслужений художник України (2009). Член НСХУ (1987). Закін. Харків. художнє училище (1975; викл. В. Ленчин). Відтоді – у..."
4180,Гнатюк Микола Васильович,1952.0,"с. Шарлаївка, нині с. Волиця-Польова Теофіпол. р-ну Хмельн. обл.",естрадний співак (баритон),"(14. 09. 1952, с. Шарлаївка, нині с. Волиця-Польова Теофіпол. р-ну Хмельн. обл.) – естрадний співак (баритон). Брат А. Гнатюка. Народний артист УРСР (1978). Лауреат міжнар. конкурсів естрад. пісні..."
4181,Гнатюк Михайло Дмитрович,1952.0,"м. Коломия Станіслав., нині Івано-Фр. обл.",живописець і дизайнер,"(14. 11. 1952, м. Коломия Станіслав., нині Івано-Фр. обл.) – живописець і дизайнер. Закін. Коломий. ПТУ № 10 (1969), вільний слухач Інституту живопису, скульптури та архітектури у Ленінграді (нині..."
4182,Гнатюк Михайло Іванович,1947.0,"с. Заріччя Надвірнян. р-ну, нині Івано-Фр. обл.",літературознавець,"(04. 03. 1947, с. Заріччя Надвірнян. р-ну, нині Івано-Фр. обл.) – літературознавець, громадсько-культурний діяч. Доктор філологічних наук (2003), професор (2003). Заслужений діяч науки і техніки України..."
4183,Гнатюк Ніна Юхимівна,1947.0,"с. Безводне, нині Ямпіл. р-ну Вінн. обл.",поетеса,"(18. 03. 1947, с. Безводне, нині Ямпіл. р-ну Вінн. обл.) – поетеса, журналістка. Член НСПУ (1971). Закін. Вінн. пед. інститут (1974). Працювала у ред. г. «Слово хлібороба» (м. Ямпіль, 1967–76), кор. Вінн. обл. радіо..."
4185,Гнатюк Юрій Дмитрович,1921.0,"с. Бистриня, нині Надвірнян. р-ну Івано-Фр. обл.",диригент,"(30. 04. 1921, с. Бистриня, нині Надвірнян. р-ну Івано-Фр. обл.) – диригент, громадський діяч. Закін. гімназію у Станіславі (нині Івано-Франківськ), студіював медицину у Львові та Мюнхені. Від 1940 – у..."
4186,Гнатюк Ярослав Васильович,1946.0,с. Білобожниця Чортків. р-ну Терноп. обл.,співак,"(01. 04. 1946, с. Білобожниця Чортків. р-ну Терноп. обл.) – співак. Заслужений артист
УРСР (1990). Закін. Київ. кон-серваторію (1975). У 1966– 68 – арт. хор. капели Укр. радіо і телебачення; 1975–83 – соліст Укр...."
4187,Гнатюк Галина Олександрівна,1977.0,"м. Радивилів, нині Дубенського р-ну Рівненської обл.",поетеса,"(25. 04. 1977, м. Радивилів, нині Дубенського р-ну Рівненської обл.) — поетеса. Член НСПУ (2015). Літературна премія імені М. Дубова (2015). Закінчила Львівський університет (1999). Учителює. Дебютувала 1994..."
4188,Гнатюк Мирослава Михайлівна,1957.0,с. Мшанець Зборів. р-ну Терноп. обл.,літературознавець,"(25. 03. 1957, с. Мшанець Зборів. р-ну Терноп. обл.) – літературознавець. Доктор філологічних наук (2006), професор (2011). Закін. Київський університет (1981). Працювала у Гол. ред. УРЕ (1975–81), н. с. Інституту..."
4190,Гнєдаш Олена Тимофіївна,1950.0,Київ,художник-монументаліст,"(14. 06. 1950, Київ) – художник-монументаліст. Дружина О. Мединського. Член НСХУ (1981). Закін. Київський художній інститут (1976; майстерня Т. Яблонської). Працює у галузі монум.-декор. мистецтва,..."
4191,Гнєдаш Руслана Борисівна,1937.0,Київ,музикознавець,"(25. 01. 1937, Київ) – музикознавець. Сестра В. Гнєдаша. Член НСЖУ (2001), НСКУ (2002). Закін. Київську консерваторію (1964; кл. Л. Єфремової). 1964–67 – муз. ред. Держ. комітету телебачення і радіомовлення УРСР;..."
4197,Гнидь Володимир Пилипович,1947.0,"с. Йосипівка Олеського, нині Буського р-ну Львів. обл.",хоровий диригент,"(24. 07. 1947, с. Йосипівка Олеського, нині Буського р-ну Львів. обл.) – хоровий диригент. Брат Б. Гнидя. Заслужений працівник культури України (1998). Закінчив Львівське культурно-освітнє училище (1966;..."
4199,Гнилоквас Віктор Андрійович,1935.0,"с. Ярове Кам’ян. р-ну, нині Черкас. обл.",співак,"(30. 10. 1935, с. Ярове Кам’ян. р-ну, нині Черкас. обл.) – співак. Заслужений артист УРСР (1977). Державні нагороди СРСР. Закін. курси культпрацівників у Черкасах (1956). Від 1957 – арт. Черкас. нар. хору. У..."
4208,Гобдич Микола Миколайович,1961.0,смт Битків Надвірнян. р-ну Івано-Фр. обл.,хоровий диригент,"(28. 04. 1961, смт Битків Надвірнян. р-ну Івано-Фр. обл.) – хоровий диригент, музично-громадський діяч. Чоловік Л. Байди. Заслужений діяч мистецтв України (1997). Народний артист України (2018). Закін...."
4210,Говда Олег Йосипович,1964.0,Львів,письменник,"(17. 04. 1964, Львів) – письменник. Закін. Львів. політех. інститут (1987). Працював на виробництві, був фермером на Івано-Франківщині. Мешкає у Львові, займається письменниц. і видавн. діяльністю...."
4212,Говдя Ольга Петрівна,1950.0,"Ленінград, нині Санкт-Петербург",мистецтвознавець,"(03. 01. 1950, Ленінград, нині Санкт-Петербург) – мистецтвознавець. Дочка П. Говді, мати К. Мамаєвої. Член НСХУ (1984). Закінчила Київський художній інститут (1972; викл. П. Білецький, Л. Владич, Л. Сак)...."
4216,Гога В’ячеслав Васильович,1951.0,Харків,співак (баритон),"(20. 04. 1951, Харків) – співак (баритон). Заслужений артист Туркмен. РСР (1979), України (2004). Закін. Київську консерваторію (1986; кл. К. Огнєвого). Соліст ансамблів пісні і танцю Середньоазіатського..."
4217,Гоголь Василь Данилович,1962.0,с. Ріп’яна Старосамбір. р-ну Львів. обл.,скульптор,"(08. 01. 1962, с. Ріп’яна Старосамбір. р-ну Львів. обл.) – скульптор. Заслужений діяч мистецтв України (1997). Член НСХУ (1992). Закін. Львів. училище приклад. мистецтва (1981), Київ. худож. інститут (1991; викл...."
4218,Гоголь Ольга Борисівна,1956.0,Миколаїв,художниця декоративно-ужиткового мистецтва,"(26. 03. 1956, Миколаїв) – художниця декоративно-ужиткового мистецтва. Член НСХУ (1992). Закін. Косів. технікум нар. худож. промислів (Івано-Фр. обл., 1977; викл. А. Калитко, В. Чіх), Одес. пед. інститут (1992;..."
4220,Годенко-Наконечна Олена Петрівна,1954.0,Мінськ,мистецтвознавець,"(10. 03. 1954, Мінськ) – мистецтвознавець, культуролог. Дружина В. Наконечного. Член НСХУ (1989). Закін. Київський художній інститут (1977; викл. П. Білецький, Л. Міляєва, Л. Сак). Працювала викл. історії..."
4221,Годзяцький Віталій Олексійович,1936.0,Київ,композитор,"(29. 12. 1936, Київ) – композитор, педагог. Заслужений діяч мистецтв України (1996). Член НСКУ (1969–70, від 1973). Премія ім. Б. Лятошинського (2003). Закін. Київську консерваторію (1961; кл. Б. Лятошинського)...."
4223,Годовальников Андрій Валентинович,1960.0,"м. Владивосток, РФ",живописець,"(15. 05. 1960, м. Владивосток, РФ) – живописець, художник театру і скульптор. Чоловік Т. Годовальникової. Навч. у Далекосхід. інституті мистецтв (м. Владивосток, РФ; 1977–80). Основні галузі – станк. і..."
4224,Годовальникова Тетяна Василівна,1962.0,Севастополь,живописець,"(31. 12. 1962, Севастополь) – живописець. Дружина А. Годовальникова. Член НСХУ (1992). Закін. Крим. художнє училище (Сімферополь, 1984; викл. Л. Балкінд). На творчій роботі. Учасниця респ. та міжнар...."
4226,Ґодовський Володимир  Михайлович,1947.0,м. Вашківці Вижниц. р-ну Чернів. обл.,хореограф,"(18. 06. 1947, м. Вашківці Вижниц. р-ну Чернів. обл.) – хореограф, педагог. Кандидат педагогічних наук (1990),  професор (1999). Заслужений діяч мистецтв України (2007). Лауреат низки міжнар., всесоюз. та..."
4228,Годун Микола Петрович,1953.0,с. Посягва Гощан. р-ну Рівнен. обл.,живописець,"(01. 08. 1953, с. Посягва Гощан. р-ну Рівнен. обл.) – живописець. Член НСХУ (1987). Закін. Одес. художнє училище (1979; викл. В. Полнобродський). На творчій роботі. Учасник обл. та респ. мистецьких виставок...."
