id,name,birth_year,birth_city,profession,bio_text
3463,Волинов Станіслав Петрович,1933.0,"м. Оренбург, РФ",військовий диригент,"(06. 05. 1933, м. Оренбург, РФ) – військовий диригент. Заслужений діяч мистецтв УРСР (1980), засл. працівник культури Польщі (1985). Закін. Інститут військ. диригентів у Москві (1955; кл. І. Лисенка). Диригент..."
3471,Волицька Ірина Василівна,1955.0,м. Сколе Львів. обл.,театрознавець,"(22. 10. 1955, м. Сколе Львів. обл.) – театрознавець, режисер. Канд. мистецтвознавства (1992). Нац. премія ім. Лесі Українки (2002). Закін. Ленінгр. інститут театру, музики і кінематографії (1980; викл. Н...."
3474,Волков Григорій Петрович,1959.0,с. Крутий Берег Полтав. р-ну Полтав. обл.,живописець і графік,"(31. 07. 1959, с. Крутий Берег Полтав. р-ну Полтав. обл.) – живописець і графік. Член НСХУ (1990). Закін. Харків. пед. університет (2001; викл. В. Шершень). Працював у Полтаві: викл. дит. худож. школи (1979–93) та..."
3478,Волков Олександр  Павлович,1957.0,"м. Керч, нині АР Крим",прозаїк,"(07. 03. 1957, м. Керч, нині АР Крим) – прозаїк. Член НСПУ (2003). Літ. премія ім. Л. Толстого (2003). Закін. Військ.-мед. академію у Ленінграді (нині С.-Петербург, 1982). Служив на Чорномор. флоті. 1991 звільнений у..."
3479,Волков Олексій Михайлович,1965.0,Тернопіль,прозаїк,"(10. 05. 1965, Тернопіль) – прозаїк. Член НСПУ (2003). 1-і премії всеукр.
літ. конкурсів «Золотий Бабай» (2002), «Коронація слова» (2005). Закін. Терноп. мед. інститут (1988). Працював хірургом у Кіровогр. обл...."
3482,Волков Вадим Анатолійович,1974.0,Чернівці,поет,"(01. 08. 1974, Чернівці) – поет. Член НСПУ (2002). Закін. Укр. фармацевт. університет (Харків, 1996), де й працював відтоді. 2002–04 – у ВАТ «Київмедпрепарат»; від 2004 – ВАТ «Актавіс». Пише російською мовою...."
3483,Волков Сергій Михайлович,1955.0,"м. Сталіно, нині Донецьк",піаніст,"(03. 05. 1955, м. Сталіно, нині Донецьк) – піаніст, педагог. Канд. мистецтвознавства (2003). Заслужений діяч мистецтв України (2008). Закін. Донец. муз.-пед. інститут (1978; кл. Л. Адаменко). Працював викл. і..."
3484,Волков Борис  Іванович,1923.0,Харків,художник-оформлювач,"(05. 03. 1923, Харків) – художник-оформлювач. Член НСХУ (1971). Заслужений художник УРСР (1981). Освіта середня. Осн. роботи – у галузі монум.-декор. мистецтва, дизайну.

Тв.: оформлення павільйонів..."
3486,Волков Борис Олексійович,1958.0,"м. Саратов, РФ",режисер анімаційних фільмів,"(18. 03.  1958, м. Саратов, РФ) – режисер анімаційних фільмів. Закін. Саратов. художнє училище (1977), Харків. худож. інститут (1982). У 1982–94 і від 2005 – на студії «Укранімафільм», художник-постановник м/ф..."
3488,Волков Віктор Олексійович,1948.0,"містечко Волочиськ, нині місто Хмельн. обл.",хоровий диригент,"(25. 02.  1948, містечко Волочиськ, нині місто Хмельн. обл.) – хоровий диригент, педагог. Заслужений артист України (2001). Закін. Одес. консерваторію (1973; кл. Л. Сичової). 1974–84 працював викл. муз.-пед...."
3489,Волков Віталій Леонідович,1927.0,"с. Аристове Ярослав. обл., РФ",графік і живописець,"(03. 07. 1927, с. Аристове Ярослав. обл., РФ) – графік і живописець. Закін. Моск. полігр. інститут (1968). Працював у Дніпроп. худож.-вироб. майстернях (1959), кер. ізостудії Палацу культури; на Львів...."
3493,Волкова Валентина Гнатівна,1950.0,"м. Фокіно Брян. обл., РФ",скульпторка,"(08. 04. 1950, м. Фокіно Брян. обл., РФ) – скульпторка. Член НСХУ (1990). Закін. Харків. худож.-пром. інститут (1980; викл. Л. Жуковська, Д. Сова). Відтоді працювала у Полтав. організації Худож. фонду України (м...."
3496,Волкова Тетяна Сергіївна,1941.0,"м. Дмитрів Моск. обл., РФ",літературознавець,"(05. 08. 1941, м. Дмитрів Моск. обл., РФ) – літературознавець. Доктор філологічних наук (1995), професор (1997). Закін. Ужгород. університет (1965), де 1966–78 і працювала; 1978–79 – у Луцькому пед. інституті; від..."
3499,Волненко Олександр  Анатолійович,1941.0,Харків,художник театру і живописець,"(23. 03. 1941, Харків) – художник театру і живописець. Син А. Волненка, чоловік Н. Марченко. Член НСХУ (1979). Закін. Київський художній інститут (1965; майстерня М. Хмелька). Працював декоратором Київ...."
3502,Волобуєв Ігор Феліксович,1962.0,Київ,скульптор,"(22. 01. 1962, Київ) – скульптор. Член НСХУ (1994). Закін. Укр. АМ (1994; викл. В. Бородай, В. Швецов). 1984–88 працював на підприємствах та у музеях Києва. Учасник респ. та міжнародних художніх виставок від 1989...."
3503,Волобуєва Наталія Євгенівна,1953.0,Київ,художник-монументаліст,"(13. 05. 1953, Київ) – художник-монументаліст. Дочка О. Яблонської, Євгена Всеволодовича, сестра Євгена Євгеновича Волобуєвих. Член НСХУ (1980). Закін. Моск. вище худож.-пром. училище (1978; майстерня В...."
3508,Володарський Віктор Володимирович,1960.0,Дніпропетровськ,художник-монументаліст,"(16. 05. 1960, Дніпропетровськ) – художник-монументаліст. Член НСХУ (1994). Закін. Харків. худож.-пром. інститут (1985; викл. Є. Биков, О. Проніна). Працює у галузях живопису, монум.-декор. мистецтва. Серед..."
3510,Володіна Алла Олександрівна,1964.0,Київ,скульпторка,"(03. 08. 1964, Київ) – скульпторка. Член НСХУ (1995). Закін. Київський художній інститут (1990; викл. М. Вронський, В. Чепелик). Від 1990 – учасниця респ., всесоюз. мистецьких виставок. Риси твор. стилю –..."
3512,Володченко Станіслав  Никифорович,1938.0,"м. Макіївка Сталін., нині Донец. обл.",графік і монументаліст,"(28. 05. 1938, м. Макіївка Сталін., нині Донец. обл.) – графік і монументаліст. Член НСХУ (1981). Закін. Укр. полігр. інститут у Львові (1972; викл. В. Бунов). Працював викл. у Крим. худож. училищі (1965–71); на..."
3513,Володько Віктор Миколайович,1956.0,Харків,живописець і монументаліст,"(28. 02. 1956, Харків) – живописець і монументаліст. Член НСХУ (1989). Обл. премія ім. М. Башкирцевої (1987). Закін. Харків. худож.-пром. інститут (1983; викл. О. Капшук, Б. Косарев). Працює на Полтав...."
3515,Волонтир Володимир Ілліч,1956.0,с. Кузьмине Мукачів. р-ну Закарп. обл.,хоровий диригент,"(08. 07. 1956, с. Кузьмине Мукачів. р-ну Закарп. обл.) – хоровий диригент, композитор. Заслужений діяч мистецтв України (1999). Член НСКУ (1996). Закін. Київську консерваторію (1980; кл. хор. диригування М...."
3517,Волотівська Галина Костівна,1943.0,с. Яроповичі Андрушів. р-ну Житомир. обл.,живописець,"(07. 08. 1943, с. Яроповичі Андрушів. р-ну Житомир. обл.) – живописець. Член НСХУ (1994). Навч. у мист. студії Г. Хусіда (1966–72), закін. Київ. інститут нар. господарства (1965), Моск. заоч. нар. університет..."
3519,Волошенко Тамара Василівна,1952.0,"с. Модричі Дрогоб. р-ну, нині Львів. обл.",живописець,"(30. 06. 1952, с. Модричі Дрогоб. р-ну, нині Львів. обл.) – живописець. Заслужений художник України (2005). Член НСХУ (1995). Закін. Львів. інститут прикладного та декоративного мистецтва (1976; викл. Д...."
3522,Волошин Богдан Романович,1962.0,Львів,журналіст і письменник,"(псевд.: Марциняк, Богдан Городецький, Мольфар Зозулька, Федір Крюґґер-старший, Роман Трак; 06. 01. 1962, Львів) – журналіст і письменник. Закін. Львівський університет (1984). Працював у г. «Ленінська..."
3523,Волошин Володимир Віталійович,1972.0,"смт Армянськ, нині місто АР Крим",композитор,"(19. 05. 1972, смт Армянськ, нині місто АР Крим) – композитор. Член НСКУ (2002). Закін. Моск. консерваторію (1999; кл. Т. Хрєнникова). Відтоді викладав у муз. школі в Ялті. Від 2003 – на творчій роботі.

Тв.:..."
3527,Волошин Леся Володимирівна,1974.0,м. Корсунь-Шевченківський Черкас. обл.,драматург,"(13. 10. 1974, м. Корсунь-Шевченківський Черкас. обл.) – драматург, театрознавець. Член НСПУ (2004). Премія ім. В. Ревуцького (2003). Закін. Київ. інститут театр. мистецтва (2003). У 2001–03 – пров. ред...."
3528,Волошин Любов Василівна,1942.0,Львів,мистецтвознавець,"(12. 03. 1942, Львів) – мистецтвознавець. Член НСХУ (2002). Закін. Львів. мед. інститут (1966), Інститут живопису, скульптури та архітектури у Ленінграді (нині С.-Петербург, 1972). Відтоді працює в Нац. музеї..."
3532,Волошинов Георгій Іполитович,1902.0,Херсон,архітектор,"(08. 01. 1902, Херсон – ?) – архітектор. Закін. Київський художній інститут (1928; викл. П. Альошин, О. Вербицький). Спроектував клуб залізничників на ст. Ясинувата в Донбасі (1925), житл. будинки на вул...."
3533,Волошинов Олег Васильович,1936.0,Миколаїв,живописець,"(31. 07. 1936, Миколаїв) – живописець. Син В. Волошинова, брат Т. Басанець. Член НСХУ (1971). Заслужений художник України (2013). Закін. Інститут живопису, скульптури та архітектури у Ленінграді (нині..."
3534,Волошинова Тетяна Олександрівна,1973.0,Кіровоград,художниця театру і живописець,"(27. 01. 1973, Кіровоград) – художниця театру і живописець. Член НСХУ (2000). Закін. Академію образотвор. мистецтва і архітектури (Київ, 1998; майстерня Д. Лідера). Учасниця худож. виставок від 1993. Персон...."
3537,Волощак Всеволод Романович,1944.0,"с. Молодинче Ходорів., нині Жидачів. р-ну Львів. обл.",художник декоративно-ужиткового мистецтва і живописець,"(26. 02. 1944, с. Молодинче Ходорів., нині Жидачів. р-ну Львів. обл.) – художник декоративно-ужиткового мистецтва і живописець. Член НСХУ (1995). Закін. Львів. мед. училище (1963). Працював стоматологом...."
3538,Волощук Василь Миколайович,1969.0,с. Сваричів Рожнятів. р-ну Івано-Фр. обл.,скрипаль,"(19. 05. 1969, с. Сваричів Рожнятів. р-ну Івано-Фр. обл.) – скрипаль, композитор. Заслужений артист України (2000). Закін. Київську консерваторію (1994; кл. В. Козіна). 1989–92 – арт. Київ. об’єдн. муз...."
3539,Волощук Ігор Михайлович,1963.0,Івано-Франківськ,мистецтвознавець,"(25. 05. 1963, Івано-Франківськ) – мистецтвознавець. Член НСХУ (1993). Закін. Київський художній інститут (1985; викл. Г. Заварова, Л. Міляєва). Працював худож. кер. скульптур. цеху Твор.-вироб. комбінату..."
3541,Волощук Михайло,1934.0,"с. Негостіна Сучав. пов., Румунія",український поет в Румунії,"(12. 01. 1934, с. Негостіна Сучав. пов., Румунія) – український поет в Румунії. Член СП Румунії. Середня муз. освіта. Один із зачинателів сучас. укр. поезії Румунії. Вірші В. друкувались у г. «Новий..."
3542,Волощук Євгенія Валентинівна,1966.0,Житомир,літературознавець,"(18. 03. 1966, Житомир) — літературознавець. Доктор філологічних наук (2010). Закінчила Житомирський педагогічний інститут (1989). Учителювала (1984—97); від 1997 — заступник головного редактора журналу..."
3544,Волченко Олександр Тимофійович,1946.0,"м. Владивосток, РФ",живописець,"(18. 02. 1946, м. Владивосток, РФ) – живописець. Член НСХУ (1994). Закін. Київський художній інститут (1970; викл. В. Болдирев, Т. Голембієвська, А. Пламеницький). Працював на Київ. комбінаті монум.-декор...."
3546,Волчков Семен Васильович,1914.0,"м. Куп’янськ, нині Харків. обл.",художник і поет,"(1914, м. Куп’янськ, нині Харків. обл. – ?) – художник і поет. Член СХУ. Учасник 2-ї світової війни. Закін. Вище військ.-мор. училище у Севастополі, Моск. текстил. інститут. Брав участь у мист...."
3547,Вольвач Павло Іванович,1963.0,Запоріжжя,поет,"(09. 10. 1963, Запоріжжя) – поет, прозаїк, публіцист. Літ. премії ім. В. Симоненка (1997) та В. Сосюри (1999). Член НСПУ (1997). Закін. Запоріз. університет (2003). Працював
на виробництві, в торгівлі, на..."
3548,Волькензон Олександр Йосипович,1903.0,,скульптор,"(12 (25). 06. 1903, Харків – ?) – скульптор. Член АРМУ (1930–32). Закін. Харків. худож. інститут (1929; викл. Л. Блох, Б. Кратко). Працював у галузях станк., монум. та декор. пластики. Учасник худож. виставок від..."
3552,Вольський Петро Дмитрович,1925.0,"м. Чимкент, нині Казах-стан",живописець і режисер,"(18. 05. 1925, м. Чимкент, нині Казах-стан) – живописець і режисер. Член НСХУ (1960). Учасник 2-ї світової війни. Бойові нагороди. Закін. Риз. АМ (1956; викл. Е. Скулме, Я. Тільберґ). Від 1970 – гол. художник..."
3553,Вольський Станіслав Францович,1943.0,"м. Славута Кам’янець-Поділ., нині Хмельн. обл.",художник ужиткового мистецтва,"(18. 07. 1943, м. Славута Кам’янець-Поділ., нині Хмельн. обл.) – художник ужиткового мистецтва. Заслужений художник України (2003). Член НСХУ (1987). Закін. Львів. інститут прикладного та декоративного..."
3555,Вольф Аріс Самуїлович,1911.0,"м. Чортків, нині Терноп. обл.",літературознавець,"(22. 04. 1911, м. Чортків, нині Терноп. обл. – ?) – літературознавець. Кандидат філологічних наук (1971). Закін. Чортків. гімназію (1930). До 1937 навч. у Львів. (також 1939–41) і Варшав. університетах з..."
3560,Волянська Лілея Олегівна,1945.0,"м. Падерборн, Німеччина",українська співачка (сопрано) та художниця у Канаді,"(28. 06. 1945, м. Падерборн, Німеччина) – українська співачка (сопрано) та художниця у Канаді. Дочка Олега-Мирослава, сестра Богдани, онука Павла Волянських. Художню й мистецтвознавчу освіту..."
3564,Ворвулєв Володимир Миколайович,1949.0,Мінськ,хоровий диригент,"(15. 03. 1949, Мінськ) – хоровий диригент. Син М. Ворвулєва. Заслужений діяч мистецтв України (2005). Закін. Київську консерваторію (1972; кл. В. Колесника, П. Муравського). Відтоді – хормейстер Київ...."
3566,Воробей Марія Іванівна,1953.0,с. Соболівка Бровар. р-ну Київ. обл.,поетеса,"(29. 03. 1953, с. Соболівка Бровар. р-ну Київ. обл.) – поетеса. Член НСПУ (1998). Закін. Київський університет (1976). Учителювала. 1980–90 – керівник літ.-мист. об’єдн. «Криниця» (Бровар. р-н); від 1990 –..."
3567,Воробець Віктор,1893.0,"с. Залужне, нині Залужжя Рогатин. р-ну Івано-Фр. обл.",видавець і редактор,"(1893, с. Залужне, нині Залужжя Рогатин. р-ну Івано-Фр. обл. – ?) – видавець і редактор. Учасник 1-ї світової війни. У січні 1919 на Закарпатті пораненим потрапив до румун. полону. У жовтні переїхав у..."
3569,Воробйов Микола Панасович,1941.0,"с. Мельникiвка, нині Смiлян. р-ну Черкас. обл.",поет,"(12. 10. 1941, с. Мельникiвка, нині Смiлян. р-ну Черкас. обл.) – поет, художник. Національна премія України імені Т. Шевченка (2005). Навч. на філос. факультеті Київ. університету (1965– 68). Дебютував 1962 у г...."
3570,Воробйова-Фоміна Жанна Євгенівна,1938.0,Дніпропетровськ,графік і живописець,"(23. 02. 1938, Дніпропетровськ) – графік і живописець. Бронз. медаль ВДНГ (1968), 1-а премія Всесоюз. конкурсу книжк. знака (Мінськ, 1974). Член НСХУ (1971). Закін. Харків. худож.-пром. інститут (1967; Г...."
3574,Ворона Олександр Іванович,1947.0,"м. Макіївка Сталін., нині Донец. обл.",живописець і графік,"(17. 01. 1947, м. Макіївка Сталін., нині Донец. обл.) – живописець і графік. Член НСХУ (1994). Закін. Ворошиловгр. художнє училище (нині Луганськ, 1974; викл. В. Вайнреб, Є. Чумак). Працює у галузі станк...."
3575,Ворона Ольга Олександрівна,1961.0,Київ,живописець і монументаліст,"(20. 11. 1961, Київ) – живописець і монументаліст. Дочка О. Ворони. Член НСХУ (1990). Закінчила Київський художній інститут (1987; викл. О. Кожеков, М. Стороженко, В. Чеканюк). Працювала на..."
3578,Воронич Михайло Васильович,1965.0,с. Саджава Богородчан. р-ну Івано-Фр. обл.,графік і живописець,"(17.  07. 1965, с. Саджава Богородчан. р-ну Івано-Фр. обл.) – графік і живописець. Брат Ярослава та Івана Вороничів. Закін. Укр. полігр. інститут у Львові (1993; викл. А. Попов). Працює у галузях графіки та..."
3579,Воронін Анатолій Петрович,1956.0,с. Довжик Золочів. р-ну Харків. обл.,співак (баритон),"(16. 10. 1956, с. Довжик Золочів. р-ну Харків. обл.) – співак (баритон), педагог. Заслужений артист України (1995). Премія ім. С. Прокоф’єва (1995). Перші премії Респ. конкурсу камер. колективів та..."
3580,Воронін Валерій Володимирович,1958.0,м. Кривий Ріг Дніпроп. обл.,письменник,"(05. 08. 1958, м. Кривий Ріг Дніпроп. обл.) – письменник, журналіст. Чоловік Т. Вороніної. Закін. Криворіз. гірничоруд. інститут (1980), Моск. університет (1988). У 1980–2001 працював (із перервою) у севастоп...."
