id,name,birth_year,birth_city,profession,bio_text
7311,Іванюк-Корф Наталія  Анатоліївна,1985.0,м. Кременчук Полтав. обл.,живописець,"(16. 04. 1985, м. Кременчук Полтав. обл.) – живописець. Член НСХУ (2010). Закін. Полтав. тех. університет (2008), де відтоді й працює. Учасниця міських, обл., всеукр. худож. виставок, пленерів, керам...."
7319,Івахів Соломія  Орестівна,1980.0,Львів,скрипалька,"(03.04.1980, Львів) – скрипалька. Дочка О. Івахіва. Заслужена артистка України (2021). Лауреатка Міжнародного конкурсу скрипалів ім. Я. Коціяна (м. Усті-над-Орліці, Чехія, 1993) та ім. С. Прокоф’єва (м...."
7323,Івахненко-Пошиваник Людмила  Андріївна,1946.0,Черкаси,графік,"(05. 05. 1946, Черкаси) – графік. Закін. Київ. вечір. факультет Укр. полігр. інституту у Львові (1972; викл. О. Крилова). На творчій роботі. Основна галузь – книжк. графіка. Оформила книги київ...."
7327,Івашків Василь  Михайлович,1958.0,с. Потік Козів. р-ну Терноп. обл.,літературознавець,"(29. 07. 1958, с. Потік Козів. р-ну Терноп. обл.) – літературознавець, фольклорист. Чоловік Г. Івашків. Доктор філологічних наук (2010). Закін. Львівський університет (1980). Працював у Терноп. пед...."
7328,Івашків Галина  Миколаївна,1955.0,Луцьк,художниця театру і живописець,"(13. 05. 1955, Луцьк) – художниця театру і живописець, педагог. Дипломи Осін. салону «Високий Замок» (Львів, 2008–09). Закін. Львів. інститут прикладного та декоративного мистецтва (1982; викл. Д...."
7329,Івашків Галина  Михайлівна,1955.0,с. Цеперів Кам’янка-Бузького р-ну Львів. обл.,мистецтвознавець,"(05. 03. 1955, с. Цеперів Кам’янка-Бузького р-ну Львів. обл.) – мистецтвознавець. Дружина В. Івашківа. Канд. мистецтвознавства (2004). Закін. Львівський університет (1986). Працювала екскурсоводом та н...."
7330,Івашко Юлія Вадимівна,1970.0,Київ,архітектор,"(18. 02. 1970, Київ) — архітектор. Доктор архітектури (2014), професор (2015). Закінчила Київський інженерно-будівельний інститут (1993), де від 1994 й працює (нині університет будівництва і архітектури): від..."
7335,Іващенко Григорій  Лукич,1954.0,с. Бурімка Семенів. р-ну Полтав. обл.,культуролог і графік,"(20. 09. 1954, с. Бурімка Семенів. р-ну Полтав. обл.) – культуролог і графік. Закін. Дніпроп. університет (1980). Працював 1980–82 у зварюв. технікумі; від 1985 – викладач історії та культурології Дніпроп...."
7336,Іващенко Григорій  Митрофанович,1930.0,"с. Бурімка, нині Семенів. р-ну Полтав. обл.",співак (баритон),"(02. 02. 1930, с. Бурімка, нині Семенів. р-ну Полтав. обл.) – співак (баритон). Заслужений артист Морд. РСР (1964). Закін. Моск. консерваторію (1958). Відтоді викладав у Полтав. пед. інституті та вечір. муз...."
7337,Іващенко Григорій  Олександрович,1989.0,м. Кривий Ріг Дніпроп. обл.,дизайнер і живописець,"(04. 01. 1989, м. Кривий Ріг Дніпроп. обл.) – дизайнер і живописець. Закін. худож.-графіч. факультет Криворіз. пед. університету (2009; викл. І. Брижата, В. Мішуровський). На творчій роботі. Учасник..."
7338,Іващенко Ігор  Єфремович,1931.0,"с. Григорівка, нині Обухів. р-ну Київ. обл.",диригент,"(17. 12. 1931, с. Григорівка, нині Обухів. р-ну Київ. обл.) – диригент, композитор. Народний артист УРСР (1974). Закін. Київську консерваторію (1957; кл. диригування О. Климова). 1956–80 – гол. диригент Держ...."
7339,Іващенко Тетяна  Ігорівна,1955.0,Сімферополь,дизайнер одягу,"(02. 04. 1955, Сімферополь) – дизайнер одягу. Закін. Київ. політех. інститут (1979). Відтоді викладала електротех. дисципліни у Київ. технікумі радіоелектроніки. Від 1989 – на творчій роботі. Президент..."
7340,Іващенко Тетяна  Петрівна,1960.0,Київ,драматург,"(05. 10. 1960, Київ) – драматург. Заслужений діяч мистецтв України (2018). Закін. Київ. інститут культури (1984). Працювала в б-ці Київ. інституту театр. мистецтва (1985–2001). Поставлено її п’єси «Принц –..."
7347,Івлюшкін Павло В’ячеславович,1977.0,"Дніпропетровськ, нині Дніпро",хореограф,"(22. 09. 1977, Дніпропетровськ, нині Дніпро) — хореограф, режисер, тренер, педагог. Заслужений діяч мистецтв України (2021). Майстер спорту зі спортивних танців на візках (2019). Суддя міжнародного..."
7348,Івницька Зоя  Олександрівна,1928.0,"м. Біла Церква, нині Київ. обл.",художниця театру,"(04. 11. 1928, м. Біла Церква, нині Київ. обл.) – художниця театру, живописець, графік. Дружина М. Івницького. Закін. Одес. художнє училище (1953; викл. Л. Мучник, Д. Фруміна). Працювала 1954–66 учителем..."
7351,Івченко Анатолій  Володимирович,1940.0,"с. Краснокумка Ставроп. краю, РФ",графік і живописець,"(07. 05. 1940, с. Краснокумка Ставроп. краю, РФ) – графік і живописець. Член НСХУ (1977). Закін. Дніпроп. художнє училище (1962; викл. М. Боровський). Працював 1962–91 на Запоріз. худож.-вироб. комбінаті. На..."
7352,Івченко Анатолій  Михайлович,1940.0,с. Нива Трудова Апостолів. р-ну Дніпроп. обл.,художник-монументаліст,"(03. 07. 1940, с. Нива Трудова Апостолів. р-ну Дніпроп. обл.) – художник-монументаліст. Член НСХУ (1988). Закін. Харків. худож.-пром. інститут (1971; викл. Б. Косарев, Ю. Старостенко, М. Шапошников). Відтоді..."
7356,Івченко Володимир  Іванович,1936.0,с. Зеленьки Миронів. р-ну Київ. обл.,прозаїк,"(17. 11. 1936, с. Зеленьки Миронів. р-ну Київ. обл.) – прозаїк, публіцист. Член НСПУ (1994). Закінчив Київський університет (1959). Працював у газетах Алтайського краю (РФ); 1967–78 – завідувач відділу,..."
7359,Івченко Галина Андріївна,1962.0,м. Яворів Львівської обл.,хоровий диригент,"(03. 05. 1962, м. Яворів Львівської обл.) — хоровий диригент, педагог, музично-громадська діячка. Заслужена діячка мистецтв України (2021). Закінчила Рівненський педагогічний інститут (1985). Від 1990..."
7366,Ігнатенко Оксана  Олександрівна,1972.0,Дніпропетровськ,поетеса,"(16. 07. 1972, Дніпропетровськ) – поетеса. Член НСПУ (2003). Закін. Дніпроп. університет (1995). Учителювала, працювала на телебаченні, кор. г. «Трибуна металурга»; нині веде літ. студію для молодших..."
7370,Ігнатуша Олександр  Федорович,1955.0,Київ,актор,"(03. 11. 1955, Київ) – актор, режисер, педагог. Член НСКінУ (1985). Народний артист України (2025). Закін. Київ. інститут театр. мистецтва (1976; курс Л. Олійника), Вищі курси сценаристів і кінорежисерів у..."
7372,Ігнатченко Ірина Георгіївна,1972.0,Дніпропетровськ,піаністка,"(21. 05. 1972, Дніпропетровськ) – піаністка, музикознавець, педагог. Дочка Г. Ігнатченка. Канд. мистецтвознавства (2003). Лауреатка міжнар. конкурсів «Золота осінь» (Хмельницький, 1993, 1-а премія),..."
7373,Ігнатьєв Володимир  Петрович,1951.0,"м. Картали Челябін. обл., РФ",художник декоративно-ужиткового мистецтва,"(14. 08. 1951, м. Картали Челябін. обл., РФ) – художник декоративно-ужиткового мистецтва, скульптор. Срібні медалі ВДНГ СРСР (1985, 1987–88). Член НСХУ (1992). Закін. Магнітогор. пед. інститут (Челябін. обл.,..."
7374,Ігнатьєв Олег  Григорович,1949.0,Миколаїв,режисер,"(21. 05. 1949, Миколаїв) – режисер, актор. Чоловік Н. Ігнатьєвої. Заслужений діяч мистецтв України (1997). Орден «За заслуги» 3-го (2009), 2-го (2018) ступ. Закін. актор. (1971; викл. М. Карасьов) і режисер. (1977; викл...."
7376,Ігнатьєв Сергій  Петрович,1964.0,Київ,живописець,"(05. 04. 1964, Київ) – живописець. Син П. Ігнатьєва. Член НСХУ (1999). Закін. Київ. ПТУ (1984), Вище монум.-художнє училище у Вільнюсі (1989). На творчій роботі. Основна галузь – монум. і станк. живопис. Створює..."
7377,Ігнатьєв Юрій  Борисович,1954.0,"м. Росток, Німеччина",графік,"(17. 06. 1954, м. Росток, Німеччина) – графік, живописець. Член НСХУ (1992). Навч. у Київ. політех. інституті (1974–76), малювати – у Ю. Силантьєва. Працював на Київ. комбінаті монум.-декор. мистецтва..."
7378,Ігнатьєва Олена  Володимирівна,1960.0,Кіровоград,музикознавець,"(03. 01. 1960, Кіровоград) – музикознавець, педагог. Член НСКУ (1992). Дипломантка низки міжнар. музикознав. конкурсів. Закін. Одес. консерваторію (1985; кл. С. Мірошниченко). Працювала викл. Кіровогр...."
7379,Ігнатьєва Тетяна  Андріївна,1953.0,"м. Сталіно, нині Донецьк",художниця декоративно-ужиткового мистецтва,"(17. 09. 1953, м. Сталіно, нині Донецьк) – художниця декоративно-ужиткового мистецтва, модельєр. Член Спілки дизайнерів України (2004). Лауреатка міжнар. конкурсу «Дизайн–21» (Париж, 1995). Закін. Моск...."
7380,Ігнатюк Олена  Олександрівна,1962.0,"с. Осовці Дрогичин. р-ну Брест. обл., Білорусь",поетеса,"(23. 02. 1962, с. Осовці Дрогичин. р-ну Брест. обл., Білорусь) – поетеса, літературознавець, культуролог. Дружина О. Ільїна. Член Спілки білорус. письменників (2002). Кандидат філологічних наук (1999)...."
7385,Ієвлєва Наталія  Тихонівна,1947.0,Сімферополь,художниця кіно,"(02. 07. 1947, Сімферополь) – художниця кіно. Член НСХУ (1980–2001), НСКінУ (1980). Закін. Одес. художнє училище (1967), ВДІК (Москва, 1974; викл. Й. Шпінель). Відтоді працювала художником-постановником Одес...."
7386,Іжевський Артур  Валентинович,1972.0,Львів,графік,"(23. 01. 1972, Львів) – графік, живописець, мистецтвознавець. Канд. мистецтвознавства (2009). Закін. Укр. академію друкарства у Львові (2004; викл. М. Дзядик, В. Стасенко). Працює у Львові: 2002–05 –..."
7389,Іздрик Юрій  Романович,1962.0,м. Калуш Івано-Фр. обл.,письменник,"(16. 08. 1962, м. Калуш Івано-Фр. обл.) – письменник, культуролог. Національна премія України імені Т. Шевченка (2025). Закін. Львів. політех. інститут (1984). Працював на виробництві, 1986–89 – у..."
7390,Ізетов Енвер  Сейтхалілович,1955.0,"м. Ферґана, Узбекистан",графік,"(17. 01. 1955, м. Ферґана, Узбекистан) – графік, живописець, дизайнер, художник анімаційного кіно. Заслужений діяч мистецтв АР Крим (2009). Член НСХУ (1990), СХ Узбекистану (1992–95). Закін. Ферґан. училище..."
7392,Ізотова Любов  Андріївна,1946.0,"м. Чарджоу, нині Туркменабад, Туркменістан",співачка (колоратурне сопрано),"(25. 01. 1946, м. Чарджоу, нині Туркменабад, Туркменістан) – співачка (колоратурне сопрано), педагог. Народний артист України (2006). 2-а премія Міжрегіон. конкурсу вокалістів (Львів, 1982). Закін. Харків...."
7393,Ікаєва Олена Леонідівна,1961.0,Київ,віолончелістка,"(03. 07. 1961, Київ) — віолончелістка. Заслужена артистка України (2018). Лауреатка Республіканського конкурсу віолончелістів імені М. Лисенка (1982). Закінчила Київську консерваторію (1984). Відтоді..."
7399,Іллєнко Михайло Герасимович,1947.0,Москва,кінорежисер,"(29. 06. 1947, Москва) – кінорежисер, педагог. Брат Вадима та Юрія Іллєнків. Акад. НАМУ (2017), доцент (2005). Заслужений діяч мистецтв України (2003). Державна премія України ім. О. Довженка (2007). Орден «За..."
7401,Іллінський Андрій Олексійович,1949.0,Київ,графік і художник декоративної кераміки,"(24. 08. 1949, Київ) – графік і художник декоративної кераміки. Син В. Іллінської та О. Тереножкіна. Член НСХУ (1987). Закін. Моск. полігр. інститут (1976; викл. П. Захаров). Від 1973 – учасник всеукр.,..."
7404,Іллічов Олександр Миколайович,1951.0,Харків,скульптор,"(24. 03. 1951, Харків) – скульптор. Член НСХУ (1995). Закін. Харків. худож.-пром. інститут (1981; викл. В. Воловик, Б. Корольков). Учасник всеукр. мистецьких виставок від 1979. На творчій роботі. Від 1992 –..."
7405,Іллічова Олена Миколаївна,1958.0,м. Ізмаїл Одес. обл.,живописець,"(14. 09. 1958, м. Ізмаїл Одес. обл.) – живописець. Член НСХУ (2000). Закін. Одес. пед. інститут (1986; викл. З. Борисюк). Працювала на Одес. худож. комбінаті (1985–89). На творчій роботі. Учасниця мистецьких..."
7408,Ілляхова Тетяна Петрівна,1954.0,м. Новоград-Волинський Житомирської обл.,художниця декоративно-ужиткового мистецтва,"(08. 11. 1954, м. Новоград-Волинський Житомирської обл.) – художниця декоративно-ужиткового мистецтва, живописець. Член НСХУ (2005). Закінчила Київський художній інститут (1979; викл. П. Басанець, І...."
7411,Ілляшенко В’ячеслав Валентинович,1959.0,Київ,графік,"(05. 06. 1959, Київ) – графік, живописець. Член НСХУ (1989–2003). У Львові закін. Укр. полігр. інститут (1982), навч. у приват. майстерні Г. Левицької. Відтоді працював у Києві: у видавництві «Політвидав..."
7413,Ілляшенко Михайло Васильович,1951.0,"с. Чехівка Чорнобаїв. р-ну, нині Черкас. обл.",режисер,"(01. 01. 1951, с. Чехівка Чорнобаїв. р-ну, нині Черкас. обл.) – режисер. Брат В. Ілляшенка. Заслужений діяч мистецтв УРСР (1990). Закін. Київ. інститут культури (1972; викл. Б. Мешкіс, В. Ткаченко), інститут..."
7415,Ільїн Анатолій Миколайович,1948.0,Запоріжжя,піаніст,"(20. 06. 1948, Запоріжжя) – піаніст, педагог. Заслужений діяч мистецтв України (2019). Доц. (1996). Закін. Київську консерваторію (нині Нац. муз. академія України; 1974; викл. С. Скринченко, О. Іноземцев, Я...."
7420,Ільїн Сергій Олександрович,1953.0,"м. Сталіно, нині Донецьк",архітектор,"(17. 10. 1953, м. Сталіно, нині Донецьк) – архітектор. Заслужений архітектор України (2006). Член-кореспондент Укр. академії архітектури (2005). Державна премія України в галузі архітектури (2003, 2009)...."
7423,Ільїнська Людмила Василівна,1953.0,м. Цюрупинськ Херсон. обл.,художниця декоративно-ужиткового мистецтва,"(31. 05. 1953, м. Цюрупинськ Херсон. обл.) – художниця декоративно-ужиткового мистецтва. Член НСХУ (1988). Закін. Крим. художнє училище (Сімферополь, 1972; викл. О. Іванченко, В. Хараборіна). Працювала..."
7424,Ільїнська Ніна Іллівна,1951.0,"м. Новочеркаськ Ростов. обл., РФ",літературознавець,"(21. 07. 1951, м. Новочеркаськ Ростов. обл., РФ) – літературознавець. Канд. пед. (1990), д-р філол. (2007) н., професор (2008). Закін. Адигей. пед. інститут (м. Майкоп Краснодар. краю, РФ, 1972). Учителювала, водночас..."
7429,Ілько Іван Іванович,1938.0,"с. Дулове, округ Тячево, Чехо-Словаччина, нині Тячів. р-ну Закарп. обл.",живописець і монументаліст,"(04. 03. 1938, с. Дулове, округ Тячево, Чехо-Словаччина, нині Тячів. р-ну Закарп. обл.) – живописець і монументаліст. Народний художник України (2018). Член НСХУ (1968). Закін. Ужгород. училище приклад...."
7432,Ільницька Олена Володимирівна,1977.0,Тернопіль,композитор,"(11. 02. 1977, Тернопіль) – композитор, педагог. Член НСКУ (2005). Закін. Нац. муз. академію України (Київ, 2001; кл. І. Карабиця) та асистентуру-стажування при ній (2004; кер. М. Скорик). Від 2001 – викладач Дит...."
7433,Ільницька Ольга Сергіївна,1951.0,смт Тарутине Одес. обл.,письменниця,"(31. 07. 1951, смт Тарутине Одес. обл.) – письменниця. Член СП Москви (2000), Рос. ПЕН-центру (2007). Закін. істор. факультет Одес. університету (1974), Моск. істор.-архів. інститут (1986). Учителювала. Працювала в..."
7434,Ільницький Микола  Миколайович,1934.0,"с. Ільник, нині Турків. р-ну Львів. обл.",літературознавець,"(23. 09. 1934, с. Ільник, нині Турків. р-ну Львів. обл.) – літературознавець, історик літератури, поет, перекладач. Чоловік Л. Ільницької, батько М. Комариці та Я. Ільницького. Доктор філологічних..."
7435,Ільницький Олег-Степан Романович,1949.0,"м. Фюрт, Німеччина",літературознавець,"(02. 02. 1949, м. Фюрт, Німеччина) – літературознавець. Чоловік Н. Пилип’юк, син Романа та Ніни Ільницьких. Закін. коледж при Нью-Йорк. університеті (1971), Гарвард. університет (м. Кембридж, шт...."
7441,Ільченко Олесь,1957.0,Київ,письменник,"(Олександр Григорович; 04. 10. 1957, Київ) – письменник, сценарист. Член НСПУ (1995), АУП (1996). Закін. природн. факультет Київ. пед. інституту (1980), Літ. інститут у Москві (1990). Працював наук. ред...."
7442,Ільченко Петро Іванович,1954.0,с. Кислиці Ізмаїл. р-ну Одес. обл.,режисер,"(23. 02. 1954, с. Кислиці Ізмаїл. р-ну Одес. обл.) – режисер, педагог. Заслужений діяч мистецтв України (2004). Премія ім. Лесі Українки (2009). Закін. актор. студію при Київ. театрі оперети (1976; викл. В...."
