id,name,birth_year,birth_city,profession,bio_text
11541,Луків Микола Володимирович,1949.0,с. Куманівці Хмільниц. р-ну Вінн. обл.,поет,"(06. 01. 1949, с. Куманівці Хмільниц. р-ну Вінн. обл.) – поет. Член НСПУ (1975). Заслужений діяч мистецтв України (1997). Літ. премії ім. М. Ос­тровського (1986), Міжнар. пре­мія ім. Г. Сковороди (1993), Всеукр...."
11543,Лукін Борис Миколайович,1958.0,"м. Свердловськ, нині Єкатеринбург, РФ",живописець,"(31. 10. 1958, м. Свердловськ, нині Єкатеринбург, РФ) – живописець, графік. Член НСХУ (1987). Закін. Одес. пед. інститут (1986; викл. В. Гегамян, О. Недошитко). Працює в Одесі: на худож.-оформлюв. комбінаті..."
11546,Лукінюк Михайло  Васильович,1950.0,с. Черепківці Глибоц. р-ну Чернів. обл.,письменник,"(17. 02. 1950, с. Черепківці Глибоц. р-ну Чернів. обл.) – письменник, публіцист. Член НСПУ (2012). Закін. Київ. політех. інститут (1980), де й працює від 1983 на каф. автоматизації хім. вироб-в (нині Нац. тех...."
11552,Луковська Ольга Ігорівна,1974.0,Львів,мистецтвознавець,"(20. 01. 1974, Львів) – мистецтвознавець, художниця декоративного текстилю. Канд. мистецтвознавства (2008). Член НСХУ (2010). Закін. Укр. академію друкарства (Львів, 2000). Від 1998 – у Львів. палаці мистецтв:..."
11558,Луніна Ганна Євгенівна,1977.0,Миколаїв,музикознавець,"(21. 03. 1977, Миколаїв) – музикознавець, му­зичний критик. Дружина В. Матюхіна. Канд. мистецтвознавства (2009). Премія ім. М. Лисенка (2014). Член НСКУ (2010). Закін. Нац. муз. академію України (2002; кл. О...."
11559,Лунченко Євген  Миколайович,1974.0,Київ,актор,"(07. 10. 1974, Київ) – актор. Заслужений артист України (2009). Закін. Київ. училище естрадно-цирк. мистецтва (1995; викл. Д. Бабаєв-Кальницький, О. Заболотний). Від 1996 грає у Нац. театрі рос. драми ім. Лесі..."
11561,Луньов Євген Анатолійович,1961.0,"Дніпропетровськ, нині Дніпро",графік,"(19. 07. 1961, Дніпропетровськ, нині Дніпро) – графік, живописець. Член НСХУ (1989). Закін. Харків. худож.-пром. інститут (1987; викл. С. Бесєдін, В. Шевченко). Відтоді працював на За­поріз. худож.-вироб...."
11562,Луньов Олег  Володимирович,1973.0,Київ,живописець,"(17. 03. 1973, Київ) – живописець, художник театру. Онук Г. Бойка. Член НСХУ (2000). Навч. приватно у В. Зарецького (1987–89), закін. Укр. АМ (Київ, 1997; викл. О. Бурлін, Д. Лідер). Від 1993 – у Київ. театрі драми і..."
11563,Луньов Святослав  Ігорович,1964.0,Київ,композитор,"(19. 04. 1964, Київ) – композитор, педагог. Член НСКУ (1994). Лауреат Все­укр. конкурсу студентів-композиторів ім. С. Рахманінова (Київ, 1992, 1-а премія). Премії ім. Л. Ре­вуцького (1997), ім. Б. Лятошин­ського..."
11565,Луньова Тетяна Володимирівна,1976.0,Київ,письменниця,"(06. 04. 1976, Київ) – письменниця, видавець. Кандидат філологічних наук (2006). Член НСПУ (2015). Закін. Полтав. пед. інститут (1998), де й працювала від 2003 (нині університет): від 2005 – завідувач кафедри..."
11566,Лупалов В’ячеслав Іванович,1946.0,"смт Мала Виска, нині місто Кіровогр. обл.",співак (баритон),"(25. 09. 1946, смт Мала Виска, нині місто Кіровогр. обл.) – співак (баритон). Народний артист України (1993). Навч. приватно у А. Козачука (Мос­ква, 1966–68). У 1970–72 пра­цював у Чол. хор. капелі ім. Л...."
11569,Лупанов Валерій  Степанович,1942.0,Полтава,хоровий диригент,"(18. 04. 1942, Полтава) – хоровий диригент. Заслужений діяч мистецтв УРСР (1988). Закін. Київську консерваторію (1964; викл. Г. Верьовка), Харків. інститут мистецтв (1972; кл. А. Мі­рош­никової). 1964–73 та від..."
11570,Лупащенко Ірина Володимирівна,1971.0,"м. Сквира, нині Білоцерківського р-ну Київської обл.",художник-сценограф,"(20. 08. 1971, м. Сквира, нині Білоцерківського р-ну Київської обл.) — художник-сценограф, живописець. Членкиня НСТДУ (1999). Закінчила Київський інститут декоративно-прикладного мистецтва і дизайну..."
11572,Лупій Світлана  Петрівна,1944.0,"м. Проскурів, нині Хмельницький",мистецтвознавець,"(26. 10. 1944, м. Проскурів, нині Хмельницький) – мистецтвознавець. Мати Т. Лупій. Канд. мистецтвознавства (1993), професор (2006). Закін. Київський художній інститут (1968). Відтоді працює у Львові: ст. н. с...."
11573,Лупій Тетяна  Григорівна,1966.0,Львів,мистецтвознавець,"(09. 12. 1966, Львів) – мистецтвознавець. Дочка С. Лупій. Канд. мистецтво­знавства (2002). Член НСХУ (2004). Закін. Львів. інститут прикладного та декоративного мистецтва (1991). Працює у Львові: від 1994 – у..."
11574,Лупій Ярослав  Васильович,1946.0,с. Нова Кам’янка Жовків. р-ну Львів. обл.,кінорежисер,"(02. 06. 1946, с. Нова Кам’янка Жовків. р-ну Львів. обл.) – кінорежисер, сценарист. Брат О. Лупія. Народний артист України (2004). Член НСКінУ (1977). Орден ""За заслуги"" 3-го ступеня (2019). Закін. Київ. інститут..."
11575,Лупій Ярослав Олександрович,1961.0,Київ,живописець,"(20. 02. 1961, Київ) – живописець, графік. Член НСХУ (1992). Закін. Львів. інститут прикладного та декоративного мистецтва (1986; викл. І. На­битович). На творчій роботі. Основні галузі – станк. живопис і..."
11579,Лупул Омелян Володимирович,1950.0,"с. Раранча, нині Рідківці Новоселиц. р-ну Чернів. обл.",поет-байкар,"(01. 08. 1950, с. Раранча, нині Рідківці Новоселиц. р-ну Чернів. обл.) – поет-байкар, лірик. Дипломант 24-го (1996) і 30-го (2002) міжнар. поет. конкурсів у Мілані. Закін. Чернів. університет (1974). Учителював у..."
11586,Луц Віктор  Данилович,1955.0,"м. Станіслав, нині Івано-Франківськ",мистецтвознавець,"(30. 12. 1955, м. Станіслав, нині Івано-Франківськ) – мистецтвознавець, ди­зайнер. Член НСХУ (2000). Закін. Київський університет (1983). Від 1980 – у складі експедицій зі збирання та дослідж. пам’яток..."
11587,Луцак Володимир Павлович,1928.0,"с. Заїзд Прилуц. р-ну, нині Черніг. обл.",скульптор і педагог,"(01. 11. 1928, с. Заїзд Прилуц. р-ну, нині Черніг. обл.) – скульптор і педагог. Член НСХУ (1967). Закін. Київський художній інститут (1956; майстер­ня М. Лисенка). Відтоді – викладач Респ. худож. школи ім. Т...."
11588,Луцак Світлана Миколаївна,1976.0,Івано-Франківськ,літературознавець,"(25. 01. 1976, Івано-Франківськ) – літературознавець. Доктор філологічних наук (2011), професор (2013). Закін. При­карп. університет (Івано-Франківськ, 1998), де й працює від 2001: від 2011 – професор кафедри..."
11589,Луценко Ігор  Вікторович,1970.0,с. Ділове Рахів. р-ну Закарп. обл.,живописець,"(08. 01. 1970, с. Ділове Рахів. р-ну Закарп. обл.) – живописець. Член НСХУ (2010). Лауреат обл. премії у галузі образотвор. мистецтва ім. Й. Бокшая та А. Ерделі (2017). Закін. Львів. АМ (1998; викл. О. Мінько, Т...."
11590,Луценко Микола Григорович,1945.0,"с. Данилівка Целіногр. обл., Казахстан",архітектор,"(17. 08. 1945, с. Данилівка Целіногр. обл., Казахстан) – архітектор. Державна премія України імені Тараса Шевченка (1983). Закін. Новосибір. буд. інститут (РФ, 1968). У 1968–70 – гол. архітектор м. Великий..."
11591,Луценко Наталія  Олександрівна,1949.0,"м. Бутурлиновка Воронез. обл., РФ",живописець,"(04. 05. 1949, м. Бутурлиновка Воронез. обл., РФ) – живописець, графік. Дружина В. Луценка. Член НСХУ (1989). Закін. Бутурлинов. пед. училище (1970). Працювала у Запоріз. архіт.-проект. інституті..."
11594,Луценко Зінаїда Валентинівна,1974.0,"смт Цибулів Монастирищенського, нині Уманського р-ну Черкаської обл.",прозаїк,"(16. 01. 1974, смт Цибулів Монастирищенського, нині Уманського р-ну Черкаської обл.) — прозаїк, педагог. Членкиня НСПУ (2020). Премія імені В. Кобилянського, лауреатка конкурсу «Коронація слова — 2012»...."
11597,Луценко Валерій  Степанович,1959.0,м. Умань Черкас. обл.,живописець,"(21. 03. 1959, м. Умань Черкас. обл.) – живописець. Член київ. мист. асоц. «Золота палітра» (2008) і Спілки художників книги (2008). Лауреат конкурсу «Художник та друкарство України» (Київ, 2008). Закін...."
11598,Луценко Віталій  Опанасович,1921.0,"с. Лучин, нині Попільнян. р-ну Житомир. обл.",живописець,"(14. 11. 1921, с. Лучин, нині Попільнян. р-ну Житомир. обл. – ?) – живописець. Закін. Київський художній інститут (1953; майстерня О. Шовкуненка). На творчій роботі. Учасник всеукр. мистецьких виставок..."
11603,Луценко Іван  Малахович,1886.0,"станиця Старокорсунська, нині Краснодар. краю, РФ",письменник,"(1886, станиця Старокорсунська, нині Краснодар. краю, РФ – ?) – письменник. Народився у сім’ї козака-хлібороба. Після закінчення двоклас. станич. школи витримав екстернат на право викладання...."
11604,Луцик Володимир  Васильович,1968.0,м. Золочів Львів. обл.,живописець,"(05. 01. 1968, м. Золочів Львів. обл.) – живописець. Член НСХУ (1995), Спілки укр. художників «Обе­ріг» (Рим). Закін. Львів. інститут прикладного та декоративного мистецтва (1991; викл. Р. Василик, О...."
11605,Луцик Марія  Миколаївна,1985.0,Київ,художниця декоративно-ужиткового та монументального мистецтва,"(14. 12. 1985, Київ) – художниця декоративно-ужиткового та монументального мистецтва. Член НСХУ (2013). Закін. Київ. інститут декор.-приклад. мистецтва і дизайну (2009; викл. Т. Ільїна, М. Данченко, Н...."
11607,Луцишина Оксана Петрівна,1974.0,Ужгород,письменниця,"(10. 10. 1974, Ужгород) – письменниця. Член НСПУ (2000). Премія Міжнар. кон­курсу молодих літераторів «Гра­нослов» (1996), літ. премії «Благовіст» НСПУ (1998), ім. Б.-І. Антонича «Привітання життя» (2000)...."
11609,Луців Юрій Олексійович,1931.0,Львів,диригент,"(12. 05. 1931, Львів) – диригент, педагог. Професор (1989). Народний артист УРСР (1990). Державна премія України ім. Т. Шев­ченка (1971). Орден «За заслуги» 3-го ступеня (2016). Лауреат Респ. огля­ду молодих..."
11610,Луцкевич Неоніла  Григорівна,1928.0,"с. Буша Чернів. р-ну, нині Вінн. обл.",мистецтвознавець,"(28. 08. 1928, с. Буша Чернів. р-ну, нині Вінн. обл.) – мистецтвознавець. Закін. Одес. художнє училище (1952; викл. М. Павлюк), Інститут живопису, скульптури та архітектури у Ленінграді (нині С.-Петербург,..."
11611,Луцкевич Олександр  Юрійович,1960.0,Київ,живописець,"(03. 10. 1960, Київ) – живописець. Син З. Лерман та Ю. Луцкевича. Член НСХУ (1989). Закін. Київський художній інститут (1985; викл. В. Виродова-Готьє, О. Лопухов, М. Стороженко). На поч. 1990-х рр. стажувався в..."
11615,Луцький Роман Михайлович,1986.0,"с. Боднарів Галицького, нині Калуського р-ну Івано-Франківської обл.",актор,"(20. 03. 1986, с. Боднарів Галицького, нині Калуського р-ну Івано-Франківської обл.) — актор. Заслужений артист України (2018). Державна премія України ім. О. Довженка (2025). Орден «За заслуги» 3-го..."
11616,Луцюк Віктор Володимирович,1958.0,смт Іваничі Волин. обл.,співак (лірико-драматичний тенор),"(04. 06. 1958, смт Іваничі Волин. обл.) – співак (лірико-драматичний тенор). Заслужений артист України (1993). Закін. Харків. інститут мистецтв (1987; кл. Т. Веске). Відтоді до 1995 – соліст Дніпроп. театру..."
11617,Луцюк Ганна Ярославівна,1989.0,с. Баїв Луцького р-ну Волин. обл.,поетеса,"(24. 05. 1989, с. Баїв Луцького р-ну Волин. обл.) – поетеса. Член НСПУ (2013). Переможець обл. літ. конкурсу «Неповторність» (2011). Закін. Луцький пед. коледж (2008). Працює у книгарні «Є» (Луцьк)...."
11619,Лучаковська-Армстронґ Роксолана,1938.0,"м. Ста­ніслав, нині Івано-Франківськ",живописець і графік,"(06. 07. 1938, м. Ста­ніслав, нині Івано-Франківськ) – живописець і графік. Дочка Б.-М. Лу­чаковського. Родина емі­грувала 1945 через переслідування рад. владою. Від 1951 – у м. Філадельфія (шт...."
11622,Лучинський Остап  Петрович,1941.0,с. Чижиків Пустомитів. р-ну Львів. обл.,художник декоративного мистецтва,"(01. 02. 1941, с. Чижиків Пустомитів. р-ну Львів. обл.) – художник декоративного мистецтва. Член Спілки дизайнерів України (1985). Закін. Львів. інститут прикладного та декоративного мистецтва (1973;..."
11625,Лучко Валер’ян Олексійович,1940.0,Київ,художник монумен­тального мистецтва,"(07. 12. 1940, Київ) – художник монумен­тального мистецтва. Член НСХУ (1983). Закін. Київ. худож.-ремісн. училище (1959; викл. І. Гайовий, В. Саратовський). На творчій роботі; гол. художник комбінату..."
11627,Лучко Федір  Тихонович,1908.0,"с. Талалаївка, нині Ніжин. р-ну Черніг. обл.",художник театру,"(14. 04. 1908, с. Талалаївка, нині Ніжин. р-ну Черніг. обл. – ?) – художник театру. Навч. у Київ. худож. (1932), Моск. театр. (1934) інститутах. Працював від 1929 на Макіїв. металург. заводі (нині Донец. обл.). Від..."
11629,Лучук Іван Володимирович,1965.0,Львів,поет,"(24. 02. 1965, Львів) – поет, перекладач і літературознавець. Син В. Лучука та О. Сенатович. Член НТШ у Львові (1989), АУП (1997). Доктор філологічних наук (2013). Закін. Львівський університет (1986). Працював у..."
11633,Лущевська Оксана Василівна,1982.0,м. Тальне Черкас. обл.,письменниця,"(17. 02. 1982, м. Тальне Черкас. обл.) – письменниця, перекладачка, літературознавець. Онука Ф. Мицика. Лауреатка літ. конкурсів «Гранослов» (2007) і видавництва «Смолоскип» (2009), 2-го Всеукр. конкурсу..."
11634,Лущій Світлана Іванівна,1973.0,"с. Лозовий Яр Яготинського, нині Бориспільського р-ну Київської обл.",літературознавець,"(06. 12. 1973, с. Лозовий Яр Яготинського, нині Бориспільського р-ну Київської обл.) — літературознавець. Доктор філологічних наук (2019). Закінчила Ніжинський педагогічний інститут (Чернігівська..."
11635,Львов Георгій  Степанович,1941.0,"м. Брянка Ворошиловградської, нині Луганської обл.",живописець,"(19. 11. 1941, м. Брянка Ворошиловградської, нині Луганської обл.) – живописець, художник-монументаліст. Чоловік З. Дев’ятак, батько У. Льво­вої. Член НСХУ (1977). Закінчив Московський текстильний..."
11639,Львович Олександр  Борисович,1956.0,Ужгород,художник декоративної кераміки,"(30. 09. 1956, Ужгород) – художник декоративної кераміки. Член СХ СРСР (1989), СХУ (1991), СХ Казахстану (1995). Закін. Львів. інститут прикладного та декоративного мистецтва (1983; викл. Е. Мисько). На творчій..."
11643,Люба Ольга Юріївна,1968.0,Київ,графік,"(23. 08. 1968, Київ) – графік. Дружина В. Любого. Член НСХУ (1994). Закін. Респ. художню середню школу ім. Т. Шевченка (1986; викл. Є. Звєздов), навч. в Укр. АМ (1990–92; обидві – Київ). На творчій роботі. Учасниця..."
11644,Любавін Ігор Юрійович,1957.0,Харків,графік,"(30. 04. 1957, Харків) – графік. Син Ю. Любавіна. Член НСХУ (1986). Закін. Харків. худож.-пром. інститут (1981; майстерня В. Ненадо). На творчій роботі. Учасник респ., всесоюз., міжнар. мистецьких виставок від..."
11647,Любанський Володимир Сергійович,1937.0,"с. Телепине Ка­м’ян. р-ну, нині Черкас. обл.",режисер,"(27. 07. 1937, с. Телепине Ка­м’ян. р-ну, нині Черкас. обл.) – режисер, артист розмовного жанру. Заслужений артист УРСР (1991). Закін. Київ. інститут театр. мистецтва (1970). Від 1963 (з перервою) працював..."
11649,Любарська Леся Михайлівна,1964.0,м. Борщів Терноп. обл.,поетеса,"(13. 06. 1964, м. Борщів Терноп. обл.) – поетеса, громадсько-культурна діячка. Член НСЖУ (2006), НСПУ (2010). Лауреатка Літ. конкурсу ім. М. Утриска (Львівщина, 2008, 2010), Всеукр. конкурсу «Барви життя» (Київ,..."
11650,Любарський Роман Рафаїлович,1957.0,"Кіровоград, нині Кропивницький",поет,"(26. 12. 1957, Кіровоград, нині Кропивницький) – поет, публіцист. Член Спілки російськомов. письменників Ізраїлю (2003), Конгресу літераторів України (2010–13), НСЖУ (1991). Закін. Кіровогр. пед. інститут..."
11652,Любий Володимир Корнійович,1963.0,Хмельницький,графік,"(18. 05. 1963, Хмельницький) – графік. Чоловік О. Любої. Член НСХУ (1992). Закін. архіт. факультет Київ. ху­дож. інституту (1987; викл. А. Добровольський), асистентуру-стажування у Нац. академії образотвор...."
11661,Любиченко Наталія Василівна,1959.0,м. Обухів Київ. обл.,письменниця,"(04. 06. 1959, м. Обухів Київ. обл.) – письменниця. Член НСПУ (2005). Закін. Уман. пед. училище (Черкас. обл., 1982). Відтоді працювала у дитсадку «Пролісок» (Обухів). Авторка кн. для дітей «Перші проліски»..."
