id,name,birth_year,birth_city,profession,bio_text
3342,Вітер Василь  Петрович,1951.0,с. Великополовецьке Сквир. р-ну Київ. обл.,кінорежисер,"(16. 06. 1951, с. Великополовецьке Сквир. р-ну Київ. обл.) – кінорежисер. Член НСКінУ (1989). Закін. актор. (1972; майстерня М. Верхацького) та режисер. (1981; майстерня В. Кісіна) факультети Київ. інституту..."
3344,Вітковська Наталія  Львівна,1959.0,Київ,живописець,"(22. 02. 1959, Київ) – живописець. Дочка Л. Вітковського, онука М. Рокицького. Член НСХУ (1988). Закін. Київський художній інститут (1983; викл. М. Стороженко, В. Чеканюк). Від 1984 – викладач у Держ. худож...."
3345,Вітковський Вадим Миколайович,1960.0,"с. Борівка Чернівецького, нині Могилів-Подільського р-ну Вінницької обл.",прозаїк,"(08. 03. 1960, с. Борівка Чернівецького, нині Могилів-Подільського р-ну Вінницької обл.) — прозаїк, публіцист. Член НСПУ (2012). Премії імені М. Трублаїні (1982), імені М. Стельмаха (2013), М. Коцюбинського..."
3346,Вітковський В’ячеслав Владикович,1957.0,Київ,балетмейстер,"(25. 03. 1957, Київ) – балетмейстер, педагог. Заслужений артист України (2008). Лауреат 1-го Всеукр. конкурсу балетмейстерів-постановників (Донецьк, 1987). Закін. хореогр. студію при Держ. ансамблі танцю..."
3347,Вітковський Віталій  Вікторович,1926.0,Харків,диригент,"(15. 03.  1926, Харків) – диригент. Заслужений діяч мистецтв України (1995). Учасник 2-ї світової війни, бойові нагороди. Закін. Київську консерваторію (1958; викл. М. Корнештейн). У 1958–81 – диригент..."
3349,Вітовський Олександр  Ідельович,1939.0,"м. Артемівськ, нині Донец. обл.",піаніст,"(04. 12. 1939, м. Артемівськ, нині Донец. обл.) – піаніст, педагог. Доц. (1986). Закін. Київську консерваторію (1964; кл. Є. Слівака, В. Топіліна), де й викладав 1966–67. Від 1967 – у Донец. муз.-пед. інституті (нині..."
3355,Вітте Наталія  Миколаївна,1933.0,Київ,піаністка,"(27. 07.  1933, Київ) – піаністка, педагог. Доц. (1989). Дипломантка Всеукр. конкурсу піаністів (Київ, 1957). Закін. Київську консерваторію (1957; кл. А. Янкевича-Янкелевича), де відтоді й викладає: від 1996 –..."
3356,Вітушинський Віктор Антонович,1951.0,"смт Ключі, нині Камчатського краю, РФ",актор,"(02. 05. 1951, смт Ключі, нині Камчатського краю, РФ) — актор. Заслужений артист України (2014). Закінчив драматичну студію при Київському українському драматичному театрі імені І. Франка (1973;..."
3359,Віхерко Анатолій  Павлович,1937.0,Київ,співак (бас),"(29. 09. 1937, Київ) – співак (бас). Заслужений артист України (1999). Закін. Київське музичне училище ім. Р. Ґлієра (1964; викл. О. Гродзинський). Від 1958 – арт. хору Нац. опери України. У репертуарі –..."
3361,Віценя Лідія  Миколаївна,1954.0,с. Дібрівка Миргород. р-ну Полтав. обл.,письменниця і журналістка,"(09. 11. 1954, с. Дібрівка Миргород. р-ну Полтав. обл.) – письменниця і журналістка. Член НСЖУ (1980), НСПУ (2000). Премія ім. П. Загребельного (2000). Закін. Київський університет (1977). Відтоді – завідувач..."
3363,Віцо Федір,1944.0,"с. Шапинець, округ Свидник, нині Сло-ваччина",український графік і громадський діяч у Словаччині,"(09. 11. 1944, с. Шапинець, округ Свидник, нині Сло-ваччина) – український графік і громадський діяч у Словаччині. Син Ф. Віца. Член СХ Словаччини (1969). Закін. Художню пром. школу у Братиславі (1962)...."
3365,Вішленков Микола  Петрович,1949.0,м. Жмеринка Вінн. обл.,хоровий диригент,"(23. 05.  1949, м. Жмеринка Вінн. обл.) – хоровий диригент, педагог. Закін. Харків. інститут мистецтв (1972; викл. З. Яковлєва). 1972–73 – соліст та хормейстер Ансамблю пісні і танцю Червонопрапор...."
3366,Вішован Владислав  Васильович,1955.0,м. Рахів Закарпатської обл.,живописець,"(25. 03. 1955, м. Рахів Закарпатської обл.) – живописець, графік і скульптор. Член НАН України (1993). Закінчив Прикарпатський університет (Івано-Франківськ, 1996; викладач М. Фіґоль). 1977–89 – оформлювач;..."
3370,Владимиров Олексій  Павлович,1957.0,"с-ще Прирєченськ Краснодар. краю, РФ",скульптор,"(22. 03. 1957, с-ще Прирєченськ Краснодар. краю, РФ) – скульптор. Член НСХУ (1987). Закін. Київський художній інститут (1984; викл. В. Бородай, І. Макогон). Учасник мистецьких виставок від 1985. Персон. – у..."
3381,Власенко Микола  Захарович,1943.0,с. Наморівка Черніг. р-ну Черніг. обл.,дизайнер і живописець,"(06. 03. 1943, с. Наморівка Черніг. р-ну Черніг. обл.) – дизайнер і живописець. Член НСХУ (2000). Закін. Київ. худож.-пром. технікум (1970; викл. В. Головко). Від 1976 оформляв експозиції музеїв; 1978–2000 –..."
3382,Власенко Олександр  Михайлович,1954.0,"радгосп «Степовий», Казахстан",живописець,"(14. 09. 1954, радгосп «Степовий», Казахстан) – живописець. Член НСХУ (1989). Закін. Харків. худож.-пром. інститут (1979; Н. Вергун, А. Константинопольський). Учасник всеукр., всесоюз., зарубіж. мистецьких..."
3387,Власов Микола  Олексійович,1978.0,Київ,графік і живописець,"(23. 12. 1978, Київ) – графік і живописець. Син О. Власова та М. Яценко, онук В. Яценка та М. Крижанівської. Член НСХУ (2005). Закін. Нац. академію образотвор. мистецтва і архітектури (2002; викл. М...."
3388,Власов Олександр  Володимирович,1964.0,Одеса,живописець,"(20. 01. 1964, Одеса) – живописець. Син В. Власова. Член НСХУ (1993). Закін. Одес. художнє училище (1983; викл. Н. Мартинюк). Серед робіт – «Повернення» (1985), «Тиша» (1987), «Похмурий день», «Вихід до моря»..."
3391,Власюк Валерій Володимирович,1963.0,"с. Теліженці Ізяславського, нині Шепетівського р-ну Хмельницької обл.",поет,"(21. 06. 1963, с. Теліженці Ізяславського, нині Шепетівського р-ну Хмельницької обл.) — поет. Член НСПУ (2023). Премія імені В. Симоненка (2021). Закінчив Київський університет імені Т. Шевченка (1986)...."
3393,Влененко Тетяна  Вікторівна,1959.0,Київ,писанкарка,"(03. 07. 1959, Київ) – писанкарка. Член НСМНМУ (2000). Закін. Київ. інститут нар. господарства (1980). Учасниця регіон. та всеукр. мистецьких виставок від 1999. Серед робіт – колекції писанок «Трипілля»,..."
3396,Влодавська Ірина  Олександрівна,1928.0,Харків,літературознавець,"(23. 03. 1928, Харків) – літературознавець. Доктор філологічних наук (1986), професор (1989). Закін. Київський університет (1950). Відтоді працювала у Донец. пед. інституті (від 1965 – університет): від 1960 –..."
3400,Воблий Борис,1883.0,с. Великі Бучки Костянтиноградського пов. Полтав. губ.,перекладач,"(02. 08. 1883, с. Великі Бучки Костянтиноградського пов. Полтав. губ. – ?, Вашинґтон) – перекладач, японознавець, громадський діяч на Далекому Сході. Закін. Полтав. духовну семінарію (1904). Був..."
3405,Вовк Іван,1921.0,"с. Кривчунка, нині Жашків. р-ну Черкас. обл.",композитор,"(25. 09. 1921, с. Кривчунка, нині Жашків. р-ну Черкас. обл.) – композитор, педагог. Навч. в Одес. консерваторії (1935–40; кл. флейти Л. Рогового, композиції – С. Орфеєва), у Школі С. Франка (Париж, 1945–53). У..."
3406,Вовк Іван  Євгенович,1948.0,с. Лани Пустомитів. р-ну Львів. обл.,актор,"(10. 10. 1948, с. Лани Пустомитів. р-ну Львів. обл.) – актор, тележурналіст. Заслужений діяч мистецтв України (2003). Закін. Київ. інститут театр. мистецтва (1975; викл. А. Скибенко). 1975– 79 – актор Ансамблю..."
3407,Вовк Ірина  Валентинівна,1963.0,"м. Ялта, нині АР Крим",поетеса,"(04. 09. 1963, м. Ялта, нині АР Крим) – поетеса, драматург, театральний критик. Член НСПУ (1994). Закін. Львівський університет (1986). Працювала н. с. у Львів. музеї історії релігії (від 1987) та в Інституті..."
3410,Вовк Сергій Олександрович,1958.0,Київ,живописець,"(11. 08. 1958, Київ) – живописець. Син О. Вовка та Н. Сиротенко, онук О. Сиротенка. Член НСХУ (1989). Закін. Київський художній інститут (1982; майстерня В. Пузиркова). Учасник мистецьких виставок від 1983...."
3414,Вовкун Василь  Володимирович,1957.0,"с. Мацошин Нестерів., нині Жовків. р-ну Львів. обл.",актор,"(16. 06. 1957, с. Мацошин Нестерів., нині Жовків. р-ну Львів. обл.) – актор, режисер-постановник, сценарист. Чоловік Л. Вовкун. Народний артист України (2007). Заслужений діяч мистецтв..."
3416,Вовчок Василь  Іванович,1959.0,с. Нижній Бистрий Хуст. р-ну Закарп. обл.,живописець,"(29. 04. 1959, с. Нижній Бистрий Хуст. р-ну Закарп. обл.) – живописець. Заслужений художник України (2021).  Лауреат міжнародної премії «Карпатська корона» (2003), обл. премії у галузі образотвор...."
3418,Вовчук Святослав  Михайлович,1955.0,"м. Тлумач Станіслав., нині Івано-Фр. обл.",художник декоративно-ужиткового мистецтва,"(16. 07. 1955, м. Тлумач Станіслав., нині Івано-Фр. обл.) – художник декоративно-ужиткового мистецтва, дизайнер. Член НСХУ (2002), Спілки дизайнерів України (2005). Закін. Харків. худож.-пром. інститут (1984;..."
3420,Водичев Андрій Володимирович,1965.0,"м. Керч, нині АР Крим",актор,"(09. 10. 1965, м. Керч, нині АР Крим) – актор, педагог. Національна премія України імені Т. Шевченка (2006). Закін. філол. факультет Харків. університету (1988), театр. студію при Львів. молодіж. театрі..."
3424,Воєвода Євгенія Юріївна,1977.0,Київ,дизайнер,"(09. 08. 1977, Київ) – дизайнер. Дочка Ю. Воєводи та Л. Даценко. 2-а премія Всеукр. виставки «Життя шрифту» (Київ, 2003). Член НСХУ (2005). Закін. Нац. академію образотвор. мистецтва та архітектури (Київ, 2001;..."
3425,Воєвода Юрій Петрович,1944.0,"м. Паризька Комуна Ворошиловгр. обл., нині м. Алчевськ Луган. обл.",графік і живописець,"(22. 06. 1944, м. Паризька Комуна Ворошиловгр. обл., нині м. Алчевськ Луган. обл.) – графік і живописець. Чоловік Л. Даценко, батько Є. Воєводи. Член НСХУ (1977). Закін. Київський художній інститут (1972;..."
3426,Воєдило Лев Леонідович,1962.0,с. Бихольцохівка Ріпкин. р-ну Черніг. обл.,живописець,"(18. 02. 1962, с. Бихольцохівка Ріпкин. р-ну Черніг. обл.) – живописець. Член НСХУ (1989). Закін. Київський художній інститут (1987; майстерня В. Забашти, О. Лопухова). Учителював. Від 2000 – старший викладач..."
3427,Возіянов Микола Кирилович,1937.0,"с. Байрак, нині у складі м. Горлівка Донец. обл.",письменник,"(19. 01. 1937, с. Байрак, нині у складі м. Горлівка Донец. обл.) – письменник. Член НСПУ (1999). Літ. премії ім. Олександра Олеся (2001), Л. Глібова та Остапа Вишні (обидві – 2003). Лауреат Всеукр. конкурсу..."
3428,Возіянов Олександр Сергійович,1940.0,"ст. Возжаївка Амур. обл., РФ",графік,"(21. 05. 1940, ст. Возжаївка Амур. обл., РФ) – графік. Чоловік І. Возіянової. Член НСХУ (1974). Закін. Київський художній інститут (1972; викл. В. Касіян, Л. Чичкан). Працював у естамп. цеху Київ. комбінату..."
3429,Возіянов Олексiй Олександрович,1973.0,Київ,художник-монументалiст,"(02. 08. 1973, Київ) – художник-монументалiст. Син Олександра та Ірини, чоловік Оксани Возіянових. Член НСХУ (2008). Закін. Нац. академiю образотвор. мистецтва і архітектури (Київ, 2000; майстерня М...."
3430,Возіянова Ірина Василівна,1948.0,Київ,мистецтвознавець,"(01. 06. 1948, Київ) – мистецтвознавець. Дружина О. Возіянова. Член НСХУ (1984). Закін. Київський художній інститут (1972; викл. П. Білецький, Л. Владич). Відтоді працює в НХМ: ст. н. с. відділу мистецтва 20–..."
3431,Возіянова Оксана Петрiвна,1974.0,Київ,художник-монументалiст,"(14. 08. 1974, Київ) – художник-монументалiст. Дружина О. Возіянова. Член НСХУ (2008). Закін. Академію образотвор. мистецтва i архітектури (1998; майстерня М. Стороженка). Від 2001 – на твор. роботi. Учасниця..."
3433,Вознюк Борис  Леонідович,1943.0,"Уфа, Башкортостан, РФ",актор,"(14. 06. 1943, Уфа, Башкортостан, РФ) – актор, педагог. Народний артист України (1999). Закін. студію при Київ. драм. театрі ім. І. Франка (1963; викл. В. Оглоблин), Держ. інститут театр. мистецтва (Москва, 1968;..."
3434,Вознюк Василь Васильович,1958.0,"м. Каркші Кашкадар’їн. обл., Узбекистан",художник-карикатурист,"(03.  07.  1958, м. Каркші Кашкадар’їн. обл., Узбекистан) – художник-карикатурист, графік. Член Асоц. карикатуристів (2003). Освіта середня. Від 1976 – у Житомирі. Працював на заводі «Електровимірювач»..."
3435,Вознюк Володимир Оксентійович,1950.0,с. Киселиці Путил. р-ну Чернів. обл.,поет,"(01. 01. 1950, с. Киселиці Путил. р-ну Чернів. обл.) – поет, літературознавець. Член НСПУ (1990). Обл. літ. премії ім. С. Воробкевича (1997) та Д. Загула (2000). Закін. Чернів. університет (1972). Відтоді працює у..."
3438,Войнарович (Лимич) Анна  Андріївна,1954.0,м. Здолбунів Рівненської обл.,поетеса,"(Лимич; 23. 11. 1954, м. Здолбунів Рівненської обл.) – поетеса. Член НСПУ (1996). Премії 

імені Вал. Поліщука (2007), 

імені Уласа Самчука (2023). Закінчила Рівненський..."
3439,Войнаровська Людмила  Іванівна,1957.0,Сімферополь,співачка (сопрано),"(24. 06. 1957, Сімферополь) – співачка (сопрано), педагог. Заслужений артист України (1998). Закін. Київську консерваторію (1983; кл. Л. Лобанової). 1986–89 – викладач Київ. пед. інституту; від 1990 – Нац. муз...."
3443,Войтенко Валентин Андрійович,1949.0,смт Червоноармійськ Житомир. обл.,графік,"(24. 01. 1949, смт Червоноармійськ Житомир. обл.) – графік. Заслужений художник України (2020). Член НСХУ (1992). Закін. Львів. інститут прикладного та декоративного мистецтва (1978; викл. Д. Довбошинський)...."
3446,Войтех Клавдія  Арсеніївна,1932.0,Київ,музикознавець,"(13. 10.  1932, Київ) – музикознавець, педагог. Сестра О. Войтеха. Закін. Київську консерваторію (1956; кл. Ф. Аерової, А. Герман). Відтоді працювала викл. муз. факультету Київ. пед. інституту; від 1957 –..."
3448,Войтко Олександр Петрович,1972.0,Вінниця,композитор,"(22. 02. 1972, Вінниця) – композитор, співак. У 10-річ. віці втратив зір. Лауреат фестивалю «Червона рута» (Донецьк, 1993). Закін. Курське муз. училище (РФ, 1992). Відтоді – керівник вокал.-інструм. ансамблю..."
3449,Войтович Валерій Миколайович,1952.0,"хутір Радочі, поблизу с. Вичівка Висоцького, нині Вараського р-ну Рівненської об",мистецтвознавець,"(08. 05. 1952, хутір Радочі, поблизу с. Вичівка Висоцького, нині Вараського р-ну Рівненської обл.) — мистецтвознавець, письменник, живописець, графік. Член НСЖУ (2007), НСХУ (2017). Закінчив Рівненський..."
3453,Войцехівський Станіслав  Іванович,1939.0,"с. Чепиліївка Узин., нині Білоцерків. р-ну Київ. обл.",художник-монументаліст,"(13. 03. 1939, с. Чепиліївка Узин., нині Білоцерків. р-ну Київ. обл.) – художник-монументаліст, графік. Член НСХУ (1985). Закін. Укр. полігр. інститут у Львові (1961; викл. М. Іванов, В. Касіян). У 1970– 90 –..."
3454,Войцеховська Наталія Феодосіївна,1927.0,"с. Гнилякове Біляїв. р-ну, нині Одес. обл.",співачка (мецо-сопрано),"(07. 09. 1927, с. Гнилякове Біляїв. р-ну, нині Одес. обл.) – співачка (мецо-сопрано), педагог. Професор (1993). Заслужений діяч мистецтв України (1994). Закін. Одес. консерваторію (1954; кл. І. Райченко). 1954–56 –..."
3455,Волга Микола Семенович,1939.0,"с. Черкаське Біловод. р-ну Ворошиловгр., нині Луган. обл.",архітектор,"(27. 04. 1939, с. Черкаське Біловод. р-ну Ворошиловгр., нині Луган. обл.) – архітектор. Народний майстер декоративно-ужиткового мистецтва УРСР (1975). Заслужений діяч мистецтв України (2009)...."
3458,Волик Олег Володимирович,1958.0,с. Левенцівка Новомоск. р-ну Дніпроп. обл.,прозаїк,"(05. 10. 1958, с. Левенцівка Новомоск. р-ну Дніпроп. обл.) – прозаїк. Член НСПУ (1999). Закін. Дніпроп. мед. інститут (1982). Працював лікарем-терапевтом: у Дніпродзержин. лікарні (Дніпроп. обл.); 1986–89 – на..."
3459,Волик Павло Іванович,1941.0,"с. Котельва, нині смт Котелев. р-ну Полтав. обл.",скульптор і живописець,"(21. 03. 1941, с. Котельва, нині смт Котелев. р-ну Полтав. обл.) – скульптор і живописець. Народний художник України (2016). Всеукр. премія ім. І. Огієнка (2001). Член НСХУ (1977). Закін. Львів. інститут..."
3462,Волинець Олексій Андрійович,1935.0,"с. Світязь, нині Шацького р-ну Волин. обл.",хоровий диригент,"(07. 01. 1935, с. Світязь, нині Шацького р-ну Волин. обл.) – хоровий диригент, педагог. Заслужений артист УРСР (1974). Закін. Львів. консерваторію (1963; кл. М. Антківа). 1962–70 та від 1995 – викладач, 1991–95 –..."
