id,name,birth_year,birth_city,profession,bio_text
12051,Маменко Ростислав Петрович,1936.0,"м. Дніпродзержинськ, нині Кам’янське Дніпроп. обл.",поет,"(17. 08. 1936, м. Дніпродзержинськ, нині Кам’янське Дніпроп. обл.) – поет. Член НСПУ (2004). Закін. Дніпроп. мед. інститут (нині Дніпро, 1959). Відтоді працював лікарем у Дніпропетровську. Від 1994 – на..."
12052,Маменко Павло Павлович,1950.0,"Дніпропетровськ, нині Дніпро",фотохудожник,"(11. 12. 1950, Дніпропетровськ, нині Дніпро) — фотохудожник, журналіст, педагог. Член НСЖУ (2014). Кандидат технічних наук (1999). Літературно-мистецька премія імені В. Підмогильного (2010). Закінчив..."
12056,Мамонов Сергій Олексійович,1949.0,Запоріжжя,композитор,"(05. 04. 1949, Запоріжжя) – композитор, педагог. Професор (1994). Заслужений діяч мистецтв УРСР (1986). Член НСКУ (1975). Лауреат Всеукр. (Київ; Донецьк, 1985, 2-а премія) та обл. (Донецьк, 1987, 1-а премія) конкурсів..."
12058,Мамонтов Анатолій Іванович,1935.0,Київ,художник кіно,"(05. 12. 1935, Київ) – художник кіно. Заслужений діяч мистецтв України (1988). Член НСКінУ (1960-і рр.), НСХУ (1967). Закін. худож. факультет ВДІКу (Москва, 1961; викл. М. Богданов, Ф. Богородський, Ю. Пименов). Як..."
12061,Мамсиков Максим Владиславович,1968.0,Київ,живописець,"(21. 08. 1968, Київ) – живописець, скульп­­тор, фотограф. Син І. Герасимової та В. Мамсикова. Член НСХУ (1995). Закін. Укр. АМ (Київ, 1994), навч. у Мюнхен. АМ (1999). На творчій роботі. Учасник мистецьких..."
12062,Мамушев Ігор Іванович,1956.0,"м. Во­­рошиловград, нині Луганськ",піаніст,"(01. 12. 1956, м. Во­­рошиловград, нині Луганськ) – піаніст, композитор, поет. Заслужений артист України (2015). Закін. Київську консерваторію (1981; кл. Т. Кравченко, А. Рощиної), де відтоді й працював...."
12064,Мамченко Олег Миколайович,1941.0,м. Синельникове Дніпроп. обл.,диригент,"(30. 07. 1941, м. Синельникове Дніпроп. обл.) – диригент, педагог. Чоловік А. Мамченко. Доц. (2004). Заслужений діяч мистецтв України (2004). Закін. Харків. інститут культури (1973; кл. Ю. Бриліанта), Львів...."
12066,Мамчич Олеся Олександрівна,1981.0,Київ,поетеса,"(28. 01. 1981, Київ) – поетеса. Член НСПУ (2001). Лауреатка фестивалів «Таланти твої, Україно» (1992), «Молоде вино» (2001), премій «Культреванш» (2004), «Благовіст» (2006), переможниця конкурсу..."
12067,Мамчур Степан Олексійович,1949.0,с. Немирівка Радивилів. р-ну Рівнен. обл.,живописець,"(08. 01. 1949, с. Немирівка Радивилів. р-ну Рівнен. обл.) – живописець. Член НСХУ (1992). Закін. Львів. інститут прикладного та декоративного мистецтва (1977; викл. М. Вендзилович, Д. Крвавич, М...."
12069,Мамчур Світлана  Анатоліївна,1967.0,Львів,співачка (драматичне сопрано),"(17. 10. 1967, Львів) – співачка (драматичне сопрано). Народний артист України (2018). Закін. Львів. консерваторію (1992; кл. М. Байко). Дебютувала 1990 на сцені Львів. опери партією Оксани в опері..."
12072,Манайло-Приходько Вікторія Іванівна,1964.0,Ужгород,живописець,"(03. 10. 1964, Ужгород) – живописець. Дочка Івана, онука Федора Манайлів, дружина В. Приходька. Член Спілки дизайнерів України (2014), НСХУ (2017). Закін. істор. факультет Ужгород. університету (1985),..."
12075,Манасян Людмила Арташесівна,1954.0,Баку,співачка (лірико-колоратурне сопрано),"(24. 11. 1954, Баку) – співачка (лірико-колоратурне сопрано), педагог. Заслужений артист України (1999). Лауреатка міжнар. конкурсу «Золо­­ті трембіти» (Київ, 1996). Закін. Азерб. консерваторію (Баку, 1984)...."
12085,Мандрика Леся Василівна,1962.0,Львів,художниця декоративного скла,"(14. 08. 1962, Львів) – художниця декоративного скла, графік. Член НСХУ (1994). Закін. Львів. інститут прикладного та декоративного мистецтва (1987; викл. Д. Дов­­бошинський, О. Звір, Е. Мисько)...."
12087,Мандрика Наталія Степанівна,1962.0,Львів,скрипалька,"(31. 01. 1962, Львів) – скрипалька, педагог. Народний артист України (2017). Обл. літ.-мист. премія ім. В. Стефаника (1999). Закін. Львів. консерваторію (1985; кл. О. Вайсфельда). Відтоді – концертмейстер та..."
12088,Мандрикова Лариса Олександрівна,1953.0,Миколаїв,живописець,"(27. 04. 1953, Миколаїв) – живописець, графік. Дочка Н. Мандрикової-Дончик. Член НСХУ (1987). Закін. худож.-графіч. факультет Одес. пед. інституту (1974; викл. О. Письмиченко). Відтоді – викладач..."
12090,Мандрикова-Онищенко Марина Олександрівна,1976.0,Сімферополь,графік,"(16. 06. 1976, Сімферополь) – графік. Член НСХУ (2012). Закін. Харків. академію дизайну та мистецтв (2001; викл. Є. Жердзицький, В. Чаус). На творчій роботі. Учасниця міських, всеукр. мистецьких виставок..."
12093,Манелюк Елла Валеріївна,1972.0,"м. Перевальськ Ворошиловградської обл., нині Алчевського р-ну Луганської обл.",хореограф,"(24. 04. 1972, м. Перевальськ Ворошиловградської обл., нині Алчевського р-ну Луганської обл.) — хореограф, педагог. Доцент (2023). Заслужена діячка мистецтв України (2021). Закінчила Рівненський..."
12097,Маник Віталій Юрійович,1963.0,Івано-Франківськ,композитор,"(25. 11. 1963, Івано-Франківськ) – композитор, педагог. Член НСКУ (1994). Лауреат Міжнар. конкурсу композиторів ім. М. та І. Коців (Київ, 1994). Закін. Львів. консерваторію (1990; кл. В. Камінського, А...."
12100,Манів Галина Миколаївна,1965.0,Кишинів,письменниця,"(13. 03. 1965, Кишинів) – письменниця, перекладачка. Член НСПУ (2001). Закін. Київський університет (2008). Працює літ. редактором. Поезія М. присвяч. християн. тематиці, роздумам над буттям людини у цьому..."
12103,Манін Валерій Михайлович,1942.0,"с. Дангара, Таджикистан",живописець,"(31. 08. 1942, с. Дангара, Таджикистан) – живописець, графік. Член НСХУ (1976), СХ РФ (2004). Закін. Сталінабад. художнє училище (нині Душанбе, 1961; викл. О. Безперстов, З. Хабібулаєв). Працював від 1964..."
12104,Манойленко Юлія Анатоліївна,1979.0,с. Ждани Лубен. р-ну Полтав. обл.,поетеса,"(28. 03. 1979, с. Ждани Лубен. р-ну Полтав. обл.) – поетеса. Член НСПУ (2009). Літ. премії ім. В. Симоненка (2003), ім. Олександра Олеся (2005), ім. І. Котляревського (2013). Закін. Полтав. пед. університет (2006). Працює..."
12105,Манойло Анатолій Федорович,1937.0,с. Дмухайлівка Магдалинів. р-ну Дніпроп. обл.,актор,"(26. 09. 1937, с. Дмухайлівка Магдалинів. р-ну Дніпроп. обл.) – актор. Народний артист України (1996). Закін. Харків. театр. інститут (1959; викл. Р. Черкашин, Д. Антонович). 1959–2016 – арт. Херсон. муз.-драм...."
12107,Манолов Василь Дмитрович,1944.0,Харків,співак (бас),"(25. 12. 1944, Харків) – співак (бас). Заслужений артист УРСР (1986). Закін. Харків. інститут мистецтв (1977; кл. В. Монахова). 1974–80 – соліст Харків. ім. М. Лисенка, 1980–91 – Київ. ім. Т. Шевченка театрів опери..."
12108,Манохін Анатолій Борисович,1952.0,"м. Черняховськ Калінінгр. обл., РФ",живописець,"(19. 08. 1952, м. Черняховськ Калінінгр. обл., РФ) – живописець. Член НСХУ (1991). Закін. Харків. худож.-пром. інститут (1983; викл. В. Побєдін, С. Рибін, В. Чаус). Співзасн. твор. групи «Маріуполь–87», розробив..."
12109,Манський Віталій Всеволодович,1963.0,Львів,режисер,"(02. 12. 1963, Львів) – режисер, сценарист, продюсер. Закін. операт. факультет ВДІКу (Мос­ква; 1990, майстерня С. Мединського). Відтоді працював у Москві. Автор програм «Сімейні хроніки» (1995–97) і..."
12111,Мануляк Михайло Григорович,1940.0,Львів,композитор,"(30. 12. 1940, Львів) – композитор, аранжувальник. Батько О. Мануляка. Від 1954 відвідував муз. студію, де опановував гру на акордеоні, згодом – на домбрі, гітарі та контрабасі. 1957–59 працював у..."
12112,Мануляк Остап Михайлович,1983.0,Львів,композитор,"(01. 05. 1983, Львів) – композитор, педагог. Син М. Мануляка. Канд. мистецтвознавства (2009). Член НСКУ (2007). Премія ім. Л. Ревуцького (2010). Закін. Львів. муз. академію (2005; кл. В. Камінського, М...."
12117,Маньков Володимир Андрійович,1946.0,"м. Слов’янськ Сталін., нині Донец. обл.",графік,"(31. 07. 1946, м. Слов’янськ Сталін., нині Донец. обл.) – графік. Член НСХУ (1995). Закін. Київ. полігр. факультет Укр. полігр. інституту у Львові (1975). Працював у Худож. фонді України (1969–90-і рр.). Голова..."
12118,Манькова Оксана Олегівна,1977.0,Миколаїв,графік,"(03. 06. 1977, Миколаїв) – графік. Закін. Київський університет культури і мистецтв (1999). На творчій роботі. Учасниця міських, обл. худож. виставок від 2005. Створює станк. пейзажі, темат. композиції в..."
12119,Манюк Орест Ярославович,1956.0,Львів,живописець,"(16. 06. 1956, Львів) – живописець. Член НСХУ (2008). Заслужений художник України (2016). Закін. Львів. інститут прикладного та декоративного мистецтва (1983; викл. О. Дуфанець, М. Малавсь­кий, Е...."
12122,Маняченко Анатолій Олексійович,1940.0,"м. Звенигородка, нині Черкас. обл.",співак (бас-баритон),"(27. 03. 1940, м. Звенигородка, нині Черкас. обл.) – співак (бас-баритон). Народний артист УРСР (1979). Лауреат конкурсу військ. ансамблів (1967). Закін. Київську консерваторію (1969; кл. І...."
12126,Мар’яхін Олександр Петрович,1951.0,"м. Феодосія, нині АР Крим",живописець,"(09. 02. 1951, м. Феодосія, нині АР Крим) – живописець, графік. Член НСХУ (1986). Закін. Моск. вище худож.-пром. училище (1975; викл. С. Дудник). Працював в Алушті (АР Крим): 1980–83 – керівник філії Крим...."
12129,Марандюк Михайло Назарович,1949.0,м. Новоселиця Чернів. обл.,шаховий композитор,"(17. 01. 1949, м. Новоселиця Чернів. обл.) – шаховий композитор. Майстер спорту СРСР (1978), гросмейстер України (1997), заслужений майстер спорту України (2005), міжнар. майстер (1989), міжнар. гросмейстер..."
12130,Маргаріус Леонід Наумович,1951.0,м. Конотоп Сум. обл.,піаніст,"(18. 02. 1951, м. Конотоп Сум. обл.) – піаніст, педагог. Заслужений працівник культури України (1993). Закін. Харків. інститут мистецтв (1972; кл. Р. Горовиць) та аспірантуру Моск. консерваторії (1983; кл. Г...."
12134,Марголіна Діна Марківна,1965.0,Київ,скульпторка,"(02. 07. 1965, Київ) – скульпторка. Член НСХУ (1994). Премія ім. М. Лисенка «Скульптор року» НСХУ (2013). Закін. Укр. АМ (Київ, 1994; майстерня В. Бородая). На творчій роботі. Учасниця худож. виставок від 1990...."
12137,Мардань Олександр Євгенович,1956.0,"м. Владивосток, РФ",драматург,"(02. 04. 1956, м. Владивосток, РФ) – драматург, сценарист, письменник. Заслужений діяч мистецтв України (2015). Член НСПУ (2006). Літ. премії ім. М. Гоголя (2010), ім. В. Даля (2014), ім. К. Паустовського (2015). Закін...."
12139,Мардус Оксана Григорівна,1971.0,смт Нова Водолага Харків. обл.,письменниця,"(24. 05. 1971, смт Нова Водолага Харків. обл.) – письменниця. Член НСПУ (1997). Лауреатка літ. конкурсів «Грано­слов» (1995), «Смолоскип» (2001), премій ім. Г. Квітки-Основ’я­­нен­­ка (2004), ім. Олександра..."
12159,Маричевська Алла Володимирівна,1963.0,с. Здовбиця Здолбунів. р-ну Рівнен. обл.,культурна діячка,"(16. 04. 1963, с. Здовбиця Здолбунів. р-ну Рівнен. обл.) – культурна діячка, видавець. Дружина М. Маричевського. Член НСХУ (2008). Закін. Київський університет (1985). Відп. секр. Нац. музею Т. Шевченка у..."
12161,Марищенко Ярослав Семенович,1950.0,"смт Червоне, нині с-ще Бердичівського р-ну Житомирської обл.",письменник,"(03. 11. 1950, смт Червоне, нині с-ще Бердичівського р-ну Житомирської обл.) — письменник. Член НСПУ (2021). Лауреат фестивалю «Розстріляна молодість» (2013; 1-е м. у номінації «Урок прози», 2014), премій..."
12162,Марищук-Кендел Ольга,1928.0,"м. Ґрінвіч, шт. Коннектикут, США",графік,"(21. 07. 1928, м. Ґрінвіч, шт. Коннектикут, США) – графік. Член НСХУ (1990). Навч. в Інституті Пратта у Нью-Йорку (1960-і рр.), Київ. худож. інституті (1971–73; викл. В. Баринова-Кулеба, В. Касіян, В...."
12163,Маріно Ольга Вікторівна,1955.0,м. Мукачеве Закарп. обл.,художниця декоративного текстилю,"(24. 03. 1955, м. Мукачеве Закарп. обл.) – художниця декоративного текстилю. Заслужений діяч мистецтв України (2007). Член Спілки дизайнерів України (1996, 2005–11 – заступник голови; 2006–13 – голова Київ...."
12168,Маркевич-Дунін Казімєж-Юзеф,1874.0,"с. Денгофівка Таращан. пов. Київ. губ., нині Денихівка Тетіїв. р-ну Київ. обл.– ",живописець,"(15. 03. 1874, с. Денгофівка Таращан. пов. Київ. губ., нині Денихівка Тетіїв. р-ну Київ. обл.– 02. 12. 1932, Варшава) – живописець, художник театру, драматург, режисер. З походження поляк. Дитинство провів у..."
12170,Марків Тереза,1957.0,"м. Монреаль, провінція Квебек, Канада",живописець,"(29. 05. 1957, м. Монреаль, провінція Квебек, Канада) – живописець, графік. З походження українка. Закін. Університет Конкордії (Монреаль, 1979), вивчала мистецтво у приват. школах. Працювала 10 р. у..."
12171,Марків Богдан,1928.0,"м. Ольштин, нині Вармін.-Мазур. воєводства, Польща",скрипаль,"(07. 10. 1928, м. Ольштин, нині Вармін.-Мазур. воєводства, Польща) – скрипаль, диригент, педагог. Батько В.-Р. Марківа. Навч. у Терноп. муз. школі (1942–44). У 1944 разом з батьками емігрував до Німеччини,..."
12172,Марків Віктор-Радослав,1968.0,"м. Гартфорд, шт. Коннектикут, США",піаніст,"(30. 03. 1968, м. Гартфорд, шт. Коннектикут, США) – піаніст, педагог. Син Б. Марківа. З походження українець. 1992 здобув ступ. бакалавра в Університеті Гартфорда, 1996 – магістра мистецтв в..."
12173,Маркін Микола Антонович,1888.0,,живописець,"(1888 – ?) – живописець. Закін. живописне відділ. Одес. худож. училища (1910). Від 1914 викладав малювання і краснопис у навч. закладах Григоріополя, Тирасполя (нині Молдова). Експонував роботи на..."
12176,Маркман Петро Федорович,1946.0,Київ,архітектор,"(20. 09. 1946, Київ) – архітектор, дизайнер. Віце-президент НСАУ (від 2011). Державна премія України у галузі архітектури (2008; за арх-ру центру сімей. дозвілля «Дивосвіт» у Києві). Закін. Київ. інж.-буд...."
12177,Марко Ірина Валеріївна,1967.0,Запоріжжя,художниця декоративно-ужиткового мистецтва,"(28. 02. 1967, Запоріжжя) – художниця декоративно-ужиткового мистецтва. 3-я премія 3-ї Національної виставки-конкурсу художньої кераміки (Опішня, 2011). Член НСХУ (2012). Закінчила відділ художньої..."
12180,Марков Леонід Семенович,1883.0,,живописець,"(15(27). 04. 1883, м. Маріуполь, нині Донец. обл. – ?) – живописець, графік. Закін. гімназію в Маріуполі (1907), вступив 1908 на юрид. факультет С.-Пе­­тербур. університету, 1909 перевівся в Новорос...."
12181,Марков Сергій Михайлович,1959.0,"с. Вавож, Удмуртія, РФ",графік,"(07. 11. 1959, с. Вавож, Удмуртія, РФ) – графік, живописець. Член НСХУ (2003). Закін. Харків. худож.-пром. інститут (1985; викл. Ю. Вінтаєв, В. Даниленко). На творчій роботі. Учасник міських, обл., всеукр...."
12183,Маркова Олена Миколаївна,1944.0,Одеса,музикознавець,"(13. 03. 1944, Одеса) – музикознавець, педагог. Доктор мистецтвознавства (1990), професор (1992). Член НСКУ (1992). Закін. Одес. консерваторію (1968; кл. С. Орфеєва) та аспірантуру при Київ. консерваторії (1983;..."
12185,Маркова-Іваник Валентина Миколаївна,1950.0,Львів,естрадна співачка,"(28. 07. 1950, Львів) – естрадна співачка. Лауреатка конкурсу естрад. пісні «Молоді голоси України» (Київ, 1984). Закін. Львів. культ.-осв. училище (1971; кл. хор. диригування). 1969 працювала в оркестрі..."
12187,Маркович Марія Йосипівна,1963.0,Тернопіль,мистецтвознавець,"(03. 05. 1963, Тернопіль) – мистецтвознавець. Канд. мистецтвознавства (2006). Член Спілки дизайнерів України (2002). Закін. факультет архітектури Львів. політех. інституту (1985). Відтоді працює у..."
12191,Маркович Костянтин Петрович,1968.0,Львів,живописець,"(20. 09. 1968, Львів) – живописець, графік. Онук Димитрія (В. Яреми). Член НСХУ (1999). Заслужений художник України (2016). Закін. Львів. інститут прикладного та декоративного мистецтва (1993; викл. С...."
12193,Марковський Ігор Віталійович,1945.0,Київ,графік,"(11. 08. 1945, Київ) – графік. Член НСХУ (1983–2002). Закін. Київ. полігр. факультет Укр. полігр. інституту у Львові (1982; викл. Б. Валуєнко, Ф. Глущук). Працював у Києві: оформлювач Рекламно-вироб...."
