id,migration_status,migration_reasoning
4789,non_migrated,Born Vinnytsia oblast; studied Lviv Institute of Applied and Decorative Arts; works as decorative glass artist in Ukraine.
4790,non_migrated,Born Ivano-Frankivsk oblast; studied in Ivano-Frankivsk and Lviv institutions; works as art historian and ceramic artist in Ukraine.
4791,migrated,Born Kyiv 1977; won 1st prize Shanghai (2001); studied at Kyiv music school and pursued international career — well-known pianist who settled in UK (Royal College of Music).
4796,non_migrated,Born Poltava; studied Kharkiv Art-Industry Institute (1993); works as painter in Ukraine.
4797,migrated,Born Ternopil 1913; studied Lviv and Warsaw Academy of Arts (1937-39); worked in Lviv and Ternopil until 1944; emigrated; settled in Argentina from 1948.
4800,migrated,Born in Slovakia 1933; Ukrainian opera singer in Slovakia; performed at Ukrainian National Theater in Prešov Slovakia throughout career — settled in Slovakia.
4801,non_migrated,Born Ivano-Frankivsk oblast; studied at Ivano-Frankivsk theater studio (1970); career as director and actor in Ukrainian theaters.
4803,non_migrated,Born Zaporizhzhia oblast; studied Kharkiv Art-Industry Institute; career as painter in Ukrainian institutions.
4804,non_migrated,Born Ivano-Frankivsk oblast; studied Lviv Institute of Applied and Decorative Arts; works as decorative arts artist in Ukraine.
4805,non_migrated,Born Dnipro oblast; studied Dnipro University (1977); teaches and works as writer in Ukraine.
4811,non_migrated,Born Sumy oblast; studied in Ukrainian institutions; works as writer in Ukraine; Honored Worker of Arts Ukraine (2017).
4813,non_migrated,Born Odesa oblast; studied Odesa Art College (1977); works as painter and sculptor in Ukraine.
4814,non_migrated,Born Zhytomyr oblast; studied Kyiv and Tbilisi universities; works as literary scholar and translator in Ukraine.
4815,non_migrated,Born in Poland (Lublin voivodeship); studied Lviv Institute of Applied and Decorative Arts (1968); career as painter in Ukraine.
4816,migrated,Born in Poland (Podkarpacie voivodeship) 1931; Ukrainian literary scholar and teacher in Poland; studied and worked in Poland throughout career.
4817,non_migrated,Born Kyiv oblast; studied Kharkiv Institute of Arts (1997); works as composer in Ukrainian institutions.
4820,non_migrated,Born Kyiv; studied Kyiv Art Institute (1986); works as sculptor in Ukraine.
4821,non_migrated,Born Novograd-Volynsky Zhytomyr oblast; studied Kharkiv Art-Industry Institute (1971); works as monumental-decorative artist in Ukraine.
4823,non_migrated,Born Khmelnytsky oblast; studied Kyiv University (1969); worked in Ukrainian regional press and editorial institutions.
4825,non_migrated,Born Kyiv; studied Kyiv Conservatory (1964); teaches at National Pedagogical University Kyiv from 1992.
4828,non_migrated,Born Astrakhan RF; studied Tbilisi Conservatory (1987); served in Soviet army ensemble (1978-86) then career in Ukrainian opera institutions from 1992.
4833,non_migrated,Born Kyiv; studied in Kyiv; career as tenor and teacher entirely in Ukrainian institutions; National Artist Ukraine (1996); Shevchenko Prize (2001).
4837,non_migrated,Born Voronezh oblast RF; studied Crimean Art College Simferopol (1974); works as painter in Ukrainian institutions.
4838,non_migrated,Born Chernihiv oblast; studied Kyiv Art Institute (1983); works as graphic and painting artist in Ukrainian institutions.
4840,non_migrated,Born Ivano-Frankivsk oblast; studied Leningrad Institute of Painting Sculpture and Architecture (1981); works as painter in Ukraine (married to V. Hrushchenko).
4843,non_migrated,Born Chernihiv oblast; studied Kyiv Conservatory (1966); career as singer in Ukrainian military and theater companies.
4844,non_migrated,Born Khmelnytsky oblast; studied Lviv University (1967); works as writer in Ukrainian institutions.
4845,non_migrated,Born Vinnytsia oblast; studied Ukrainian Polygraphic Institute Lviv (1992); works as painter and graphic artist in Ukraine.
4849,non_migrated,Born Kharkiv; studied Kharkiv Institute of Arts (1985); teaches at Kharkiv institutions from 1987.
4852,non_migrated,Born Kharkiv; won prizes at international competitions (Sophia 1968; Moscow 1969; Poznan 1971); studied in Kharkiv and Moscow; career as violinist in Ukrainian institutions.
4855,non_migrated,Born Dnipropetrovsk; studied Lviv Institute of Applied and Decorative Arts (1978); works as graphic artist in Ukrainian institutions.
4864,migrated,Born Vorohta Ivano-Frankivsk oblast 1941; left Ukraine with parents as child; Canadian prizes (Toronto 1956); Royal music activities — settled in Canada.
