id,migration_status,migration_reasoning
6308,non_migrated,Pianist from Kharkiv; studied at Kharkiv Conservatory and career in Kharkiv music institutions.
6312,migrated,Poet born in Bielsk Podlaski Poland; studied at Lublin University; member of NSPУ (2002) but born and educated in Poland (non-Soviet country).
6313,non_migrated,Art historian from Odesa region; WWII veteran; studied and career in Odesa academic institutions.
6316,non_migrated,Writer from Starobilsk Luhansk; studied at Kharkiv Pedagogical University and career in Ukrainian literary organisations.
6318,non_migrated,Writer and philosopher from Cherkasy region; studied at Kyiv University and career in Ukrainian academic institutions.
6319,non_migrated,Conductor and guitarist from Kyiv; studied at Kyiv institutions and career in Ukrainian musical life.
6320,non_migrated,Painter from Okhtyrka Sumy; career in Ukrainian folk art and cultural organisations.
6321,non_migrated,Writer from Zhytomyr region; career in Ukrainian literary and journalistic organisations.
6322,internal_transfer,Baritone from Poltava; studied at Kharkiv Conservatory; career from 1964 in Kharkiv opera but received Russian national artist title (нар. арт. РФ 2002) indicating prolonged career in Russia.
