id,migration_status,migration_reasoning
8895,non_migrated,Studied at Kyiv Conservatory and works as soprano singer and professor in Ukraine; no evidence of emigration.
8896,non_migrated,Studied at Rivne and Vinnytsia pedagogical institutes and works as writer in Ukraine; no evidence of emigration.
8897,non_migrated,Studied and works as painter in Kyiv; no evidence of emigration.
8903,non_migrated,Studied at Kyiv Conservatory and worked as mezzo-soprano singer in Ukraine; no evidence of emigration.
8904,non_migrated,Studied at Kyiv Engineering-Construction and Art institutes and works as painter in Ukraine; no evidence of emigration.
8905,non_migrated,Born in Russia; studied at Rostov Music College and worked as baritone singer in Ukrainian theaters; no evidence of emigration from Ukraine.
8906,non_migrated,Studies at Lviv and Kyiv academies; works as painter in Poltava region; no evidence of emigration.
8909,non_migrated,Studies at Kyiv Academy of Fine Arts; works as painter in Poltava; no evidence of emigration.
8911,non_migrated,Studied at Kyiv Art Institute and taught there; works as architect in Kyiv; no evidence of emigration.
8912,non_migrated,Born in Russia; studied at Kyiv Art Institute and works as graphic artist in Ukraine; no evidence of emigration from Ukraine.
8913,internal_transfer,Studied at Kharkiv Institute of Arts; worked as violinist at Oryol Philharmonic (RF) from 1972; career included substantial time in Russia.
8914,non_migrated,Studied at Moscow Land Management Institute and worked as architect in Crimea throughout career; no evidence of emigration.
