name,birth_year,death_year,age_at_death,death_cause,migration_status,source,esu_absent,notes
Vasyl Stus,1938,1985,47,Died in Perm-36 corrective labour colony (Soviet political prisoner),non_migrated,SBU archives; Memorial; Nobel Peace Prize nomination records,True,Nobel Peace Prize nominee; most celebrated Ukrainian poet of the 20th century
Mykola Khvylovy,1893,1933,39,Suicide under direct political pressure (arrest of colleague M. Skrypnyk),non_migrated,Ukrainian Literary Encyclopedia; Institut literatury NAN Ukrainy,True,Central figure of the Executed Renaissance; pseudonym of Mykola Fitiliov
Mykola Zerov,1890,1937,47,"Shot at Sandarmokh, November 1937",deported,Sandarmokh martyrology; Memorial database; SBU declassified files,True,"Neoclassicist poet, translator, literary critic; arrested 1935"
Les Kurbas,1887,1937,50,"Shot at Sandarmokh, November 1937",deported,Sandarmokh martyrology; Memorial database; SBU declassified files,True,Founder of modern Ukrainian theatre (Berezil theatre); arrested 1933
Mykola Kulish,1892,1937,47,"Shot at Sandarmokh, November 1937",deported,Sandarmokh martyrology; Memorial database; SBU declassified files,True,Playwright; collaborator of Les Kurbas at Berezil; arrested 1934
Oles Dosvitniy,1891,1934,42,"Shot; NKVD execution, 1934",non_migrated,Rehabilitovani istoriieiu; Ukrainian Literary Encyclopedia,True,Writer and literary organiser; pseudonym of Oleksandr Skrypai
Mykola Boychuk,1882,1937,52,"Shot; Great Terror, 1937",non_migrated,Memorial database; Rehabilitovani istoriieiu; SBU declassified files,True,Founder of Boychukism monumental art movement; arrested 1936
Hnat Mykhailychenko,1892,1919,26,Shot by White Army forces during Civil War,non_migrated,Ukrainian Literary Encyclopedia; historical archives,True,Writer and political activist; killed age 26 during Civil War
